Job-Title,Date-Posted,Date-Scraped,Url,Company,Job-Type,Salary,Location,Description
"Data Analyst / Decision Scientist, Growth",NA,2023-01-30 12:28:49,https://www.google.com/search?q=Machine+Learning+Jobs+Lithuania&ibp=htl;jobs&sa=X&ved=2ahUKEwjCp4PIg_D8AhVKPn0KHYaLCFgQutcGKAF6BAgXEAU#htivrt=jobs&htidocid=pSq_xaWDw9wAAAAAAAAAAA%3D%3D&fpstate=tldetail,Vinted,Full-time,NA,"Vilnius, Vilnius city municipality, Lithuania","Vinted is Europes biggest pre-loved fashion marketplace, with 65+ million members in 16 countries. We want to make second-hand the first choice worldwide.A team of 1,200+ people from Vinteds offices in Vilnius, Berlin, Prague, and Amsterdam develop and support our platform. We share a unique work culture thats based on aiming high, taking ownership, co-creating, caring, and growth.Vinted is committed to building an inclusive workplace where people from all walks of life feel a sense of belonging. We welcome applications from all suitably qualified persons regardless of their race, colour, national origin, citizenship, sex, gender identity, sexual orientation, religion/beliefs, disability or age. We truly believe when we can be fully ourselves, we work better.As our new Decision Scientist in the Data Science & Analytics department (Growth domain), youll help Vinted achieve its mission of making second hand first choice worldwide. By solving complex problems youll improve the... Vinted product and facilitate data driven decision making. Youll be working on complex and strategic projects that will substantially impact the course of the company during this exciting phase of rapid growth. Growth domain at Vinted is focused on expanding our user base by optimising the user funnel, ensuring sellers are as successful as they can be, and taking care of efficient geographical expansion and marketing tools. The focus of this role will be on growing lister engagement.You will be part of a cross-functional product team working alongside Product Owner, Designer and Engineers. You will report to the Manager of Data Science & Analytics, Growth and you will be part of the Vinted Data Science & Analytics Guild with fellow data roles from other domains (i.e. being part of the same guild, you will collaborate and learn alongside other Decision Scientists from other domains).Within Data Science & Analytics (DSA) we have three distinct roles. We believe that each role can make a similarly sized business impact in different ways and therefore our salary ranges are the same for all three roles. To understand your role within DSA context better, here are brief descriptions of each role we have in the department:- Analytics Engineers are responsible for data curation  translating data needs from stakeholders into architecting, building and maintaining efficient & reliable data models and pipelines.- Decision Scientists are responsible for actionable insights, identifying and sizing opportunities, and automated tools that increase the quality of product and business decisions by applying statistical methods and data-driven decision making.- Data Scientists are responsible for identification of algorithmic opportunities, ensuring those opportunities are addressed in an optimal fashion and design, development and maintenance of production-grade statistical and machine learning algorithms.In this position, youll:- Be your teams primary point of contact to provide answers to data-related questions- Ensure these questions are answered in optimal fashion (e.g. in the form of an ad hoc deep-dive, experiment, dashboard, or automatically recurring analysis)- Collaborate with your team and stakeholders to identify strategic opportunities and answer key business questions- Analyse identified opportunities to understand their scope and impact (i.e. size opportunities)- Own the key performance indicators for a team, including selection, tracking, forecasting, and proactively flagging issues- Enable stakeholders to independently leverage data for business insights via self-serving and dashboarding tools (Looker)- Define the requirements for (A/B) testing and analyze the results of (A/B) tests- Help to create a backlog with prioritized hypotheses and analysesAbout you:- 2+ years working experience as a Decision Scientist, Data Analyst, Data Scientist or Business Strategist or in a related position- Highly results-oriented and comfortable with iterative processes- A good communicator who can present complex topics clearly and persuasively to different audiences- Strong analytical, strategic, and business skills- Excellent written and spoken English- Strong interpersonal skills- A degree in statistics, physics, econometrics, economics, business or a similar field- Statistical proficiency (e.g. A/B testing, regression analysis)- Proficient in SQL and experience with dashboarding tools (e.g. Looker, Tableau, etc.)- Programming experience (Python/R/Scala)- Advantage: experience with Machine Learning techniques- Advantage: experience working in a tech company or in a cross-functional product development team- Advantage: 3+ years of working experienceWork perks:- Opportunity to join our share options programme- Learning budget (13.2 % from net yearly salary)- 25 working days of holiday- Remote workout classes- Mental- and emotional-health support from Mindletic- Private health insurance- A canteen that serves homemade food at friendly prices- Monthly team-building events- A personal budget for shopping on Vinted- Work anywhere in the EU for 90 days out of the year- Dog-friendly office- Home office support (IT workstation equipment provided + a personal budget of up to 540  for home workplace furniture)We want people to work from where theyre most comfortable, which is why were using a hybrid workplace model at Vinted for the foreseeable future.Hybrid means that we encourage working from the office on Tuesdays and Wednesdays and the remainder of your time from either home or the office, but its not required. Youre welcome to work from either location all or some of the time, depending on what you think is best and safest for you, and how the Covid-19 situation is developing where you are.The salary range for this position is 2,500-3,000  (gross) per month.If this sounds interesting  you may well be just who we need"
DATA SCIENTIST,2023-01-05,2023-01-30 12:28:49,https://www.google.com/search?q=Machine+Learning+Jobs+Lithuania&ibp=htl;jobs&sa=X&ved=2ahUKEwjCp4PIg_D8AhVKPn0KHYaLCFgQutcGKAF6BAgXEAU#htivrt=jobs&htidocid=ntoubo7jYJoAAAAAAAAAAA%3D%3D&fpstate=tldetail,BARBORA Lietuva,Full-time,NA,"Vilnius, Vilnius city municipality, Lithuania","Are you passionate about data and IT world If yes, then this job might be a perfect opportunity for you to unleash your talent and become a true Barborian!WHAT YOU'LL BE DOING:• Develop ML models for personalization systems.• Monitor the performance of developed models.• Take ownership and write easy-to-understand code.• Communicate insights effectively in both written and visual way.REQUIREMENTS:• A proven track record of statistical modeling in various domains.• Advanced knowledge of Python.• Fluency in SQL.• Understanding of deep learning solutions.• 2+ years of experience in data scientist or relevant role.YOU ARE SOMEONE WHO:• Is proactive and a quick learner with an ambitious and results driven personality.• Has good knowledge of English.• Are curious and eager to learn new things.• Is an excellent communicator with organizational skillsWHAT'S IN IT FOR YOU:• You will accelerate your career by joining the #1 e-commerce grocery company in the Baltics; •... You will enjoy Barbora.lt and partners discounts;• Your choice of a Mac or Windows laptop;• Flexible working hours and a possibility to work remotely;• A high degree of collaboration and autonomy, motivated colleagues and access to cutting-edge technologies;• Fully equipped kitchen with coffee, cold drinks, and snacks;• Monthly LAN parties with pizza, company events and team-buildings!SALARYGross salary range is 2700 - 3500 EUR / month and depends on your experience"
Machine Vision Engineer,2023-01-18,2023-01-30 12:28:49,https://www.google.com/search?q=Machine+Learning+Jobs+Lithuania&ibp=htl;jobs&sa=X&ved=2ahUKEwjCp4PIg_D8AhVKPn0KHYaLCFgQutcGKAF6BAgXEAU#htivrt=jobs&htidocid=kBhsObH_JcUAAAAAAAAAAA%3D%3D&fpstate=tldetail,Alliance for Recruitment,Full-time,NA,"Kaunas, Kaunas City Municipality, Lithuania","Mikron KaunasOUR CLIENT -The Mikron Group enables its customers to increase quality and industrial productivity. The Group has over 100 years of experience, state-of-the-art technologies, and global service. The Mikron Group develops, produces, and markets highly precise, productive, and adaptable automation solutions, machining systems, and cutting tools. Rooted in the Swiss culture of innovation, Mikron is a global partner to companies in the automotive, pharmaceutical, MedTech, consumer goods, writing instruments, and watchmaking industries.Job description:The Machine Vision Engineer working in this position will be responsible for the installation of the equipment, and its testing in the laboratories to determine the process and the quality of the operation. Also, he is responsible for the adaptation of real-mounted camera systems to high-performance devices and the final mechanical alignment of cameras, optics, and lighting.Responsibilities• Carry out evaluations and... tests of feasibility according to customer request;• Configure the system delivered to customer facilities, adjustments of hardware (optics, lights) and software (programming and parametrization);• Test systems to ensure their functionality according to specifications (Factory Acceptance Test);• Correct vision systems according to changed requirements, and environment;• Carry out the documentation for customers related to the vision system;• Ensure activities mentioned above according to project timeline and cost.Requirements• Basic knowledge of at least one object-oriented programming language (Microsoft Visual C#, Microsoft Visual Basic, Python and etc.);• Basic knowledge of automation components (PLC, sensors, etc.);• Good English language skills;• Flexibility and availability for trips to our customers abroad, about 50-70%;• Motivation to work and be a team player;• Attention to detail, diligence, and accuracy;• Initiative, independence, and desire to improve processes.Nice to have• Background and experience in machine vision systems;• Knowledge of Cognex or Keyence products;• Interest in photography, cameras, optics.Benefits• Benefits combined with growth opportunities and open-minded and friendly company culture;• Private medical care insurance;• Opportunity to be part of a very dynamic team in a technology-oriented and progressive working environment"
Data Scientist,2023-01-11,2023-01-30 12:28:50,https://www.google.com/search?q=Machine+Learning+Jobs+Lithuania&ibp=htl;jobs&sa=X&ved=2ahUKEwjCp4PIg_D8AhVKPn0KHYaLCFgQutcGKAF6BAgXEAU#htivrt=jobs&htidocid=vUF1V4QbYpYAAAAAAAAAAA%3D%3D&fpstate=tldetail,Yukon Advanced Optics Worldwide / PULSAR,Full-time,NA,"Vilnius, Vilnius city municipality, Lithuania","Yukon Advanced Optics Worldwide is a globally renowned company, operating in the field of civilian use electro-optical observational devices. Company is widely known under the brands Pulsar and Yukon, market leaders in innovative solutions. We design, develop, produce and fully support thermal imaging devices, digital night vision devices, and daytime optics. Our company uses many modern technologies and directions such as Embedded Linux, FPGA, IoT, digital image processing, neural networks.Available vacancy in R&D department at our Vilnius office:Data ScientistResponsibilities:• Developing, training and benchmarking DNN models for Thermal Imaging• DNN model cloud and on-edge inference implementation• Latest research and trends in imaging applications with Machine Learning• Dataset Lifecycle Management• Collaboration with embedded software development teamRequirements:• Proven experience with custom DNN architectures for Computer Vision task• Experience with data... manipulation, transformation, visualization, and statistics• Working knowledge of common ML frameworks: TensorFlow, TF-Light, PyTorch• Python programming skills (Numpy, Pandas, Scipy, Scikit-learn,etc.)• Willingness to learn and help growing AI/ML expertise within the teamBonus Qualifications:• Experience with classical Computer Vision algorithms and image filtering• DNN model optimization for Embedded Platforms• Familiarity with Data Science tools and other programming languages C/C++/SQL• Russian language skillsWe offer:• Salary from 4000 to 5500  before taxes.• Monthly bonus• According to target indicators upon completion of a year of employment• Training compensation• Opportunities to acquire most up-to-date knowledge to increase your skills and competencies.• Work travel• Friendly international team• Participation in various internal projects• Participation in various social-cultural programs and entertainment events organized by the company.Send your CV to: hryukonww.com Only shortlisted candidates will be contacted about futher procedure of personnel placement.FB: facebook.com/PulsarVisionIG: instagram.com/pulsar.visionYT: youtube.com/pulsarvisionWEB: pulsar-vision.com"
"Decision Scientist / Data Analyst, Transactional Experience",NA,2023-01-30 12:28:50,https://www.google.com/search?q=Machine+Learning+Jobs+Lithuania&ibp=htl;jobs&sa=X&ved=2ahUKEwjCp4PIg_D8AhVKPn0KHYaLCFgQutcGKAF6BAgXEAU#htivrt=jobs&htidocid=NSeVPWL04N0AAAAAAAAAAA%3D%3D&fpstate=tldetail,Vinted,Full-time,NA,"Vilnius, Vilnius city municipality, Lithuania","Vinted is Europes biggest pre-loved fashion marketplace, with 75+ million registered members in 18 countries. We want to make second-hand the first choice worldwide.A team of 1,200+ people from Vinteds offices in Vilnius, Berlin, Prague, and Amsterdam develop and support our platform. We share a unique work culture thats based on aiming high, taking ownership, co-creating, caring, and growth.Vinted is committed to building an inclusive workplace where people from all walks of life feel a sense of belonging. We welcome applications from all suitably qualified persons regardless of their race, colour, national origin, citizenship, sex, gender identity, sexual orientation, religion/beliefs, disability or age. We truly believe when we can be fully ourselves, we work better.Youll become a part of the Transactional Experience domain which is focused on enabling a user through their transactional experience journey. Our domains mission is to set the right promise so members... initiate the transactions and meet that promise by enabling them to succeed in buying and selling. As a product team Decision Scientist you would become a significant part of a cross-functional team and drive quality of business and product decisions by bringing actionable insights from data.Within Data Science & Analytics (DSA) we have three distinct roles. We believe that each role can make a similarly sized business impact in different ways and therefore our salary ranges are the same for all three roles. To understand your role within DSA context better, here are brief descriptions of each role we have in the department:- Analytics Engineers are responsible for data curation  translating data needs from stakeholders into architecting, building and maintaining efficient & reliable data models and pipelines.- Decision Scientists are responsible for actionable insights, identifying and sizing opportunities, and automated tools that increase the quality of product and business decisions by applying statistical methods and data-driven decision making.- Data Scientists are responsible for identification of algorithmic opportunities, ensuring those opportunities are addressed in an optimal fashion and design, development and maintenance of production-grade statistical and machine learning algorithms.In this position, youll:- Collaborate with your team and direct stakeholders to identify strategic opportunities and answer key business questions- Ensure these questions are answered in an optimal fashion (e.g. in the form of an ad hoc deep-dive, experiment, dashboard, or automatically recurring analysis)- Analyze identified opportunities to understand their scope and impact (i.e. size opportunities)- Own the key performance indicators for a team, including selection, tracking, forecasting, and proactively flagging issues- Enable your team and direct stakeholders to independently leverage data for business insights via self-serving and dashboarding tools (Looker)- Define the requirements for (A/B) testing and analyze the results of (A/B) tests- Help to create a backlog with prioritized hypotheses and analysesAbout you:- Extensive working experience as a Decision Scientist, Data Analyst, Data Scientist or Business Strategist or in a related position- Highly results-oriented and comfortable with iterative processes- A good communicator who can present complex topics clearly and persuasively to different audiences- Strong analytical, strategic, and business skills- Excellent written and spoken English- A degree in statistics, physics, econometrics, economics, business or a similar field- Statistical proficiency (e.g. A/B testing, regression analysis)- Knowledge of at least one statistical programming language (Python, R, etc.)- Advantage: Fluency in SQL and experience with dashboarding tools (e.g. Looker, Tableau, etc.)- Advantage: experience working in a tech company or in a cross-functional product development teamWork perks:- Opportunity to join our share options programme- Learning budget (13.2 % from net yearly salary)- 25 working days of holiday- Workout classes- Mental- and emotional-health support from Mindletic- Private health insurance- A canteen that serves homemade food at friendly prices- Monthly team-building events- A personal budget for shopping on Vinted- Work anywhere in the EU for 90 days out of the year- Dog-friendly office- Home office support (IT workstation equipment provided + a personal budget of up to 540  for home workplace furniture)We want people to work from where theyre most comfortable, which is why were using a hybrid workplace model at Vinted for the foreseeable future.Hybrid means that we encourage working from the office on Tuesdays and Wednesdays and the remainder of your time from either home or the office, but its not required. Youre welcome to work from either location all or some of the time, depending on what you think is best and safest for you, and how the Covid-19 situation is developing where you are.The salary range for this position is 2,5004,600  (gross) per month.If this sounds interesting  you may well be just who we need"
