Job-Title,Date-Posted,Date-Scraped,Url,Company,Job-Type,Salary,Location,Description
Postdoctoral Research Fellow / Research Fellow - Machine Learning for...,2023-01-15,2023-01-30 12:11:06,https://www.google.com/search?q=Machine+Learning+Jobs+Australia&ibp=htl;jobs&sa=X&ved=2ahUKEwi9p8fG_-_8AhXbGDQIHYl9CL0QutcGKAF6BAgSEAU#htivrt=jobs&htidocid=j9xu_ZQJi2gAAAAAAAAAAA%3D%3D&fpstate=tldetail,Macquarie University,Full-time,NA,"The Rocks NSW, Australia","PRIMARY DETAILWe are seeking a talented and experienced Postdoctoral/Research Fellow to engage and embark in our new project within machine learning for precision healthcare.THE ROLE• Salary Package: Postdoctoral Research Fellow (Level A), from $97,621 to $104,622 p.a. or Research Fellow (Level B) $110,274 to $130,472 p.a., plus 17% employer's superannuation and annual leave loading.• Appointment type: Full-time, fixed-term position for 2 years• Macquarie University (North Ryde) locationThe RoleWe are seeking an enthusiastic researcher to participate in an established research program in artificial intelligence and machine learning for precision healthcare. The goal of the program is to research, develop, and evaluate a new generation of machine and deep learning methods and applications, to support clinicians in making better healthcare decisions. The research will be conducted as part of an NHMRC Partnership project and will focus on personalised patient-centric diagnosis... and treatment of neurological conditions using clinical and genomic datasets. You will be working with a cross-disciplinary group of highly experienced and internationally recognised researchers at the Centre for Health Informatics, at the Australian Institute of Health Innovation (AIHI) at Macquarie University and collaborating with other research groups.About YouYou will bring your expertise in machine/deep learning to a multi-disciplinary team and help the team to develop real-world systems. We are looking both for academic rigour and outputs, as well as practical analytical skills, proven problem-solving experience, and ability to interact with internal and external stakeholders. Ideally, you will have the desire to research health/medical applications of machine learning, with experience in using modern methods in real-world applications and working in a collaborative cross-disciplinary setting. You will be a good communicator, passionate about your research, and enjoy working in a dynamic team.About UsMacquarie is the university of pioneering minds. Globally recognised as one of Australia's leading research universities, Macquarie is a place where extraordinary new possibilities come to light. We've helped people to hear, introduced wireless internet technology to the world, and broken through traditional boundaries by appointing Australia's first female vice-chancellor.Macquarie University's Faculty of Medicine, Health and Human Sciences builds on our aspiration to have the nation's first fully integrated Academic Health Sciences Centre under a university's leadership. It brings together the excellent work of medical and allied-health clinicians and researchers across the University and around the country, with unparalleled access to world-leading clinical resources and research facilities found only on our campus. Our Faculty hosts the Australian Institute of Health Innovation (AIHI), an internationally acclaimed powerhouse researching health systems, e-health and patient safety.The Centre for Health Informatics (CHI) explores the application of novel digital technologies in healthcare with a specific focus on Artificial Intelligence (AI) and its implications for transforming models of care, driving system-wide change and delivering more personalised healthcare. The Centre leads a number of large-scale NHMRC projects in digital health and in 2018 established the Australian Alliance for Artificial Intelligence in Healthcare. As the longest-running digital health research centre in Australia, CHI is a research partner to major healthcare providers, research institutions and governments, and has national and international industry partnerships. The Centre generates high-impact research and works with many large Australian and international Electronic Health Record datasets and have expertise in the development and implementation of state-of-the-art artificial intelligence (AI) methods.Macquarie is a university engaged with the real and often complex problems and opportunities that define our lives. Since our foundation 54 years ago, we have aspired to be a different type of university. Over the years, we've grown to become the centre of a vibrant local and global community. Connect with us today.To ApplyTo be considered for this position, please apply online by submitting your CV with a publications list and a separate (1-2 pages) cover letter that demonstrates how you meet the selection criteria below. We ask that applicants also include a one-page summary of your top-3 publications explaining (a) the importance of these publications, and (b) your part in these publications.Selection Criteria:Essential• PhD in Computer Science, Data Science, Statistics, Health Informatics, or a closely related field.• Experience in Machine/Deep Learning, Data Science/Analytics, or AI, and strong analytical skills.• Excellent research track record evidenced by first-author publications in selective journals and conferences.• Proven experience with relevant machine learning and data analytics environments, used to develop practical applications.• Excellent written and verbal communication skills with an ability to communicate across discipline boundaries.• Proven ability to conduct research independently and as part of a collaborative team.Desirable• Publications in top-tier AI journals and conferences, such as IJCAI, NeurIPS, KDD, ICML, ICDM, etc.• Understanding of medical and health applications, and experience with application of AI to health/medical problems.• Experience in writing research proposals and securing research/industry funding.• Experience in supervising Honours and high-degree research students.Appointment to either Postdoctoral/Research Fellow will be in accordance with demonstrated skills, and experience.Please see: Australian Institute of Health Innovation Recruitment prospectusSpecific Role Enquiries: Prof. Shlomo Berkovsky, Centre for Health Informatics, Australian Institute of Health Innovation at shlomo.berkovskymq.edu.auRecruitment Enquiries: Shubha Moorthy, HR Officer at shubha.moorthymq.edu.auApplications Close: Sunday 19 February at 11:55pm AEDTIf you're already part of the Macquarie Group (MQ University, UMQ, MQ Health, MGSM), you'll need to apply through your employee Workday account. To apply for this job: Login to Workday and go to the Careers App  Find Jobs.Applications Close:19/02/2023 11:59 PMDiversity and InclusionInnovation and ingenuity thrive at Macquarie University when diversity, equity and inclusion take centre stage. At the University, we embrace a culture where diversity of background, experience and perspective are fundamental to our success.We do not discriminate on gender identity, age, culture, disability, sexuality, Indigeneity, family and caring responsibilities or religion. See our journey towards leadership in Equity, Diversity and Inclusion in Higher Education.Flexible WorkAt Macquarie, we believe by providing flexibility in when, where and how work is done, we can support our staff to manage their personal commitments, while optimising their work performance and contributions to the University. See how we lead in flexible work to enable an outcome focused and inclusive workplace. To learn more about our culture and hiring process, explore our Candidate Resource Hub"
Research Projects Officer in Machine & Statistical Learning,NA,2023-01-30 12:11:07,https://www.google.com/search?q=Machine+Learning+Jobs+Australia&ibp=htl;jobs&sa=X&ved=2ahUKEwi9p8fG_-_8AhXbGDQIHYl9CL0QutcGKAF6BAgSEAU#htivrt=jobs&htidocid=w330Pcgt-VgAAAAAAAAAAA%3D%3D&fpstate=tldetail,Commonwealth Scientific & Industrial Research Organisation (CSIRO),Full-time,NA,"Tasmania, Australia","Acknowledgement of CountryCSIRO acknowledges the Traditional Owners of the land, sea and waters, of the area that we live and work on across Australia. We acknowledge their continuing connection to their culture and pay our respects to their Elders past and present. View our vision towards reconciliationThe Opportunity• Bring your skills in machine learning and statistical learning to work• Flexible work arrangements! A mix of home and office• Full-time opportunity based in HobartCSIROs Environment Business Unit brings together our capabilities in marine, atmospheric, water and terrestrial environment disciplines, as well as significant social and economic research, to align and support the nation in creating a better and more sustainable future.As a Research Projects Officer, you will be a machine learning/data scientist/statistical learning specialist developing, implementing and interpreting machine learning systems at CSIRO.If you have a strong background in... understanding and developing computational and statistical methods across varied domains, do not hesitate to apply. In your initial days at CSIRO youll have the opportunity to contribute to the studies and projects across two key business areas, hydrophone-based acoustic surveillance of illegal fisheries and hydrodynamic modelling. How exciting is that!Your duties will include:• Applying machine learning approaches to various projects in the Coastal and Oceanic monitoring and research space.• Proposing, developing, incorporating and testing novel approaches to existing or new scientific investigations into environmental research methods by adapting and/or developing original concepts and ideas.• Implementing the latest machine-learning approaches to detect and classify acoustic signatures associated with illegal fishing activity, including blast sounds, vessel sounds, and fishing equipment noise.• Independently liaison with clients, implementing, calibrating and disseminating models for existing projects.• Exploring novel applications across CSIRO where the machine learning technologies outlined here could be adapted and leveraged to assist other domains• Contributing to the strategic development of modelling tools and frameworks supporting projects in the environmental space.• Initiating, managing and executing externally funded projects within imposed time and budget limitations.Location: Hobart, TASSalary: AU$105k  AU$114k plus up to 15.4% superannuationTenure: Indefinite/ full-timeReference: 90793To be considered you will need:• Relevant tertiary qualification in the field of computer science, science, mathematics, statistics, engineering or physics• Experience in the development, implementation, and interpretation of machine and/or statistical learning systems• Any prior experience in the field of machine learning or statistical analysis and working with environmental or acoustic datasets is desirable.For full details about this role please review the Position DescriptionEligibilityApplications for this position is open to Australian/New Zealand Citizens and Australian Permanent Residents only.Appointment to this role is subject to the provision of a national police check and may be subject to other security/medical/character requirements.Flexible Working ArrangementsWe work flexibly at CSIRO, offering a range of options for how, when and where you work.Diversity and InclusionWe are working hard to recruit people representing the diversity across our society, and ensure that all our people feel supported to do their best work and feel empowered to let their ideas flourish.About CSIROAt CSIRO Australia's national science agency, we solve the greatest challenges through innovative science and technology. We put the safety and wellbeing of our people above all else and earn trust everywhere because we only deal in facts. We collaborate widely and generously and deliver solutions with real impact.Join us and start creating tomorrow today!How to ApplyPlease apply on-line and provide a cover letter and CV that best demonstrate your motivation and ability to meet the requirements of this role.Applications Close22 January 2023, 11:00pm AEDT"
Machine Learning Engineer,2023-01-19,2023-01-30 12:11:07,https://www.google.com/search?q=Machine+Learning+Jobs+Australia&ibp=htl;jobs&sa=X&ved=2ahUKEwi9p8fG_-_8AhXbGDQIHYl9CL0QutcGKAF6BAgSEAU#htivrt=jobs&htidocid=sjyCqlG0BVYAAAAAAAAAAA%3D%3D&fpstate=tldetail,nbn® Australia,Full-time,NA,"Sydney NSW, Australia","Build your career and Australias future.Not many people can say they are working on building Australias future. With us youll be doing just that, leaving a legacy for all Australians. Plus, theres equal employment, great training, and true flexible working arrangements.A fantastic opportunity at nbn, Australias largest infrastructure project, as the Machine Learning Engineer, reporting to the Head of Data Science, COE where you will join the Office of the Chief Data Officer, a key pillar within the Strategic Services Business unit.A bit about your rolenbn is streamlining and improving the quality and flow of data across the entire organisation as well as performance management and advanced analytics capabilities to support day to day operations and decision making for all levels within nbn. In this role, you will perform the delivery of high-quality data science solutions to high priority business problems, with a focus on protecting, managing and promoting data as a... strategic asset for nbn and its stakeholders, in a sustainable, scalable and cost-efficient manner.The position will require you to understand challenges in multiple business domains, discovering new business opportunities while being comfortable shaping problem definitions and working with ambiguity. The problems addressed are significantly complex, you will demonstrate excellence in data science methodologies and represent CDO best practices.You will seek to identify and implement robust, efficient and scalable solutions that leverage multiple techniques and/or technologies. You will consider and quantify cross-organisation trade-offs to implement mechanisms to ensure that benefit persists. You will be required to deliver on advanced analytic and data science engagements with the business, catering for stakeholder expectations regarding delivery and testing approach, development of machine learning models, and evaluating new techniques. You will play a key role in the nbn Data Science community, defining and developing standards and best practices across the analytic and ML lifecycle & in advocating best practice and the ongoing development of other analytics practitioners.A bit about youThe ideal candidate will have demonstrated experience in applying a breadth of analytics skills to drive projects and BAU activities, applying MLOps/Devops methodologies on Machine Learning solutions, leading to proven business value and impact on strategic decisions. You will have an agile development mindset, appreciating the benefit of constant iteration and improvement.You have experience with AWS, with excellent data manipulation and data transformation skills. Ideally, you will have a working experience with one or more machine learning platforms such as Sagemaker (desirable), Kubeflow or GCP AI platform and a strong understanding and hand-on experience in cloud engineering and modern devops practices including an in-depth understanding of Linux and bash/shell scripting, automation (gitops, dataops, CICD, infrastructure as code), deployment strategies, container and container orchestration (docker and kubernetes), serverless (lambda, knative), micro service architecture, API design and documentation (OpenAPI format), API deployment and scaling distributed systems (load balancing, ingress/egress controllers).Life at nbnPlease note that this role will be a permanent position and applications for this role will close at midnight Sunday 5th February 2023.At nbn our people have a clear and shared purpose - empowering Australians to redefine the way they live, work and play into the future. As one of the Australias largest infrastructure projects ever undertaken in Australian history, youll be part of a team building a brighter future for the country.In your personal career, youll benefit from technical training for professional development, leadership programs and access to the latest technology, as well as being led by a diverse executive team.nbn is committed to an inclusive, flexible and supportive workplace where everyone can feel valued, respected and have equal opportunity to thrive and succeed. We encourage applications from people of all ages, nationalities, abilities and cultures - including Aboriginal and Torres Strait Islander peoples, the LGBTI+ community and people living with disability. We're happy to adjust our recruitment process to support accessibility needs  we encourage you to advise us at the time of the application via recruitmentnbnco.com.auWe actively focus on our people having a fair go at reaching their career aspirations. Were committed to equal opportunities for all employees. With initiatives like Womens Leadership Programs, a commitment to equal pay, flexibility and market leading parental leave, we truly are paving the way for true equality in the workplace.Continue the conversationIf you think this role might be for you, we want to hear from you. Please apply by following the links and sending in your resume only. We do not require a cover letter or any selection criteria to be addressed.At nbn, health, safety and wellbeing will always be our highest priority and we are committed to protecting our employees, and the customers and communities we serve. nbn recognises that vaccinations against COVID-19 are critical and necessary in certain situations. As such workers who regularly engage face to face with our customers or the community must be fully vaccinated against COVID-19 (which means two doses of an ATAGI approved vaccine), unless a valid medical exemption is provided.At nbn our people and our planet matter. We have an unwavering commitment to the wellbeing and safety of our employees so that everyone goes home safely each day and can perform at their peak to deliver the nbn network. nbn also aims to build a network that minimises energy use and can be operated with minimal impact on the environment"
Senior/Lead Machine Learning Engineer,NA,2023-01-30 12:11:08,https://www.google.com/search?q=Machine+Learning+Jobs+Australia&ibp=htl;jobs&sa=X&ved=2ahUKEwi9p8fG_-_8AhXbGDQIHYl9CL0QutcGKAF6BAgSEAU#htivrt=jobs&htidocid=Ga9MoY-Z0f4AAAAAAAAAAA%3D%3D&fpstate=tldetail,Lookahead Search,Full-time,NA,Australia,"$180-200K + super (depending upon experience)Fully remote role (within Australia)Tech includes: Python, notebooks, pandas, torch, scikit, tensor, AWSThe roleA startup in the music industry are looking to bring on a ML tech lead to work with their globally distributed development team. You'll be helping bring the existing models that are built offshore, in-house. And you'll help build a small team. (While this is not a greenfield role, there will be more models to come.)About youYou've had experience building models with Python (with tech such as notebooks, pandas, torch, scikit, tensor), using containers with AWS (Lambda, API Gateway, OpenSearch, EC2, ECR, Sagemaker). You enjoy mentoring others and contributing to the culture of your team. You enjoy helping others improve processes, model accuracy and data quality.Must have:Commercial experience building ML models on AWS for more than one company.Permanent Residency or Australian / NZ CitizenshipThe offerSalary... $180-200K + superWork from home anywhere in AustraliaFlexible work arrangementsAn opportunity to lead and build a small ML teamApply nowIf you're interested in having a conversation about this role, send me an email with your resume, and let me know why you're interested in this position. We can then schedule a call to see if there's a fit.If this role isn't quite right, but you're looking for other developer or data roles, feel free to get in touch anyway.Debbie Teakledebbielookahead.com.au  www.lookahead.com.au"
