Job-Title,Date-Posted,Date-Scraped,Url,Company,Job-Type,Salary,Location,Description
【Kyoto】Machine Learning Engineer,NA,2023-01-30 12:26:53,https://www.google.com/search?q=Machine+Learning+Jobs+Japan&ibp=htl;jobs&sa=X&ved=2ahUKEwiHoOeTg_D8AhXKAzQIHRG4DycQutcGKAF6BAgOEAU#htivrt=jobs&htidocid=-uX9z7LPYakAAAAAAAAAAA%3D%3D&fpstate=tldetail,ExaWizards,Full-time,NA,"Kyoto, Japan","RoleResearch and implement state-of-the-art ML modelsSolve problems provided by our partner companies (large corporations)//Minimum Skill/ExperienceStrong knowledge of PythonExperience with ML frameworks such as Scipy/Numpy, Scikit-Learn, Pandas, Tensorflow, Keras, Chainer, PyTorchStrong knowledge of Computer Science or related quantitative fieldStrong knowledge of machine learning models (linear regression, ensemble methods, boosting, RNN, CNN, GCN, GAN, etc.)Ability to implement models from papersDemonstrated history of model research and designExperience with git/hgGood communication skill (Japanese)PythonScipy/Numpy, Scikit-Learn, Pandas, Tensorflow, Keras, Chainer, PyTorch, , , RNN, CNN, GCN, GAN... YOLOPreferred Skill/ExperienceGood communication skill (English)Strong knowledge of algorithms and data structuresExperience with working at startupsStrong work initiativeGit, hg"
Machine Learning Engineer,NA,2023-01-30 12:26:54,https://www.google.com/search?q=Machine+Learning+Jobs+Japan&ibp=htl;jobs&sa=X&ved=2ahUKEwiHoOeTg_D8AhXKAzQIHRG4DycQutcGKAF6BAgOEAU#htivrt=jobs&htidocid=cqUZiMEQ4RcAAAAAAAAAAA%3D%3D&fpstate=tldetail,Treasure Data,Full-time,NA,"Minato City, Tokyo, Japan","The Machine Learning team is a relatively new team whose initial goal is to productize an Automated Machine Learning (AutoML) platform. This team works closely with the Backend Workflow team within the Core Services group in order to deliver ML pipelines as a service for all customers. Additional ML solutions already in our roadmap include Text Analysis, Causal Analysis/Discovery, Explainable AI (XAI), Uplift modeling, and Exploratory Data Analysis (EDA).Productizing our ML products as a scalable cloud service requires diverse knowledge and experience not only in data science, but also software engineering. Areas such as container platform Java APIs (AWS ECS), AWS cloud API programming, Python ML libraries, SQL query processing for large data, Pandas dataframe processing for feature engineering, and AWS infrastructure management using Terraform are all topics you will be directly involved with over the course of your work in the ML team at Treasure Data.This position is ideal for... those with not only Data Science and Machine Learning skills, but also conventional cloud engineering skills for developing, deploying, and operating these critical ML products. This ML engineer position will expect candidates to understand machine learning algorithms, have experience in data analysis, and desire to grow as a software engineering in cloud computing environments.Success in this role requires a passion for developing and productizing ML products with strong interests and knowledge in data science along with strong experience in software engineering.You do this by collaborating with others to achieve our shared goals together in a self-organized team; pursuing autonomy with ownership, while increasing trust and sustainability to evolve continuously together. You would be able to effectively communicate ideas, software system designs, implementations, and decisions in a clear and concise manner to make others understandable.Responsibilities• Work with product managers and engineering colleges to define and deliver new ML products.• Continuously learning new ML algorithms or techniques.• Work with distributed development teams to operate ML as a Service by participating in on-call rotations.• Pro-actively and continuously improving existing systems and processes together with team members.Requirements• A BS in Computer Science or a related field, or equivalent work experience.• 3+ years of experience with software development• Hands on experience on building and maintaining machine learning product or services• Strong Python coding skills along with other typed programming language experience such as Java or C++, meaning that not only scripting skills.• Strong data science knowledge including state-of-the-art ML models, libraries, and techniques.• Experience with SQL query processing and Pandas Dataframe API programming• Industry experience using public cloud IaaS providers like AWS.• Quickly catch up new technologies or company standards.• Understand software development life cycle such as mock, CI (circleci), unit testing, and github actions.Nice to havesThese arent required, but be sure to mention them in your application if you have them.• Experience with Automl frameworks such as AutoGluon, H2O AutoML, PyCaret, FLAML and so on.• Experience for Explainable AI (XAI) such as SHAP and LIME.• Experience working with big data technologies such as Hadoop, Hive, Presto, Spark, BigQuery, and Redshift.• (Awarded) experience in data science competitions such Kaggle.• OSS contribution experiences.• Strong EDA skills using Pandas and Notebooks for feature engineering and so on.• Experience with Container runtimes such as AWS ECS/EKS and Kubernates.• Familiar with Infrastructure as Code using Terraform, or CloudFormation.• Demonstrated ability working collaboratively in cross-functional teams and a strong track record for delivery as part of a team.• Familiar with security best practices including knowledge about Security Groups, IAM, networks.• Experience with distributed teams across different time zones"
ML Engineer,NA,2023-01-30 12:26:54,https://www.google.com/search?q=Machine+Learning+Jobs+Japan&ibp=htl;jobs&sa=X&ved=2ahUKEwiHoOeTg_D8AhXKAzQIHRG4DycQutcGKAF6BAgOEAU#htivrt=jobs&htidocid=BgOxgbez87gAAAAAAAAAAA%3D%3D&fpstate=tldetail,tripla,Full-time,NA,"Tokyo, Japan","Job OverviewAt tripla, we make travelers happy. Whether it be for booking the perfect hotel room, dining at the trendiest restaurant, or partaking in an exciting excursion, we build smart, AI driven products to allow travelers plan the perfect trip. In the short amount of time that weve been around, Tripla chatbot has become Japans most popular chatbot in the industry, and the pace of growth is only increasing. Were currently expanding our services into many other areas, but we need a talented ML engineer to help us get there.As a ML engineer, youll be responsible for the refining and upkeep of the ML models that power our products, including: question/answer systems, recommenders, pricing predictors, as well as others. Since AI is what gives Tripla its competitive advantage, youll be a central figure as this company grows. Youll be responsible for not only delivering powerful algorithms, but also for building them for scale. This includes designing the data pipelines that... feed our models and automating the training/inference process to enable continuous improvements.The ideal candidate is experienced and self-directed. Comfortable supporting multiple teams, systems, and products. The candidate is excited by the prospect of working with new AI technologies and cutting edge experimental products. Perhaps most importantly, the candidate should want to be a part of a team. Nothing at Tripla is accomplished by one person. The candidate must have strong communication skills and the desire to tackle challenges as a group.Responsibilities• Develop and enhance our ML models: NLU, time series prediction, recommendation, etc.• Evaluate and diagnose ML models. Analyze and clean the data being fed to them.• Build and upkeep automated machine learning data pipelines and training systems.• Work with stakeholders including the executive, product, data, and design teams to come up with new ways we can utilize data to solve problems.• Automate and scale our resources and pipelines to accommodate the sharply increasing data requirements.Qualifications• 5+ years of some form of software engineering experience (at least 2 of which are in data science)• Experience building and optimizing ML models.• Extensive experience with object-oriented/object functional languages, e.g. Python, Ruby, Java, C++, etc.• Experience supporting and working with cross-functional teams in a dynamic environment.• English fluencyNice to haves• Graduate degree in computer science, mathematics, statistics, or some other quantitative discipline.• Experience with NLP• Experience with tensorflow• Exposure to constructing automated training pipelines for machine learning models"
Machine Learning Engineer,NA,2023-01-30 12:26:55,https://www.google.com/search?q=Machine+Learning+Jobs+Japan&ibp=htl;jobs&sa=X&ved=2ahUKEwiHoOeTg_D8AhXKAzQIHRG4DycQutcGKAF6BAgOEAU#htivrt=jobs&htidocid=V9FBs3SzRnQAAAAAAAAAAA%3D%3D&fpstate=tldetail,PayPay,Full-time,JP¥9M–JP¥12M a year,"Minato City, Tokyo, Japan","Responsibilities• Research, design, and build machine learning systems for prediction, recommendation, and automation• Execute the key phases of the ML lifecycle including data extraction, exploratory data analysis, data preparation, model development and training, model evaluation and validation, and model serving• Build monitoring tools and pipelines for automated training and deployment• Collaborate with data scientists, data engineers, product managers, and stakeholders to build robust production systemsRequirements• Bachelors in a quantitative field such as Computer Science, Mathematics, Statistics, Machine Learning, or equivalent• More than three years of experience as a data scientist, machine learning engineer, or equivalent role• Experience in at least one primary language (e.g., Java, Scala, Python) and SQL (any variant)• Experience in one or more machine learning frameworks such as TensorFlow, PyTorch, Theano, etc.Nice to havesThese arent required, but be... sure to mention them in your application if you have them.• Masters or PhD in a quantitative field such as Computer Science, Mathematics, Statistics, Operations Research, Machine Learning, or equivalent• More than five years of experience as a data scientist, machine learning engineer, or equivalent role• Experience building and maintaining microservices• Experience with Big Data technologies like BigQuery, Spark, Hadoop, AWS Redshift, Kafka, or Kinesis streaming• Experience with AWS services such as Glue, SageMaker, Athena, and S3• Extensive knowledge and work experience in recommendation systems, deep learning, NLP, and optimization• Experience maintaining data security and privacy• Expertise in MLOps frameworks, CI/CD pipelines, and automation"
"Software Engineer, Machine Learning & Search - Mercari",NA,2023-01-30 12:26:55,https://www.google.com/search?q=Machine+Learning+Jobs+Japan&ibp=htl;jobs&sa=X&ved=2ahUKEwiHoOeTg_D8AhXKAzQIHRG4DycQutcGKAF6BAgOEAU#htivrt=jobs&htidocid=8JQVsMbW34QAAAAAAAAAAA%3D%3D&fpstate=tldetail,"Mercari, inc.",Full-time,NA,"Minato City, Tokyo, Japan","JD in Japanese follows. JDIntroductionOur MissionMercari is a Japan-based company with the mission of create value in a global marketplace where anyone can buy & sell. Having continuously worked toward this goal since our founding in 2013, we are now transforming from a startup into a global player. While this transformation brings its own specific set of challenges, we believe that solving them one after another will allow us to fully achieve our mission. Are you interested in working together to take on these exciting challengesOur CultureTo achieve our mission at Mercari, our organization and each of our employees share the same values and perspectives. Our individual guidelines for action are defined by our three values: Go Bold, All for One, and Be a Pro. Our organization is also shaped by our four foundations: Sustainability, Diversity & Inclusion, Trust & Openness, and Well-being for Performance. Regardless of how big Mercari gets, the culture will... remain essential to achieving our mission and something we want to preserve throughout our organization.We invite you to read the Mercari Culture Doc, which summarizes the behaviors and mindset shared by Mercari and its employees. We continue to build an environment where all of our members of diverse backgrounds are accepted and recognized, and where they can thrive while holding dear Mercaris culture.Position OverviewWork Responsibilities• Platform engineers for machine learning/search systems develop the functions and services of the marketplace app Mercari through the development and maintenance of infrastructure and platforms. Mercari is actively applying machine learning/search technology to provide a more convenient, safer, and more enjoyable marketplace. Machine learning/search platform engineers use the cloud and Kubernetes to operate and improve machine learning/search systems.Bold Challenges• Develop libraries and frameworks to improve the availability of machine learning/search systems• Improve the existing machine learning/search infrastructure and leverage industry-leading best practices to help the AI/search team operate• Disseminate the best practices of machine learning/search engine operation, improve the development process, and improve the skills of engineers• Develop and improve monitoring and logging systems for the evaluation of machine learning models/search experiments• Collaborate with other teams to develop large-scale infrastructureRequired Experience• Operating a web system• Over 5 years of software development experience and over 3 years of Java, Python or Golang development experience• End-to-end backend system development experience• Basic knowledge and skills related to security, basic knowledge and troubleshooting skills related to RDBMS, SQL, network, Linux, monitoring system, logging, and operation• Communication skills to carry out projects in collaboration with multiple teams and stakeholdersPreferred Experience• Developing and operating large-scale distributed systems (Kubernetes, Hadoop, etc.)• Functional development and bug fixing skills necessary to improve system performance and reliability• Using container technology such as Docker and Kubernetes• Using the cloud (AWS, GCP, Microsoft Azure, etc.)• Microservice development and operation experience with Docker and Kubernetes• Using one or both of the following:• Machine learning: TensorFlow Serving, TensorFlow Lite, ONNX• Search: Elasticsearch, Solr or other OSS search enginesLanguage Requirements• English: Independent (CEFR - B2)• Japanese: Basic (CEFR - A2) Preferred• For details about CEFR, see hereRelated Articles• Conversation between Machine Learning Engineers. Meet  lain21 and  chica #WeMakeMercariWorking ConditionsEmployment StatusFull-time• Probationary period: First 3 months after joining the company. (During this period your contract conditions will be the same as that of a permanent employee.)OfficeRoppongi• Smoking is prohibited within our offices• Mercari has introduced a work style policy called Your Choice. Each member is free to choose whether they want to work in the office or work fully remote. *Exceptions made for certain kinds of work.Work Hours• Full flextime (no core time or flex time)• Does not apply to all positionsHolidays• Two days off per week (as well as national holidays, New Year's break, etc.)• Paid leave, congratulatory and bereavement leave, relax days, sick leaveSalary• Annual salary paid in 12 monthly installments (including fixed overtime allowance)• Based on skills, experience, and abilities• Reviewed twice a yearBenefits• Complete health and social insurance• Incentive program• Support systems, including those that benefit the employees family members• See this page for details.Support• Relocation support• Language learning support• Translation/interpretation support• See this page for details.MediaCorporate Sites• Mercari, Inc.• Merpay, Inc. Japanese• Souzoh, Inc.• Mercoin, Inc.• Merlogi• Mercari USOwned Media• Mercari Careers• Mercari Engineering Portal• Mercan - Introduces the people that make Mercari• Mercari US Careers• Mercari US Blog2013Go BoldAll for OneBe a Pro3SustainabilityDiversity & InclusionTrust & OpennessWell-being for Performance4Mercari Culture Doc•   Kubernetes• • AI• • • • Web• 53JavaPythonGolang• End-to-end• RDBMSSQLLinux• • KubernetesHadoop• • DockerKubernetes• AWSGCPMicrosoft Azure• DockerKubernetes• •  TensorFlow ServingTensorFlow LiteONNX•  ElasticsearchSolrOSS• Independent (CEFR - B2)• Basic (CEFR - A2) PreferredCEFR• Vol.46  lain21 chicaML  mercan ()• 3)• : • YOUR CHOICE• • 2 • Sick Leave• • • 2• • •  • • •  • • • • • • Mercari US• • • mercan• Mercari Design"
Machine Learning Engineer (Urgent Hiring!!!),2023-01-28,2023-01-30 12:26:55,https://www.google.com/search?q=Machine+Learning+Jobs+Japan&ibp=htl;jobs&sa=X&ved=2ahUKEwiHoOeTg_D8AhXKAzQIHRG4DycQutcGKAF6BAgOEAU#htivrt=jobs&htidocid=obqDPNtW2_4AAAAAAAAAAA%3D%3D&fpstate=tldetail,Fast-growing AI Start-up,Full-time,NA,"Tokyo, Japan",About Client:A fast-growing AI international company looking for a Machine Learning EngineerWhat you will do:Build machine learning models for a wide range of business solutionsWhy you should join this company:International English speaking EnvironmentFlex timeChallenging & exciting working environmentHigh Salary & Benefit package
VISA & housing support available ★ Multinational people are active! [AI...,2023-01-24,2023-01-30 12:26:56,https://www.google.com/search?q=Machine+Learning+Jobs+Japan&ibp=htl;jobs&sa=X&ved=2ahUKEwiHoOeTg_D8AhXKAzQIHRG4DycQutcGKAF6BAgOEAU#htivrt=jobs&htidocid=KTqPh4hpQHIAAAAAAAAAAA%3D%3D&fpstate=tldetail,"Human Resocia Co., Ltd.",Full-time,NA,Japan,"Human Resocia is THE GLOBAL COMPANY.Over 800 foreign engineers from more than 50 countries works at Human Resocia.Our engineers will be seconded to the client to take charge of the projects.The project will include machine learning, image recognition / object detection using deep learning, development of learning models / algorithms such as natural language processing, and development of systems using data analysis results.Every engineers will be assigned to the project that suits your experiences.Project example Development of smart factories and robotics using AI sensors Development of image processing AI for drones Research and development of object recognition system for in-vehicle cameras of autonomous vehicles (ADAS) Natural language processing (NLP) for AI conference systems Image processing using drones at construction sites"
Senior Machine Learning Engineer,NA,2023-01-30 12:26:56,https://www.google.com/search?q=Machine+Learning+Jobs+Japan&ibp=htl;jobs&sa=X&ved=2ahUKEwiHoOeTg_D8AhXKAzQIHRG4DycQutcGKAF6BAgOEAU#htivrt=jobs&htidocid=w9Vm0_wHOBYAAAAAAAAAAA%3D%3D&fpstate=tldetail,CADDi,Full-time,JP¥5M–JP¥12M a year,"Taito City, Tokyo, Japan","At CADDi, we have a massive amount of technical drawings, corresponding quotations, along with data describing the required manufacturing processes. By processing these data into a form that is easier to utilize and quickly implementing the cycle of hypothesis testing, we aim to find answers to the problems faced by the manufacturing industry.Besides what we already have, there is a lot more data out there that hasnt been fully utilized. Assessing valuable data and preparing it for utilization is the key to taking the burden off this industry.Responsibilities• Leveraging existing data assets to discover new value for the corporation• Analysis of base data to obtain hypotheses concerning business and operational improvement• Developing new user-facing features that combine CADDis domain expertise, data assets, and operational excellenceRequirements• An understanding our mission to unleash the potential of manufacturing• 3+ years of experience utilizing machine learning... methods to solve business problems• Experience delivering services in a production environment in the cloud (AWS, GCP, Azure, etc)• Self-driven, and can operate both independently and also as a team member• Able to exercise strong problem solving skills to deliver customer value• Strong fundamental skills in linear algebra, calculus, and statistics• Experience in application development or analysis work with Python, MATLAB, or R• Experience with machine learning frameworks (PyTorch, Tensorflow, scikit-learn, LightGBM, etc)• Experience using SQL for data analysis• Experience using version control systems such as GitNice to havesThese arent required, but be sure to mention them in your application if you have them.• Experience with GPU-based data processing (CUDA, OpenCL, etc)• Experience working with data pipeline technologies such as Airflow, Apache Beam, Spark, etc.• Past participation in data analysis contests such as Kaggle• Comfortable reading research papers from major journals• Experience utilizing numerical optimization methods (continuous, discrete, or combinatorial"
Machine Learning Engineer | Featured AI company,2023-01-24,2023-01-30 12:26:56,https://www.google.com/search?q=Machine+Learning+Jobs+Japan&ibp=htl;jobs&sa=X&ved=2ahUKEwiHoOeTg_D8AhXKAzQIHRG4DycQutcGKAF6BAgOEAU#htivrt=jobs&htidocid=vs30sr-RT3oAAAAAAAAAAA%3D%3D&fpstate=tldetail,⁑注目AI企業/Featured AI company⁑,Full-time,NA,"Tokyo, Japan","About the CompanyThe company has engaged in various industry AI projects. We have clients in a wide range of industries, such as finance, manufacturing, retail, food and drink, education, healthcare, manufacturers and IT communications, with hundreds of cases. The company is rated as one of the Best Ventures to Work in Japan.Based on the knowledge and know-how of each industry obtained from this wide network, we promise innovative proposals that exceed the industry and precedent. Many intelligent talents in the world are gathering into the company now.Job DescriptionMachine learning engineers who implement machine learning models to help solve actual issues in society and companies.Work with in-house AI consultants to translate actual issues in society and companies into statistical and machine learning problemsImplement machine learning models and test hypotheses.Operate the machine learning models.Make new proposals in an engineer-driven manner using individual... backgrounds and the latest technologiesRequirements for each fieldImage ProcessingMultiple experiences in building machine learning models with input and output of images and point clouds.In addition, meet one or more of the following 131. Familiar with the latest technologies such as CV and CG2. Experience in presenting at conferences and writing papers.3. Experience in product integration.Structured Data ProcessingExperience in PoC and data analysis for in-house/*other companies.• For PoC for other companies, experience in leading technical aspects for other companies is a preferred.Knowledge of some established machine learning/statistics methodologies and ability to implement machine learning (programming experience: 1+ years)Japanese: Business levelNatural Language ProcessingExperience in Japanese language analysisJapanese: Business levelIn addition, meet one or more of the following 151. Experience in presenting at conferences and writing papers.2. Experience in analyzing real data or open data in a company, and projects using that data.3. Experience in service operation.4. Experience as a researcher (project)5. Experience in product development related to NLPSpeechAcademic background or work experience in speech analysis.In addition, meet one or more of the following 151. Experience in presenting at conferences and writing papers.2. Experience in analyzing real data or open data in a company, and projects using that data.3. Experience in service operation.4. Experience in researcher (project).5. Experience in product developmentMathematical OptimizationInterested in social implementation of mathematical optimization techniques.Deep understanding and extensive knowledge of one or more programming languages.Ability to implement algorithms in papers.Japanese: Business levelIn addition, meet one or more of the following 121. Practical experience using mathematical optimization techniques2. Experience in research using mathematical optimization.Working conditions & treatment5 million yen to 15 million yenDiscretionary labor system (You can come office and go home anytime)Full holiday 2 day system (Saturday / Sunday) holidaysAnnual holiday over 120 daysRefreshment holidays (5 days a weekday)New Year holidaysAnnual paid leaveReturn vacation (2 days a year: when family lives in a remote area over 1000 km)Condition leave (during trial period: 3 days)Marriage leave (person, child)Maternity leaveNursing care leaveDoctoral Program Support SystemVarious Social Insurance (Employee Pension, Health Insurance, Employment Insurance, Labor Accident Insurance)Commuting allowance (up to 35,000 yen / month)Business trip allowanceMedical checkupOnline medical consultation (first call)Book purchase (full company burden)Study session (once / weekly, during business hours"
