Job-Title,Date-Posted,Date-Scraped,Url,Company,Job-Type,Salary,Location,Description
Data Scientist,NA,2023-01-30 12:31:06,https://www.google.com/search?q=Machine+Learning+Jobs+Nepal&ibp=htl;jobs&sa=X&ved=2ahUKEwivuqqJhPD8AhU3HjQIHYXID64QutcGKAF6BAgcEAU#htivrt=jobs&htidocid=kAk8eWT2szYAAAAAAAAAAA%3D%3D&fpstate=tldetail,Fusemachines,Full-time,NA,"Kathmandu, Nepal","About FusemachinesFusemachines is a leading AI strategy, talent, and education services, provider. Founded by Sameer Maskey Ph.D., Adjunct Associate Professor at Columbia University, Fusemachines has a core mission of democratizing AI. With a presence in 4 countries (Nepal, the United States, Canada, and the Dominican Republic and more than 250 full-time employees) Fusemachines seeks to bring its global expertise in AI to transform companies around the world.About The RoleWe are looking for intellectually curious, highly motivated individuals to join our Data Science & Analytics team. You will partner with our Engineering, Product, and Operations teams to identify critical issues to the business, develop a deep understanding of them, and design scalable solutions. You will leverage your quantitative and modeling skills to transform signals into insights, and insights into actions. You should have strong analytical skills, excellent communication abilities, and a knack for... working across teams in a fast-paced environment.Qualification And Experience• Math or Computer Science Masters (preferred) or Bachelor's Degree• Must have at least 2 years of relevant experienceRequired Skills/CompetenciesSound understanding of:• Data Engineering• Pyspark• Databricks• Python• Data streaming• Kafka• Statistical modeling• Random forest• xgboostWhat You Will Do• Customer churn• Propensity models• Working with customer data• Understand customers' marketing data• Time series forecasting• Price optimizationEqual Opportunity Employer: Race, Color, Religion, Sex, Sexual Orientation, Gender Identity, National Origin, Age, Genetic Information, Disability, Protected Veteran Status, or any other legally protected group status.Powered by JazzHRqKpo5htWPw"
Backend Engineer,NA,2023-01-30 12:31:07,https://www.google.com/search?q=Machine+Learning+Jobs+Nepal&ibp=htl;jobs&sa=X&ved=2ahUKEwivuqqJhPD8AhU3HjQIHYXID64QutcGKAF6BAgcEAU#htivrt=jobs&htidocid=FGyPDZeDwxAAAAAAAAAAAA%3D%3D&fpstate=tldetail,Fusemachines,Full-time,NA,"Kathmandu, Nepal","Backend EngineerLocation: Kathmandu, NepalJob Type: Full TimeDepartment: Asia TechnologyExperience: Mid LevelAbout FusemachinesFusemachines is a leading AI strategy, talent, and education services provider. Founded by Sameer Maskey Ph.D., Adjunct Associate Professor at Columbia University, Fusemachines has a core mission of democratizing AI. With a presence in 4 countries (Nepal, the United States, Canada, and the Dominican Republic and more than 250 full-time employees). Fusemachines seeks to bring its global expertise in AI to transform companies around the world.Job TypeThis is a full-time positionRole Scope• Support client needs by delivering ODI jobs and frameworks• Understands multithreading, locks, and queues very well• Writes reusable, testable, and efficient code (with a huge emphasis on testable code)• Communicate about complex technical, architectural, and organizational problems and propose comprehensive iterative solutions• Design and develop... scalable and secure APIs• Understands best practices for security and data protection• Involve in tuning and optimization of SQL statementsRequirements for the role• 5+ years of experience in Python development• Strong hands-on experience with Oracle Data Integrator (ODI) (Mandatory)• Experience in Data Migration using SQL loader, import/export• Code guru in Python.Experience designing scalable and secure APIs, and are a proponent of API-first development• Experience with various authentication methods and technologies.Strong knowledge of database, schema designing and SQL• Knowledge of SQLAlchemy and related libraries is a plus• Python data science and machine learning libraries, such as SciKitLearn, Theano, NumPy, SciPy, and Panda• Experience with Python frameworks (e.g. Django, Flask, FastAPI)• Strong unit test and debugging skills with experience in frameworks like PyTest, and Unittest.• Experience with distributed data processing using queues and schedulers• Knowledge source code control toolsEqual Employment OpportunityWere proud to be an equal opportunity employer  and celebrate our employees differences, including race, color, religion, sex, sexual orientation, gender identity, national origin, age, disability, and Veteran status. Differences make us better"
Lead Data Engineer,NA,2023-01-30 12:31:07,https://www.google.com/search?q=Machine+Learning+Jobs+Nepal&ibp=htl;jobs&sa=X&ved=2ahUKEwivuqqJhPD8AhU3HjQIHYXID64QutcGKAF6BAgcEAU#htivrt=jobs&htidocid=pkSH2EyKPMMAAAAAAAAAAA%3D%3D&fpstate=tldetail,Fusemachines,Full-time,NA,"Kathmandu, Nepal","Lead Data EngineerLocation: Kathmandu, NepalType: Full TimeDepartment: Asia TechnologyExperience: Mid LevelAbout FusemachinesFusemachines is a leading AI strategy, talent, and education services provider. Founded by Sameer Maskey Ph.D., Adjunct Associate Professor at Columbia University, Fusemachines has a core mission of democratizing AI. With a presence in 4 countries (Nepal, the United States, Canada, and the Dominican Republic and more than 250 full-time employees) Fusemachines seeks to bring its global expertise in AI to transform companies around the world.About the roleThis is a full time positionRole scope• Design and develop high-performance data architectures, which support data warehousing, real-time ETL, and batch big-data processing• Design, develop, conducts unit testing, and maintain complex Tableau reports for scalability, manageability, extensibility, performance, and re-use.• Resolve support tickets related to Tableau reports• Collaborate with... Product, Engineering, Science, Data analysts, and data scientists to implement rich and re-usable datasets/metrics• Care about architecture, observability, testing, and building reliable infrastructure and pipelines• Conduct Discovery of existing Data Infrastructure and Proposed Architecture• Evaluate, design, and implement the data pipelines, data lineage, and data governance frameworks that are suitable for a modern analytics solution, considering industry-standard best practices and patterns.• Data migration (if needed)• Assess best practices and design a schema that matches business needs for delivering a modern analytics solution (descriptive, diagnostic, predictive, prescriptive)• Possesses strong leadership skills with a willingness to lead, create Ideas, and be assertiveRequirements for the role• 5+ years of real-world development experience with big-data platform• Bachelors degree in computer science, data science, IT, or related field of study or equivalent experience• Experience in tools like Talend and/or similar ETL tools• Proven experience in developing and working Tableau driven dashboards, analytics• Advanced Tableau development skills required• Evaluated and implemented data solutions in AWS, Azure, or Google Cloud• Experience with big data tools• Experience with relational SQL and NoSQL databases, including Postgres, MongoDB, ElasticSearch• Expert knowledge of SQL, Python, and database patterns and practices• Experience with Spark/PySpark and other streaming data pipelines• Knowledge of and aptitude for machine learning development and implementation• Strong analytical skills• High degree of organization, individual initiative, and personal accountability• Astute with high resilience and the ability to achieve results and milestones in uncertain development situations.Equal Opportunity Employer: Race, Color, Religion, Sex, Sexual Orientation, Gender Identity, National Origin, Age, Genetic Information, Disability, Protected Veteran Status, or any other legally protected group status"
Full Stack Tech Lead,NA,2023-01-30 12:31:07,https://www.google.com/search?q=Machine+Learning+Jobs+Nepal&ibp=htl;jobs&sa=X&ved=2ahUKEwivuqqJhPD8AhU3HjQIHYXID64QutcGKAF6BAgcEAU#htivrt=jobs&htidocid=otZavvXTqWkAAAAAAAAAAA%3D%3D&fpstate=tldetail,Fusemachines,Full-time,NA,"Kathmandu, Nepal","About FusemachinesFusemachines is an artificial intelligence talent and education solutions company dedicated to democratizing AI. Headquartered in New York,US with operations in Dominican Republic, Canada, and Nepal, it is a 200+ company. Fusemachines' AI educational program has made world-class AI education accessible and affordable to students worldwide. Fusemachines helps organizations identify opportunities where AI can be best utilized to transform and grow their business.Qualification And Experience• Bachelor's degree in computer science or related field of study.• 5+ years experience as a Software Engineer or Software DeveloperRequired Skills/ Competencies• Overall AWS knowledge to be able to design system architecture. AWS Services (ElastiCache, S3, SQS, DynamoDB, Kinesis Analytics, Glue)• Must have expertise in Elastic search.• Demonstrated proficiency in Python• Demonstrated experience using at least one JavaScript framework (Angular JS, React JS, etc.)•... Experience using at least one relational database (MySQL, SQL Server, PostgreSQL, etc.)• Basic understanding of Splunk.• Understanding of kubernetes, especially EKS.• CI/CD basic understanding (Jenkins, GitHub Actions, cloud build).• Kafka knowledge on architecture level.• Strong analytical skills and excellent problem-solving skills• Good understanding of fundamental programming concepts like object-oriented design, algorithms, and data structures• Experience developing complex software systems that have successfully been delivered to customers• Experience with data integrity, regression, performance testing• Strong interest in machine learning software systems and big data software systemsKey Responsibilities• Write clean and maintainable code that conforms to best practices; perform peer code reviews• Investigate, explore, and employ architectural principles and approaches to deliver best-in-class products• Collaborate and evaluate on prototyping new technologies• Work in a fast-paced Agile/Scrum environment• Mentor team members on their appropriate application• Work closely with local, remote, and international teamsEqual Opportunity Employer: Race, Color, Religion, Sex, Sexual Orientation, Gender Identity, National Origin, Age, Genetic Information, Disability, Protected Veteran Status, or any other legally protected group status.Powered by JazzHRaCoWgps8VO"
UX/UI Designer,NA,2023-01-30 12:31:08,https://www.google.com/search?q=Machine+Learning+Jobs+Nepal&ibp=htl;jobs&sa=X&ved=2ahUKEwivuqqJhPD8AhU3HjQIHYXID64QutcGKAF6BAgcEAU#htivrt=jobs&htidocid=5Lc716-y0v8AAAAAAAAAAA%3D%3D&fpstate=tldetail,Fusemachines,Full-time,NA,"Kathmandu, Nepal","About FusemachinesFusemachines is a leading AI strategy, talent, and education services provider. Founded by Sameer Maskey Ph.D., Adjunct Associate Professor at Columbia University, Fusemachines has a core mission of democratizing AI. With a presence in 4 countries (Nepal, the United States, Canada, and the Dominican Republic and more than 250 full-time employees). Fusemachines seeks to bring its global expertise in AI to transform companies around the world.Key ObjectiveUX/UI designer is responsible for creating, visualizing, and implementing strategic user experiences that align user and customer needs with business goals. This role excels as a passionate designer, collaborator, customer advocate, and lifelong learner.Qualifications and Experience• At least 2 years of UX/UI design experience.• A degree in design, information technology/management, or related fields.Required skills/Competencies• Excellent communication, presentation, interpersonal, and analytical skills... including the ability to communicate complex, interactive design concepts clearly and persuasively.• Thorough knowledge of UX design principles and traditional design principles, with expertise in how to apply them within a visual design system.• Proficiency in designing and prototyping with tools such as Figma, Adobe XD, or Sketch.• Experience with design tools such as Photoshop, Illustrator.• Demonstrated strong visual design expertise with the ability to produce fresh, simple, elegant, and exceedingly usable layouts and interactions and iconography.• Experience working in a collaborative team and working directly with developers for the implementation of designs.• Ability to own and drive the design process by independently defining requirements, scoping projects, and prioritizing tasks.• Committed to learning and expanding professional and technical knowledge.• Exceptional organizational and time management skills.Good to have• Knowledge of HTML, CSS, and IxD.• Experience working in an Agile development environment.Key Responsibilities• Translate concepts into prototype designs, which can range from simple paper sketches to high-fidelity and interactive digital mock-ups to help drive the product requirements.• Collaborate directly with clients/stakeholders to understand project/product requirements to solve problems, ideate, imagine, and create high-quality products.• Participate in discussions and presentations, conveying the power and thought behind your UX solutions.• Iterate designs and solutions efficiently and intelligently based on feedback and suggestions received.• Select the most promising idea(s) based on their feasibility, desirability and viability analyzing users need, business need and technical implementation• Conduct user research to identify main user insights and opportunity spaces, and transform the finding into powerful concepts and designs that leads to innovative solutions and best-in-class end-to-end user experiences.• Effectively communicating research findings, design approaches with product management, engineering, marketing, and executive decision-makers• Assist in planning and executing tests to assess the usability of a software product in development with rapid iterative studies, usability assessments, surveys, card sorting, and participatory design sessions.• Ensure design standards, UX guidelines and best practices are adhered toEqual Employment Opportunity: We're proud to be an equal opportunity employer - and celebrate our employees' differences, including race, color, religion, sex, sexual orientation, gender identity, national origin, age, disability, and Veteran status. Differences make us better"
Business Development Representative,NA,2023-01-30 12:31:08,https://www.google.com/search?q=Machine+Learning+Jobs+Nepal&ibp=htl;jobs&sa=X&ved=2ahUKEwivuqqJhPD8AhU3HjQIHYXID64QutcGKAF6BAgcEAU#htivrt=jobs&htidocid=By1no1tikXgAAAAAAAAAAA%3D%3D&fpstate=tldetail,Fusemachines,Full-time,NA,"Kathmandu, Nepal","About FusemachinesFusemachines is a leading AI strategy, talent, and education services provider. Founded by Sameer Maskey Ph.D., Adjunct Associate Professor at Columbia University, Fusemachines has a core mission of democratizing AI. With a presence in 4 countries (Nepal, the United States, Canada, and the Dominican Republic and more than 250 full-time employees). Fusemachines seeks to bring its global expertise in AI to transform companies around the world.About The RoleWith a mix of strong processes and creativity, you will help drive new business revenue through outbound opportunity generation. This is an awesome opportunity to truly learn about AI and Digital Transformation. You will be coming into a sales environment where theres already a prospecting and outreach machine in place but is in need of a captain to steer the ship.You will engage effectively in written form, as well as conduct high-level conversations with experts in the AI space to fuel our companys... growth. On top of that, youll work closely with our own PhDs to help translate their skills into sales value props.You will also work with our Marketing Team to improve our campaigns and messaging, and you will partner closely with our Sales Team to create and execute sales strategies that include sequence building and other content creation.This is a Hybrid Work (a blend of in-office and remote) position.Qualification And Experience• Bachelors Degree completed in any field• Must have 2+ years in a similar fieldRequired Skills/ Competencies• Excellent Communication in English both written & verbal• Problem-solving & Proactive personality• Ability to work independently & in a team with good time management skillsKey Responsibilities• Explore and introduce cold calling and video into outbound campaigns• Respond, engage and qualify inbound leads and inquiries• Collaborate with the sales & marketing team to develop account-based selling strategies• Draft cold emails and build out sales strategies that support all prospecting efforts• Ability to work with team members across different time zones• Monitor Outreach.io and CRM, to stay current on leads and opportunities• Build and maintain reports on the Account Executive sales funnels• Maintain dashboards of weekly key business metrics, including number of sales activities completed, number of sales meetings, etc.• Drive attendance for webinars and live seminars, set meetings for conferencesWork Shift: 3:30 PM to 12:30 AM (shuttle service will be provided by the company)Equal Employment Opportunity: We're proud to be an equal opportunity employer - and celebrate our employees' differences, including race, color, religion, sex, sexual orientation, gender identity, national origin, age, disability, and Veteran status. Differences make us better.Powered by JazzHRCt3ta0BMEX"
Project Management Trainee,NA,2023-01-30 12:31:09,https://www.google.com/search?q=Machine+Learning+Jobs+Nepal&ibp=htl;jobs&sa=X&ved=2ahUKEwivuqqJhPD8AhU3HjQIHYXID64QutcGKAF6BAgcEAU#htivrt=jobs&htidocid=ENhzCFNfjI4AAAAAAAAAAA%3D%3D&fpstate=tldetail,Fusemachines Nepal Pvt. Ltd.,Full-time,NA,"Kathmandu, Nepal","Project Management TraineeLocation: Kathmandu, NepalType: Full TimeDepartment: Asia TechnologyExperience: Entry LevelAbout FusemachinesFusemachines is a leading AI strategy, talent, and education services provider. Founded by Sameer Maskey Ph.D, Adjunct Associate Professor at Columbia University, Fusemachines has a core mission of democratizing AI. With a presence in 4 countries (Nepal, the United States, Canada, and the Dominican Republic and more than 250 full-time employees) Fusemachines seeks to bring its global expertise in AI to transform companies around the world.About the RoleThis role will provide you the opportunity to learn about General Project Management. You will work on projects that will give you hands-on experience with PM tools, project management methodology, and change management. The opportunity will allow you to sharpen your communication and problem-solving skills in a project environment with diverse teams.Duration• 6 monthsQualifications... & Experience• Masters Degree in relevant field (Computer Science/ Management)• Bachelor Degree (Computer Science/ Management) with minimum 2 years of experience• Preferred experience in IT industry*General Responsibilities• Support project managers/ project Leads in managing schedules and milestones; ensuring that weekly project statuses are received from team members• Documenting resourcing needs, availability and commitments• Manage Newsletter• Assisting with documentation and other project deliverables• Coordinating aspects of user testing, producing test cases; scheduling UAT cycles, setting up test data, and participating in UAT• Prepare project status reports• Maintain the project issue log and risk register• Produce and analyze project performance statistics and assist project managers• Organize training and other related sessionsLearning Resources• Internal training program• Access to learning materials• Certification: condition appliedEqual Opportunity Employer: Race, Color, Religion, Sex, Sexual Orientation, Gender Identity, National Origin, Age, Genetic Information, Disability, Protected Veteran Status, or any other legally protected group status"
