Job-Title,Date-Posted,Date-Scraped,Url,Company,Job-Type,Salary,Location,Description
"Engineering Manager, Machine Learning - Mercari",NA,2023-01-30 12:27:10,https://www.google.com/search?q=Machine+Learning+Jobs+Japan&ibp=htl;jobs&sa=X&ved=2ahUKEwiHoOeTg_D8AhXKAzQIHRG4DycQutcGKAF6BAgOEAU#htivrt=jobs&htidocid=kYIevwNKq4YAAAAAAAAAAA%3D%3D&fpstate=tldetail,"Mercari, inc.",Full-time,NA,"Minato City, Tokyo, Japan","This position requires English language ability. JD is available in English only. JDIntroductionOur MissionMercari is a Japan-based company with the mission of create value in a global marketplace where anyone can buy & sell. Having continuously worked toward this goal since our founding in 2013, we are now transforming from a startup into a global player. While this transformation brings its own specific set of challenges, we believe that solving them one after another will allow us to fully achieve our mission. Are you interested in working together to take on these exciting challengesOur CultureTo achieve our mission at Mercari, our organization and each of our employees share the same values and perspectives. Our individual guidelines for action are defined by our three values: Go Bold, All for One, and Be a Pro. Our organization is also shaped by our four foundations: Sustainability, Diversity & Inclusion, Trust & Openness, and Well-being for... Performance. Regardless of how big Mercari gets, the culture will remain essential to achieving our mission and something we want to preserve throughout our organization.We invite you to read the Mercari Culture Doc, which summarizes the behaviors and mindset shared by Mercari and its employees. We continue to build an environment where all of our members of diverse backgrounds are accepted and recognized, and where they can thrive while holding dear Mercaris culture.Position OverviewWhat You'll Do• Engineering managers are committed to creating organizational structures and solving organizational issues, creating a place where engineers can play more active roles.• Mercari's engineering organization has members from a variety of backgrounds. By managing teams with diversified experiences, nationalities, cultures, etc., they are responsible for drawing out the potential of teams and individuals and producing greater results.• The main components of the role are as follows:• Recruiting, training, goal setting, evaluation, and providing feedback to engineers• Maximizing the results of engineer members and supporting career their growth• Assigning engineers to projects and supporting the communication needed to carry them out• Problem solving for the engineering organization as well as proposing and executing growth strategies• Planning and implementation of in-house events to deepen understanding of expertise and organization• Especially, as an engineering manager in the AI/ML teams, you are expected to maximize Mercaris output through machine learning. The AI/ML teams use technology like artificial intelligence, machine learning, and deep learning to improve Mercaris UX, with an emphasis on image recognition, NLP, and algorithms for recommendations.Unique Challenges• We are looking for people that are interested in our services, mission, and values, and want to work where engineers can go bold, use the latest technology, make autonomous decisions, and take on challenges at a rapid pace.Minimum Requirements• Shared understanding and belief in Mercari Group mission and values• Professional knowledge of AI/ML with specialization in at least one of the following:• Natural language processing• Recommendation• Search• Hands-on experience with ML modeling or development experience with ML systems• Experience as a manager for engineers or researchers• Developing and operating large-scale products• Project management experience for machine learning projects• Coordinating with multiple stakeholdersPreferred Requirements• Making technical decisions for a team as a tech lead• Designing the architecture of an entire system• Managing a multicultural team• Experience writing articles/theses in AI/ML fields• Experience creating ML models using large-scale data• Experience training AI/ML engineers and/or researchers• Hiring AI/ML engineers (application screening, interviewing, direct recruiting, event hosting, etc.)• Knowledge of and experience with databases (RDBMS/NoSQL), networks, linux, monitoring systems, logging, operations, and SLO/SLA• Development and operation using microservices architecture• Cloud development experience (preferably GCP or AWS)• OSS contribution experience / familiar with OSS communityScreening Criteria• Check here for more detailsLanguage Requirements• English: Independent (CEFR - B2)• Japanese: Independent (CEFR - B2) preferred*Click here for more information about CEFRWorking ConditionsEmployment StatusFull-time• Probationary period: First 3 months after joining the company. (During this period your contract conditions will be the same as that of a permanent employee.)OfficeRoppongi• Smoking is prohibited within our offices• Mercari has introduced a work style policy called Your Choice. Each member is free to choose whether they want to work in the office or work fully remote. *Exceptions made for certain kinds of work.Work Hours• Full flextime (no core time)• Does not apply to all positionsHolidays• Two days off per week (as well as national holidays, New Year's break, etc.)• Paid leave, congratulatory and bereavement leave, relax days, sick leaveSalary• Annual salary paid in 12 monthly installments (including fixed overtime allowance)• Based on skills, experience, and abilities• Reviewed twice a yearBenefits• Complete health and social insurance• Incentive program• Support systems, including those that benefit employee family members• Language learning support• Translation/interpretation support• See this page for details.Support• Relocation Support• See this page for details.MediaCorporate Sites• Mercari, Inc.• Merpay, Inc. Japanese• Souzoh, Inc.• Mercoin, Inc. Japanese• Merlogi• Mercari USOwned Media• Mercari Careers• Mercari Engineering Portal• Mercan - Introduces the people that make Mercari• Mercari US Careers• Mercari US Blog"
Senior Machine Learning Engineer,NA,2023-01-30 12:27:10,https://www.google.com/search?q=Machine+Learning+Jobs+Japan&ibp=htl;jobs&sa=X&ved=2ahUKEwiHoOeTg_D8AhXKAzQIHRG4DycQutcGKAF6BAgOEAU#htivrt=jobs&htidocid=heG46mwmt2IAAAAAAAAAAA%3D%3D&fpstate=tldetail,CADDi,Full-time,NA,Japan,"DescriptionAlthough the domestic manufacturing industry is estimated to be worth 180 trillion yen, many manufacturers and their suppliers are unable to fully demonstrate their development potential and technological capabilities because they are hindered by quotations and administrative tasks, as well as a lack of sales force and information.CADDis mission is to remove those restrictions in various aspects of the industry and unleash each companys potential to the fullest. We introduce technology to drive digital transformation in the industry so that all manufactures - from small factories and established leading manufactures to new start-ups - can thrive and add new value to the world. Will you bring your skill to create such a future with usUnleash the potential of manufacturing with dataAt CADDi, we have a massive amount of technical drawings, corresponding quotations, along with data describing the required manufacturing processes. By processing these data into a form... that is easier to utilize and quickly implementing the cycle of hypothesis testing, we aim to find answers to the problems faced by the manufacturing industry.Besides what we already have, there is a lot more data out there that hasnt been fully utilized. Assessing valuable data and preparing it for utilization is the key to taking the burden off this industry.Responsibilities• Leveraging existing data assets to discover new value for the corporation• Analysis of base data to obtain hypotheses concerning business and operational improvement• Developing new user-facing features that combine CADDi's domain expertise, data assets, and operational excellenceQualifications• An understanding our mission to unleash the potential of manufacturing• 3+ years of experience utilizing machine learning methods to solve business problems• Experience delivering services in a production environment in the cloud (AWS, GCP, Azure, etc)• Self-driven, and can operate both independently and also as a team member• Able to exercise strong problem solving skills to deliver customer value• Strong fundamental skills in linear algebra, calculus, and statistics• Experience in application development or analysis work with Python, MATLAB, or R• Experience with machine learning frameworks (PyTorch, Tensorflow, scikit-learn, LightGBM, etc)• Experience using SQL for data analysis• Experience using version control systems such as Git• Proficiency in EnglishPreferred Qualifications• Experience with GPU-based data processing (CUDA, OpenCL, etc)• Experience working with data pipeline technologies such as Airflow, Apache Beam, Spark, etc.• Past participation in data analysis contests such as Kaggle• Comfortable reading research papers from major journals• Experience utilizing numerical optimization methods (continuous, discrete, or combinatorial)For overseas candidates• Full Time Position In Japan Base• Relocation support is available• Visa support is available• Japanese language educational support is available• Remote working in Japan working hours (while waiting for Visa)• We can guide you to the next step quickly if you could mention the following point in your application email.• Willing to relocate to Japan once visa is granted• Able to work full time JST 9:00-18:00JST11:00-20:00 while waiting for visa"
Senior Software Engineer,NA,2023-01-30 12:27:11,https://www.google.com/search?q=Machine+Learning+Jobs+Japan&ibp=htl;jobs&sa=X&ved=2ahUKEwiHoOeTg_D8AhXKAzQIHRG4DycQutcGKAF6BAgOEAU#htivrt=jobs&htidocid=T8Kw3ImJ_lsAAAAAAAAAAA%3D%3D&fpstate=tldetail,株式会社RevComm,Full-time,JP¥8M–JP¥13M a year,"150-0002, Japan","RevCommAI  Voice  CloudSaaSAIAIMiiTelAIMiiTel for Zoom Forbes JAPAN2TOP20ASPIC IoTAI--B-Dash Camp AWS Startup Architecture of the year TechCrunch Tokyo   100Forbes JAPANTOP20INTERSPEECHAIIPMiiTel41,65043,800AIMiiTel for... ZoomGlobal20211050SaaSGrowth PlanVerticalHorizontalParallelGeographical4HRTechMedTechEdTechAbout RevComm, Inc.We are a SaaS company providing AI x voice x cloud software and databases with a focus on the sales domain.We develop and provide ""MiiTel,"" a voice analysis AI phone, and ""MiiTel for Zoom,"" an AI-powered online business negotiation analysis tool, using artificial intelligence (AI) technology.AwardsWe have earned a variety of awards, including being ranked in the TOP 20 of Forbes JAPAN's ""Entrepreneurial Ranking of Japan"" for two consecutive years.Industry-Academia CollaborationConducted joint research with Kyoto University, University of Tsukuba, and Kyushu Institute of Technology.GlobalPaid services will be available in Indonesia in 2021 and are being used by local companies.Growth PlanOur growth strategy is oriented in four directions: Vertical, Horizontal, Parallel, and Geographical.MissionValueMissionRevCommAIValueH appinessA ccountabilityP assion P rofessionalism Y outhfulness RevCommOur missionvalueMissionReinventing communication to create a society where people think of othersWe develop the latest voice technology leveraging Artificial Intelligence to eliminate friction in communication and create a society where people can better communicate with each other.ValueH appiness  Always smilingA ccountability  Trusted by people & societyP assion   PassionateP rofessionalism  Deliver intrinsic value to the worldY outhfulness  Flexible and creative.Main BusinessOur challenge is to reinvent communication to create a society where people think of others. Most recently, we have been developing AI x Voice x Cloud software/database, and as our first corporate service, we are providing cloud IP phones equipped with voice analysis AI to visualize Sales & CS communication.Sales increase Real-time scoring of Sales & CS talk, automatic transcription & summary, sharing of excerpts and more. It helps to improve communication quality between related parties and increase appointment rates, conversion rates, and customer satisfaction rate all at once.Cost reduction Reduce training costs by visualizing Sales & CS talks with AI and quantitatively evaluating the issues of each representative.By integrating with CRM/SFA, man-hours for after call work, management, and incoming/outgoing calls will be reduced, and productivity will be improved.By eliminating hardware such as telephones and PBXs (phone server), fixed costs are greatly reduced.Business domain• The first market area we will tackle is the B2B Inside Sales & CS market.• There are three steps in business strategy:1st Step: Sales Optimization,2nd Step: Meeting Optimization, (we are here)3rd Step: Business Decision Optimization. Ultimately, we will build a platform to create AI for business decision making.• In B2C, we would develop voice UI services such as communication bots in mid-long term.Role responsibilityAs a senior engineerTech Lead, you lead the technical growth of the team.Responsible for designing, building, and scaling Machine Learning services.Responsible for designing, building, and operating service systems (e.g. health, availability, latency).Coordinate QCD (quality, cost and delivery) with stakeholders.Work with research engineers and introduce Machine Learning services into RevComm products.Resolve technical issues which are requested from customers and internaldependencies.Why you joinA best-in-class product in one of the fastest-growing market segments. More than 1,000 companies use and love our product.You are able to keep learning new technologies. Our engineering team consists of top talent from top tier companies.Our products are meeting the needs of our customers and our business is growing rapidly. We are currently handling over 150,000 calls per day. Our products are used daily by our customers and contribute directly to their sales, so high quality and stability is a must.We value the ownership and leadership of our members. Each member takes the initiative on the projects to achieve the team's goals. We are building a self-organized team.RequirementsMindset: Empathy for the mission and corporate value(1) Mission: To reinvent communication and create a society where people think of others.(2) Corporate Value: HAPPYH appiness  Always smilingA ccountability  Trusted by people & societyP assion  PassionateP rofessionalism  Deliver intrinsic value to the worldY outhfulness  Flexible and creative.Skill Set5+ years of professional software engineering experience.Familiar with Python or Golang.Expertise designing and operating REST or gRPC services.Expertise building CICD by such as GitHub Actions.Experience in using AWS and Kubernetes.Experience in leading a team. A proactive, kind, and collaborative mindsetExtra skillsExperience in operating MLOps.Experience in using MLOps toolings such as Kubeflow, MLFlow and Sagemaker.Experience in operation workflow engines such as Airflow and Argo workflows.Experience in working with Machine Learning researchers or data scientists.Understanding of Machine Learning works.Contribution to OSS.Work experience in an English-speaking company or business-level English skills.What we are looking forThe ability to work well in a team environment.The person who is good at thinking and communicating logically.High motivation for personal growth. / Senior Software Engineer 8,000,000  13,000,000Conditions will be determined by experience and ability.Overtime pay is included for 45 hours.150-0002 Hulic Shibuya 1-chome Building 7F, 1-3-9 Shibuya, Shibuya-ku, Tokyo8 minutes walk from Shibuya stationNo transferFull remote workWorking HoursFull flex timeVacationWeekends off / National holidaysYear end holidaySummer vacationPaid vacation5 days of paid vacation granted after 3 months of employment, and 5 more days of paid vacation granted after 6 months of employment. 10 days of paid vacation granted in total.Family leave1 day off for the birthdayBereavement leaveSick leaveNational holidaysEmployee benefitsIT Health InsuranceRemote allowanceTravel expensesSocial insurance availableHaving side jobs is okayStock Options15% ruleProbationary period6 month probationary period. The working conditions are the same as in the offer letter.Employment StatusFull-time employees or contract employees.Hiring process1. Resume and CV check2. Soft skill interview3. Hard skill interview4. CxO interviewDetails will be provided by HR.In some cases, coding tests are performed.RevComm93,500 185  1942023 1 103-4405-46211-3-9 7 AI  Voice  Cloud"
Machine Learning Research Intern for Gastronomy,NA,2023-01-30 12:27:11,https://www.google.com/search?q=Machine+Learning+Jobs+Japan&ibp=htl;jobs&sa=X&ved=2ahUKEwiHoOeTg_D8AhXKAzQIHRG4DycQutcGKAF6BAgOEAU#htivrt=jobs&htidocid=feVdL5eRH1QAAAAAAAAAAA%3D%3D&fpstate=tldetail,Sony AI,Full-time,JP¥3.5M–JP¥5.01M a year,Japan,"Sony AI is seeking research interns from all levels (BS, MS, and PhD.) with expertise in artificial intelligence, machine learning, and closely related areas to join our Gastronomy team. The internship requires a minimum of 3-months duration. During the internship, you would be paired with mentors and work with them closely on all aspects of research, from defining research problems to developing new ML solutions to presenting your findings at top publication venues. The vast scope of the Gastronomy project provides you with a lot of creative flexibility to explore things and learn. More about the project can be found here.Roles and Responsibilities• Conduct fundamental and innovative research in machine learning within the Gastronomy domain, including but not limited to, multisensory (vision, speech, olfactory, gustatory, and haptic) perception learning, human-in-the-loop learning, etc.• Research and develop innovative machine learning strategies for novel recipe creation that... includes important aspects such as health and sustainability.• Construct multisensory datasets (related to food) from scratch.• Collaborate with a diverse team to integrate your research into products.• Write code to support research, usually in Python.• Write reports and give presentations for internal audiences.• Publish influential research outcomes at top-tier CV conferences.Required Qualifications and Skills• Pursuing PhD, Masters, or Bachelors degree in Machine Learning, Computer Science, Data Science or related field.• In-depth expertise in one or more of machine learning, deep learning, computer vision, optimization and/or NLP.• Experience with and/or enthusiasm for building datasets from scratch.• Excellent communication and presentation skills.• Proven ability to implement software in Python.• Familiarity with deep learning frameworks, in particular PyTorch.• (Preferred) Experience with cloud computing, in particular AWS.• Excellent oral and written English. Japanese language skills are a plus but not a necessity.Preferred Qualifications• Experience or interest in modeling/understanding multisensory (image, speech, olfactory, haptic, and gustatory) perception.• Familiarity with user research and constructing datasets.Working LocationLocation Flexible"
"Data Engineer, Machine Learning Development",NA,2023-01-30 12:27:11,https://www.google.com/search?q=Machine+Learning+Jobs+Japan&ibp=htl;jobs&sa=X&ved=2ahUKEwiHoOeTg_D8AhXKAzQIHRG4DycQutcGKAF6BAgOEAU#htivrt=jobs&htidocid=f4Tzh5jjkGUAAAAAAAAAAA%3D%3D&fpstate=tldetail,Woven Planet,Full-time,NA,"Tokyo, Japan","Woven Planet is building mobility for a safer, happier and sustainable world. A subsidiary of Toyota, Woven Planet innovates and invests in new technologies, software, and business models that transform how we live, work and move. With a focus on automated driving, smart cities, robotics and more, we build on Toyota's legacy of trust and safety to deliver mobility solutions for all.For nearly a century, Toyota has been delivering products and services that improve lives. Automation that originated to increase the efficiency of daily activities has evolved into the safe, reliable, connected automobiles we enjoy and depend on today. Now, we are looking to the next 100 years and to extending that dream for a better life for all people from cars to smart cities.Our unique global culture weaves modern Silicon Valley innovation and time-tested Japanese quality craftsmanship. The complementary strengths enable us to optimize safety, advance clean energy and elevate well-being. We... envision a human-centered future where world-class technology solutions expand global access to mobility, amplify the capabilities of drivers, and empower humanity to thrive.THE TEAMThe Toyota Woven City is a fully connected ecosystem powered by hydrogen fuel cells to be built at the base of Mt. Fuji in Japan. It is envisioned as a living laboratory and ever evolving, incorporating various types of cutting edge technologies. At the same time, it is also human-centric, that is, it is expected to keep people safe and comfortable.Woven Citys R&D team will develop innovative products and services using technologies developed by Toyota Motor Corporation.Our mission is to:1. Develop services and products for Woven City2. Expand capabilities through long-term R&DToyota Motor Corporation has been involved in a variety of technological development in the robotics, energy, and automotive domains for a long time. Our team will leverage Toyotas hardware expertise in these fields to create new value by developing software on top of this.Our team will develop innovative services that are essential to the city. As a first party developer, we will also build a foundation upon which third party partners can participate. Therefore, we are responsible for not just the applications but also the core software and capabilities.Our team consists of many highly experienced members with international work experience. We strive to be open minded as we create a new culture with members from various backgrounds and nationalities. Our global team works closely with the Toyota Motor Corporation and the Toyota Research Institute in North America to develop our technologies and products.We are seeking talented people to join us as we take on new challenges to create new products and services for the Toyota Woven City.For more information about Woven City, please visit: https://www.woven-city.global/WHO ARE WE LOOKING FORWere looking for software engineers who are passionate about creating AI-microservice platforms.We will estimate human activities in Woven City to predict their future decisions and to promote behavior change. Our platforms will be available for inventors and accelerate their innovations. We can develop microservices (such as combined API) for mobility, energy management, healthcare, and other services in Woven City.You will be responsible for driving the entire process of development and implementation, starting with defining the cross-functional specifications.RESPONSIBILITIES• Lead design of microservices using machine learning for Woven Citys service• Architect, build, and maintain microservices platform• Design, implement, and test high quality APIs• Exercise technical judgment in working with large, cross-functional teamsMINIMUM QUALIFICATIONS• Bachelor's degree in Computer Science or related field• 7+ years of production development experience in 2+ general programming languages (python/C++/Java/Go, etc.)• 3+ years software coding experience in machine learning (preprocess/integration test)Add a list• Strong experience in container tools (docker, kubernetes, etc.)• Strong experience in API design (REST, gRPC, OpenAPI Specification)• Business level proficiency in English and JapanesePREFERRED QUALIFICATIONS• High motivation for catching up with cutting edge technologies• Experience in modern software development tools (JIRA, GitHub, CI/CD tools, etc.)• Experience in cloud service (AWS, GCP, etc.)If you are currently located outside of Japan we will set an interview over Google Hangout Meet or Skype.WHAT WE OFFERCompetitive Salary - Based on skills and experienceWork Hours - Flexible working time with NO core-hoursPaid Holiday - 20 days per year (prorated)Sick Leave - 6 days per year (prorated)Holiday - Sat & Sun, Japanese National Holidays, and other days defined by the companyJapanese Social Security - all applicable (Health Insurance, Pension, Workers Comp, and Unemployment Insurance, Long-term care insurance)Employee BenefitsIn-house Training Program (software study/language study)By submitting your application you agree to the following terms:https://www.woven-planet.global/careers/privacy-policyOUR COMMITMENTWe are an equal opportunity employer and value diversity.We pledge that any information we receive from candidates will be used ONLY for the purpose of hiring assessment"
