Job-Title,Date-Posted,Date-Scraped,Url,Company,Job-Type,Salary,Location,Description
"Principal Applied Scientist, Machine Learning",NA,2023-01-11 18:15:36,https://www.google.com/search?q=Machine+Learning+Jobs+New+Zealand&ibp=htl;jobs&sa=X&ved=2ahUKEwjy6ofR7cD8AhWvIEQIHX1RBTQQutcGKAF6BAgSEAU#htivrt=jobs&htidocid=AoDwDaguR1sAAAAAAAAAAA%3D%3D&fpstate=tldetail,Xero,Full-time,NA,"Auckland, New Zealand","We are the Data Team. A collective of specialists driven by our shared mission to help establish Xero as the most insightful and trusted small business platform. Our backgrounds and work are diversewe work on data platforms, data modelling, application development, applied research, ethics, literacy, and strategy, to name a few. At the heart of our mission is helping our colleagues and customers get value from data responsibly, on robust data platforms, with robust methods. Applied Scientists work in cross-functional teams (engineers, designers, product managers, etc) to create AI-powered experiences. We apply machine learning to develop products that reduce toil and provide insight, allowing small businesses to focus on what matters. Theres a myriad of job titles out there and the English language can only express so much in a couple of words. So role title aside, what were looking for is someone to: About the role:  Provide leadership to cross-functional teams that build... web-scale ML products  Work with your peers and the Data Leadership Team to define the roadmap for Applied Sciences  Identify cross-cutting opportunities to create frameworks / tooling and improve data quality  Work with other scientists to figure out the best practices for reproducible and robust science, before documenting and evangelising them  Keep up-to-date with the latest developments in ML, identifying opportunities for Xero to improve #beautiful products.  Be comfortable with pushing the frontiers of ML in the pursuit of delivering products, but only where absolutely necessary  Teach colleagues around Xero about how use data the right way  Make sure our work is always in the best interests of our customers  Align multiple programs of work so that they benefit each other  Identify new ML product opportunities and work with product teams to determine if theyre worth pursuing  Create the culture that makes people love working with us  Mentor, manage, and develop other scientists and colleagues About you:  You have extensive experience delivering web-scale production machine learning systems  You rejoice in identifying tough problems that can be solved with scientific thinking  You understand that solving worthwhile problems means covering all areas of the data lifecycle - finding it, understanding it, experimenting with it, despairing over it, fixing it,   Youre comfortable reading ML research papers, keep abreast of new work on arXiv.org and have on occasion spent your time tinkering around with that interesting new framework you read about recently ... but when it comes down to it, you want to solve real business problems in the simplest and most robust way possible  Youre comfortable working with experts from all corners of the company to deeply understand the customer problem before getting your hands dirty with all that data and code  Experience as a hands-on practitioner building productionized machine learning pipelines which touch real human end users  You have a solid grasp of statistics and you have wrestled with the challenges inherent in actually measuring the impact of your machine learning pipelines in the wild  Youve learned through experience that its important to write testable, repeatable code so you can debug it when something goes bump in the night  You know your way around the nix command line, ssh your way happily around your multiple running AWS instances and are a competent programmer in Python, Scala or similar  Youve mentored and grown teams of applied scientists, teaching the skills of scientific reasoning, collaboration, and effective program delivery. What you'll bring:  Ability to translate between the business and machine learning domains  Sound software engineering skills in Python, Scala, or similar  Expert level hands on practitioner skills in one or more of: time series forecasting, natural language processing, classical machine learning, deep learning  Ability to grasp and teach the mathematical concepts that underpin the domains outlined above  Comfortable with version control and command line  Strong communication skills and the ability to tailor a message for peers, senior stakeholders, and junior team members alike  Ability to mentor and grow junior scientists"
Data Scientist,NA,2023-01-11 18:15:37,https://www.google.com/search?q=Machine+Learning+Jobs+New+Zealand&ibp=htl;jobs&sa=X&ved=2ahUKEwjy6ofR7cD8AhWvIEQIHX1RBTQQutcGKAF6BAgSEAU#htivrt=jobs&htidocid=1S-k1OeTT1EAAAAAAAAAAA%3D%3D&fpstate=tldetail,Partly,Full-time,NA,New Zealand,"Note: Partly is headquartered in Christchurch but has employees spread across NZ, AU and UK. If relocating to Christchurch, we would cover those costs. If working remote, we would pay for any visits to HQ (at least once per quarter).  Our story Partly's mission is to connect the world's parts and we're doing that by building the first global platform for replacement parts, starting with auto parts. Our big vision is to accelerate the world towards a sustainable future where waste is eliminated and all replacement parts are universally searchable, accessible and available to all. We've more than tripled our team over the last 12 months and expect to double in size again over the coming 12 months. We're a global team spanning both Europe and Australasia. Founded by ex-Rocket Lab engineers, we utilise bleeding-edge technology to solve challenging but exciting problems that make a huge impact in a $1.9 trillion industry. We provide a scalable digital infrastructure solution to some... of the world's largest businesses and the most exciting startups. Partly's solutions are integrated across hundreds of companies globally, providing the backbone for cataloguing and managing parts online. Blackbird Ventures (Canva, CultureAmp etc.) led both our Pre-Seed and Seed rounds, alongside I2BF (NYC), Hillfarrance, Icehouse, Peter Beck (Rocket Lab), Akshay Kothari (Notion Co-Founder) and Dylan Field (Figma Co-Founder). We're continuing to build a world-class team and ensuring Partly is a place where people can do the best work of their lives. We're proud of the culture we've built at Partly, and our values are lived throughout every experience.  This role You will be joining a team of incredibly ambitious and talented engineers and data scientists to tackle hard and exciting problems using cutting-edge research. This is an opportunity to work in an extremely fast-paced environment and take on rewarding challenges and responsibilities. You will report to Tim Grunshaw (Director of Engineering).  What will you do  Data mining and modelling  Work with graph and text data  Automate data ingestion process Your skills  Experience in machine learning  Experience in data mining  Experience with structuring and processing unstructured data  Experience with data acquisition  (Strong bonus) Experience in the automotive parts industry  (Strong bonus) Experience with graph machine learning and algorithms  (Bonus) Experience with graph database  (Bonus) Experience with NLP Benefits  Competitive base salary plus equity. Even though were a small startup, we offer competitive salaries and great equity.  Parental leave and flexible return to work. After returning to work, primary carers can work 4-day weeks for 100% of their pay for the first twelve weeks. For secondary carers, we offer 10 days of leave at full pay.  Flexible working hours. Were office-first, but are flexible with hours and working from home when you need to.  A brand new architecturally designed office in Christchurch CBD. With free snacks, drinks on tap, two different coffee machines, social areas, and one of the best cafes in Christchurch 50m away.  Monthly team lunches to celebrate our wins and enjoy each other's company outside the office.  Ergonomic workspace. Sit-stand desks, ergonomic chairs, quiet spaces, and collaboration spaces to suit all kinds of working styles"
Computer Vision Developer,NA,2023-01-11 18:15:38,https://www.google.com/search?q=Machine+Learning+Jobs+New+Zealand&ibp=htl;jobs&sa=X&ved=2ahUKEwjy6ofR7cD8AhWvIEQIHX1RBTQQutcGKAF6BAgSEAU#htivrt=jobs&htidocid=qGv_PWpcYTIAAAAAAAAAAA%3D%3D&fpstate=tldetail,Fingermark,Full-time,NA,"Havelock North, New Zealand","About Fingermark Fingermark are a global tech company based in New Zealand with offices in Australia, Brazil, UAE and the United States. For over 15 years they have been a world leader in digital transformation and lead the way in the development of Artificial Intelligence (AI) and associated hardware products for the Quick Service Restaurant (QSR), Retail and Industrial sectors. Fingermark design, build and deploy leading-edge digital technology solutions enabling operational efficiency, revenue gains and enhanced customer experiences. From AI software with real-time business analytics and consultancy through to kiosks and menu boards - they design fit-for-purpose innovative solutions and ecosystems. Fingermark researches and develops game-changing, innovative technologies that support their vision: to revolutionise customer speed of service. To continue delivering to this vision around the world, Fingermark are looking for a talented Computer Vision Developer. About the... opportunity As the Computer Vision Developer, you will be working in a very dynamic team environment across multiple technologies and disciplines. Your primary role will be designing and applying computer vision and deep learning algorithms to solve complex data mining, pattern recognition and object detection problems. This is a key role helping to deliver outstanding products to our worldwide customers. We have an interest in the following areas of experience:  Breadth of knowledge across computer vision and deep learning development, and architecture  Research of recent deep learning, computer vision, and computer architecture developments  Ability to understand and implement cutting edge deep learning techniques  Experience delivering computer vision-based products including practical coding experience  Experience developing algorithms with computer vision technologies  Experience with DNN models and frameworks (e.g. Yolo, SDD, Darknet, Tensorflow, Caffe)  Serverless, Lambda, DynamoDB, RDS, CloudWatch  API design and build - REST, GraphQL  Microservices design and development  Containers, e.g. Docker, Helm  Terraform, Serverless  SSH tunnels, VPN  Continuous integration/deployment  Git, Bitbucket  Monitoring (Grafana, Prometheus)  Strong working knowledge of Linux  AWS, Google Cloud Platform  Data science and engineering, simulation/queue modelling experience desirable  Neural networks experience  Demonstrated programming skills with Python  Analytical and creative problem-solving skills  Team player and self-motivated  Ability to work in an Agile environment This is an exciting time join the Fingermark team - we are in a growth phase with customers and opportunities in multiple global markets. We are in the business of providing next generation connected experiences utilising an effective combination of hardware and software. We aim to make it easier for people to lead their busy lives"
AI Research Scientist,NA,2023-01-11 18:15:38,https://www.google.com/search?q=Machine+Learning+Jobs+New+Zealand&ibp=htl;jobs&sa=X&ved=2ahUKEwjy6ofR7cD8AhWvIEQIHX1RBTQQutcGKAF6BAgSEAU#htivrt=jobs&htidocid=xVOOO3o8b-EAAAAAAAAAAA%3D%3D&fpstate=tldetail,Altered State Machine,Full-time,NA,"Auckland, New Zealand","Altered State Machine (ASM) are looking for world-class AI Research Scientists to work on our Core Research Track. We are welcoming applicants from anywhere in the world. As part of the Innovation team you will work in developing novel deep learning models towards solving and building the next generation of AI generative models. This team will solve the most challenging problems in AI innovation & aim to be first and top of the world. ASM are creating the worlds first protocol for decentralised and democratised Artificial Intelligence, owned and traded using NFTs, and interoperable across the Metaverse. Our protocol enables anyone to own AI, and the machine learning models that define what it learns over time. These are paired with artwork in the form of NFT's to create non-player agents. We're creating a world where everyone can own, understand, trust and benefit from their AI. Join us in building the #OpenMetaverse. Help to push the boundaries of future innovation. Key... responsibilities:  Design, implement, and evaluate models and software prototypes.  Report and present research findings and developments, including status and results, clearly and efficiently, both internally and externally, verbally and in writing.  Work with external collaborators and maintain relationships with relevant labs and partners and key stakeholders as appropriate. In order to set you up for success as a Research Scientist at ASM, we look for the following skills and experience:  Ph.D. in a related area, e.g. Computer Vision, Computer Graphics, VR/AR/MR.  Relevant experience to the position such as post-doctoral roles, a proven track record of publications from conferences e.g. Siggraph, ICCV, CVPR, ECCV, AAAI, NIPS.  Practical experience in research of AI models, e.g. transformers, diffusion models, VAE/GAN.  Real passion and experience in AI generative area  *Please submit your publications when applying.** We're a great place to work at  Experienced and wickedly talented team and growing  Venture funded by a consortium of leading crypto investors and more every day  Plenty of opportunity  Real work-life balance We can offer  Great variety (no two days are the same)  Exciting international projects  Engaging with global AAA gaming companies, game platforms and investors  The right salary  Flexibility with WFH options  The chance to be part of the next generation of the internet the decentralised Metaverse Were looking for people to help us build the future of AI and gaming in Web3. If the above sounds like you and the idea of new technologies, gaming and the Metaverse excites you, wed love to chat"
Data Scientist,NA,2023-01-11 18:15:39,https://www.google.com/search?q=Machine+Learning+Jobs+New+Zealand&ibp=htl;jobs&sa=X&ved=2ahUKEwjy6ofR7cD8AhWvIEQIHX1RBTQQutcGKAF6BAgSEAU#htivrt=jobs&htidocid=c7PVETEaFnAAAAAAAAAAAA%3D%3D&fpstate=tldetail,New Zealand Transport Agency,Full-time,NA,"Auckland, New Zealand","Join the data science team at an exciting time of growthExplore modelling and machine learning techniques with large, complex datasetsWellington or Auckland-basedProvide data science, statistical and modelling expertise to help NZTA decision makers and those in the wider land transport sector solve complex problems and challenges. The opportunity  Te Whiwhinga mahi The Data Science team sits in and is part of the Research and Analytics team at the Agency. It aims to provide an evidence base to support and underpin smarter, evidence-based decisions, for NZTA decision makers and those in the wider land transport sector. As part of the Advanced Analytics and Modelling team you will be making a difference to everyday lives of New Zealanders. Working closely with the Transport Agency's delivery groups, you will provide data science, statistical and modelling expertise to solve complex problems and challenges. The role gives you the opportunity to build strong working relationships with... key stakeholders to identify opportunities that would benefit from data science or other advanced analytical techniques. Your relationship with these stakeholders will be key to success and you are seen as a though-leader by providing advice as well as solutions. The team is working in a number of emerging areas including real-time predictions; risk scoring through advanced analytical and modelling techniques; forecasting; modelling transport accessibility; graph analytics; and evaluating the effectiveness of road engineering initiatives. You will be a self-starter who is comfortable working with complex and often challenging data. We are looking for individual with a curious and inquisitive mind, looking to step into a position to explore and create an impact. About you  Ko wai koe To be successful in this role, you will bring: An advanced level of statistical programming (SQL, Python and/or R)Experience in statistical interpretation and complex analysis, including the ability to find stories and insights in dataKnowledge of ETL processes and experience working in a server-based environmentExperience in developing both training and inference systems for machine learning pipelinesComfortable working on cloud environments (preferably Azure)Familiarity with code versioning tools (Git, Github, Azure DevOps)An understand of information security and discretionAn ability to build and maintain relationshipsGood verbal and written communication skillsA relevant post graduate qualification in statistics or another discipline requiring the analysis of complex dataClick here to view the position description. About us  Ko wai mtou At Waka Kotahi, the NZ Transport Agency, it all starts with our people. The organisation's performance and success depends on the people who choose to make this a great place to work and make a difference for Aotearoa. The Transport Agency has a strong future focus, understanding that new technologies and changing customer expectations mean the transport system we know today will not be the one we deliver in ten years time. Along with our other benefits we also have new Waka Kotahi Life, Income Protection and Critical Illness Insurance scheme available for permanent employees. R Katinga  Applications close: 2 August 2022For further information, email: careersnzta.govt.nzTo be considered for this position you must have a legal right to live and work in New Zealand.Waka Kotahi is an equal opportunity employer (EOE). At the Agency we recognise the importance of diversity and inclusion and are committed to providing a working environment that embraces these values. Please let us know if you need any support or have any access requirements that will help you through the recruitment process.Please note that we may begin shortlisting as we receive applications. We encourage early applications as we may withdraw the advertising at any time"
Data Scientist,NA,2023-01-11 18:15:40,https://www.google.com/search?q=Machine+Learning+Jobs+New+Zealand&ibp=htl;jobs&sa=X&ved=2ahUKEwjy6ofR7cD8AhWvIEQIHX1RBTQQutcGKAF6BAgSEAU#htivrt=jobs&htidocid=QI9qXH230EIAAAAAAAAAAA%3D%3D&fpstate=tldetail,AIA,Full-time,NA,"Auckland, New Zealand","At AIA, our promise is to help people live Healthier, Longer, Better Lives by encouraging them to make positive lifestyle changes one step at a time. Our firm belief is that by following our Operating Philosophy of doing the right thing, in the right way with the right people, the results will come. AIA Insurance for Life, Health and Wellbeing. The opportunity : We have a unique and exciting opportunity to join our Data Analytics team as a Data Scientist. We are on the lookout for someone to be responsible for designing and implementing advanced analytics, statistical, modelling and machine learning solutions supporting a variety of business challenges and opportunities. You will work intimately with the business to define, shape and implement proposition (product, pricing), distribution, digital, marketing operational and risk management strategies. About the role : Some of the key responsibilities include : Supporting strategy, planning and ideation processes with... stakeholders Supporting briefing and reverse briefing Undertaking data discovery and quality profiling Collating data from data warehouses, marts, disparate internal and external sources and preparation as required Model selection, recommendation, building, testing, training and execution Delivery of insights through written reports, visualisations, stakeholder engagement and presentations Model deployment Determination and measurement of appropriate KPIs for performance monitoring to measure the success of your insights Prototyping, experimenting and user experience work may be required from time to time About you : For this role, you will need the following skills and experience : 2+ Years experience as a data scientist i.e. on the tools, building, deploying and managing models or 5+ Years experience as a data analyst with statistics / data science background and demonstrated ability to learn and grow quickly. Tertiary and post-graduate statistics or data science / analytics qualification preferred Technical certifications (e.g. SQL, R, Python, Tableau) an advantage. Experienced in data science, data engineering, statistical and financial modelling, supervised and unsupervised machine learning, visualization and model governance. Advanced technical skills with T-SQL, R, Python and Tableau Commercial acumen, business process understanding and financial services experience. Ability to consult with and influence senior business and technical stakeholders to optimize data solutions between both business and technical objectives. Inquisitive, problem solver and analytical commercial thinker. Ability to deliver business outcomes, create cut-through and deal with ambiguity. Be able to anticipate, plan for and overcome roadblocks; define and agree strategies for technical, project delivery, story telling, and change management. Why choose AIA : At AIA, weve made a promise to help people live healthier, longer, better lives. And it starts with our own people. We invest in training and development to build on your current skills Career development through internal mobility opportunities Work for a business helping make positive health and wellbeing changes to the lives of New Zealanders Access additional leave days to recharge and refresh yourself Enjoy wonderful Health and Wellbeing initiatives that support you Work with supportive and inclusive managers Flexible working arrangements Whats next If youre passionate about making a difference then click the Apply Now Button! Recruitment Agencies : Our Talent team does not require any recruitment agency support. Interested Candidates : Apply using the Apply  button. No emailed applications accepted. For general enquiries only, contact"
AI Researcher,NA,2023-01-11 18:15:40,https://www.google.com/search?q=Machine+Learning+Jobs+New+Zealand&ibp=htl;jobs&sa=X&ved=2ahUKEwjy6ofR7cD8AhWvIEQIHX1RBTQQutcGKAF6BAgSEAU#htivrt=jobs&htidocid=WwB4SHbLCzIAAAAAAAAAAA%3D%3D&fpstate=tldetail,Altered State Machine,Full-time,NA,"Auckland, New Zealand","Altered State Machine (ASM) are looking for world-class AI Researchers to work on our Product Feature Track. We are welcoming applicants from anywhere in the world. As part of the Innovation team you will work in applying novel deep learning models towards designing the next generation of AI generative features. You will use the models invented by the Core AI Research team, and any open-sourced AI projects from the rest of the world, e.g. stable diffusion to build advanced AI features. ASM are creating the worlds first protocol for decentralised and democratised Artificial Intelligence, owned and traded using NFTs, and interoperable across the Metaverse. Our protocol enables anyone to own AI, and the machine learning models that define what it learns over time. These are paired with artwork in the form of NFT's to create non-player agents. We're creating a world where everyone can own, understand, trust and benefit from their AI. Join us in building the #OpenMetaverse. Help to... push the boundaries of future innovation. Key responsibilities:  Implement, and evaluate models and software prototypes.  Report and present research findings and developments, including status and results, clearly and efficiently, both internally and externally, verbally and in writing.  Work with external collaborators and maintain relationships with relevant labs and partners and key stakeholders as appropriate. Requirements In order to set you up for success as an AI Researcher at ASM, we look for the following skills and experience:  M.S. / Ph.D. in a related area, e.g. Computer Science, Machine Learning, Artificial Intelligence.  Practical experience in AI models, e.g. transformers, diffusion models, VAE/GAN.  Real passion and experience in AI generative area Benefits We're a great place to work at  Experienced and wickedly talented team and growing  Venture funded by a consortium of leading crypto investors and more every day  Plenty of opportunity  Real work-life balance We can offer  Great variety (no two days are the same)  Exciting international projects  Engaging with global AAA gaming companies, game platforms and investors  The right salary  Flexibility with WFH options  The chance to be part of the next generation of the internet the decentralised Metaverse Were looking for people to help us build the future of AI and gaming in Web3. If the above sounds like you and the idea of new technologies, gaming and the Metaverse excites you, wed love to chat"
