Job-Title,Date-Posted,Date-Scraped,Url,Company,Job-Type,Salary,Location,Description
NLP Developer,NA,2023-01-30 12:26:59,https://www.google.com/search?q=Machine+Learning+Jobs+Japan&ibp=htl;jobs&sa=X&ved=2ahUKEwiHoOeTg_D8AhXKAzQIHRG4DycQutcGKAF6BAgOEAU#htivrt=jobs&htidocid=uEA4oF2l8hMAAAAAAAAAAA%3D%3D&fpstate=tldetail,Yaraku,Full-time,JP¥4.2M–JP¥5.04M a year,"Tokyo, Japan (+1 other)","About YarakuYaraku is a small start-up located in Shibuya, Tokyo. Our focus is primarily on our web-based Translation Management System application.Work deeply without interruptionsAs developers, we love getting in a flow state, where we become so fully absorbed in programming that almost magically time stands still as code pours out of our fingers. The enemy of this state is interruptions, and so weve built a culture that avoids them. For instance, rather than having someone come over to your desk to ask a question, theyll send you a message through Slack (and youre free to turn on do not disturb mode so you dont get annoying notifications). If youre the kind of developer who likes to pop in your headphones and code in silence for hours on end, this is the place for you.Freedom and responsibilityYoull get to choose the tasks you work on, and be responsible for all stages of development: from design to implementation to testing to deployment. We take a hands off... approach to management, and so no one is going to tell you exactly how to do something. Rather, youll have the freedom to choose yourself what approach to take, and even which technologies to use.Craft quality codeWe know that taking the time to create clean, quality code pays dividends in the future. Management understands this, and so rather than being pushed to quickly hack something together, youll have the time needed to create beautiful code.Your gateway to JapanOur team is made up of international developers from around the world, and English is our common language around the office. If youre looking to move to Japan, we welcome you to apply - no Japanese is required and you dont need to be living in Japan yet.Our response to COVID-19Employees are working from home and will continue remote work in the foreseeable future. For overseas candidates, well have you work remotely until we can secure you a visa.About the positionAs an NLP Developer, youll be responsible for the conceptual and theoretical aspects of language-related features in our application. Youll work closely with the development team to apply NLP-related research into a practical, production-ready implementation.SkillsExperience with Natural Language Processing (NLP)Able to take research articles and journals and apply practicallyKnowledge of Web DevelopmentBachelors degree in relevant field or 10-years Work Experience (for Visa purposes)PlusesExperience with NLP-driven applications is a plusExperience with AI or Machine Learning is a plus.Experience or knowledge of DevOps (Docker, Ansible etc) a strong plus.BenefitsVisa sponsorshipFull Employment under Japanese law (which includes National Health Insurance and Pension)Commute Fee coveredNo OvertimeRemote work possibleSalaryAnnual: 4,200,000 - 5,040,000Yaraku focuses on Artificial Intelligence / Machine Learning. Their company has offices in Tokyo. They have a small team that's between 11-50 employees.You can view their website at https://www.yaraku.com"
[AI] Research Tokyo Student Intern（Intern_TRL）【IBM Japan】,NA,2023-01-30 12:27:00,https://www.google.com/search?q=Machine+Learning+Jobs+Japan&ibp=htl;jobs&sa=X&ved=2ahUKEwiHoOeTg_D8AhXKAzQIHRG4DycQutcGKAF6BAgOEAU#htivrt=jobs&htidocid=Jz_BRKflFdUAAAAAAAAAAA%3D%3D&fpstate=tldetail,IBM,Internship,NA,"Tokyo, Japan","IntroductionAt IBM, work is more than a job - it's a calling: To build. To design. To code. To consult. To think along with clients and sell. To make markets. To invent. To collaborate. Not just to do something better, but to attempt things you've never thought possible. Are you ready to lead in this new era of technology and solve some of the world's most challenging problems If so, lets talk.Your Role and ResponsibilitiesThis job position is for IBM Japan.Periodup to 12 weeks in 2023Mandatory language: EnglishTime9:0017:36 (default)Reduced working hours can be negotiated:Place: IBM Japan HQ at HakozakiSalary(Daily):9,700 yen (for master's)10,900 yen (for doctoral students)(in case housing allowance is unnecessary)15,700 yen (for master's)16,900 yen (for doctoral students)(including housing allowance)Commuting cost will be paid.IBM Research is one of the worlds largest and most influential corporate research labs, with an unmatched investment in basic... research and core science and a commitment to invent the future of technology by making scientific breakthroughs that will transform industries and society. IBM Research is extending research and development especially in technology areas related to AI because it has great possibilities of solving difficult and/or new problems that have not been solved and of creating innovative services that have not been even dreamed of.Current focus areas in AI include pioneering work in: natural language processing, spoken language processing, automatic speech recognition, planning and reasoning, optimization, machine learning, reinforcement learning, and automated data analytics.We have many internships available in Tokyo and are seeking highly motivated students with a background in computer science, artificial intelligence, or equivalent areas. You should be enrolled and studying towards a master's or doctoral degree in Computer Science, Computer Engineering, Mathematics or a related area.Required Technical and Professional ExpertiseSkill set and knowledge:Basic computer programming skill and knowledge, basic English language capability to understand technical documents written in English and to have simple conversations in English. Besides, knowledge and skills in the areas mentioned in Job Description depending on the area of internship.Preferred Technical and Professional ExpertiseExperience:Fundamental experience of computer programming.Language:• English communication skills for emails and conference calls is mandatory.• Understanding and interests on different cultures are desirable"
Machine Learning Engineer,2023-01-09,2023-01-30 12:27:00,https://www.google.com/search?q=Machine+Learning+Jobs+Japan&ibp=htl;jobs&sa=X&ved=2ahUKEwiHoOeTg_D8AhXKAzQIHRG4DycQutcGKAF6BAgOEAU#htivrt=jobs&htidocid=-mdvnM02l08AAAAAAAAAAA%3D%3D&fpstate=tldetail,Zeals,Full-time,NA,Japan,"Are You Looking• To make a difference at the fastest growing tech company in Japan• For a fair working environment where anyone regardless of their background can make an impact• To invest yourself and take ownership of your work• Forward to work in a highly flexible, remote-first organization• To simply have a ton of funWe Are ZealsA communication tech company based out of Tokyo, Japan. We are a group of scrappy and hungry bunch from different walks of life, looking to make an actual impact on the way people and businesses communicate through our AI Chatbot technology. We obsess over bringing hospitality to everyone--be it our customers or you! Youre an individual with unique needs. As an employer we are ready to roll-up our sleeves and change the status quo if it means to make your experience better!Everyone matters here at Zeals--regardless of their background. Be it a young coding prodigy (Yes, our CTO just turned 23) to someone who hardly speaks Japanese. Everyone... has a voice. We went from a small, humble apartment to a 300 people organization across multiple time zones (with no sign of stopping) in the span of 7 years--all that thanks to our members contributions. So, if you join us, get ready to raise up your voice and spend your time contributing to projects that matter!Our last 2 years have been phenomenal and we are still growing (with so much untapped potential). While we cant attract you with ping-pong tables or all-you-can-drink espresso bars. We can promise you full flexibility on your workstyle and co-workers that you can brag about to your friends, family or anyone you meet the next time you go out for a party!Your Typical Day With Us• Research, design, and build machine learning systems for prediction, recommendation, and automation• Select appropriate algorithms and fine-tune models for optimal performances• Evaluate model performance and suggest improvements where appropriate• Integrate machine learning models into production• Staying up-to-date with the latest machine learning technologies and methodologies• Execute critical phases within the ML lifecycleWhat Youll Need• Bachelors or Masters degree in a quantitative field such as Computer Science, Mathematics, Statistics, or Machine Learning• 3 years of work experience as a Machine Learning Engineer or Data Scientist• Data Science skills:• Familiarity with recommendation system algorithms, dimensionality reduction, and clustering• Knowledge on AB testing, statistical sampling, and hypothesis testing• Development skills:• Strong proficiency in Python.• Familiarity with frameworks such as Tensorflow and Pytorch.• Experience building and deploying machine learning models in a production environment• Familiarity with model monitoring techniques and toolsWhat Makes You Stand Out• Ph.D. in a quantitative field such as Computer Science, Mathematics, Statistics, or Machine Learning• Hands-on working experience in MLOps frameworks• Extensive knowledge, and ideally work experience, in recommendation systems, deep learning, and optimization methods and some experience in Natural Language Processing.• Familiarity with:• reinforcement learning• image analysis• customer experience and customer journey in e-commerce• Experience in Big Data technologiesDont just take our word for itZeals has received the LinkedIn Top Startups award twice in a row. We believe this is a testament to our growth and ability to attract outstanding talentswho could potentially be your colleague!Ready to roll up our sleevesWe obsess over bringing hospitality to everyonebe it our customers or you! Youre an individual with unique needs. So, while we cant attract you with ping-pong tables or all-you-can-drink espresso bars, we promise you a once-in-a-lifetime experience and co-workers that you can brag about to your friends, family, or anyone you meet the next time you go out for a party! As an employer, we are ready to roll up our sleeves and change the status quo if it means improving your experience!• Salary Range: competitive (performance review every 6 months)• Performance review: twice a year• Holidays: 10 days paid holidays during the first year, weekends off, national holidays, summer and winter break.• Visa support: We sponsor visas for suitable candidates. You can expect full visa support from our professional HR team.• Flexible working: Highly flexible, remote-first international organization• For Japanese residents: Work from anywhere, interim work from overseas, full flex time• Housing allowance (within 1.5KM away from the office)• Club activity allowance• Shuffle Lunch allowance (Cross department lunch)• Zeals Bar (bi-weekly free-flow beer party"
System Software Developer,2023-01-25,2023-01-30 12:27:00,https://www.google.com/search?q=Machine+Learning+Jobs+Japan&ibp=htl;jobs&sa=X&ved=2ahUKEwiHoOeTg_D8AhXKAzQIHRG4DycQutcGKAF6BAgOEAU#htivrt=jobs&htidocid=_mXbQHY_NPEAAAAAAAAAAA%3D%3D&fpstate=tldetail,CEVA Inc,Full-time,NA,"150-0002, Japan","DescriptionThe Vision Business Unit (VBU) is a small and dedicated group in CEVA. We offer our customers the most specialized cores and algorithms to run any Computer Vision based application, including Machine Learning and Neural Networks. Areas such as Artificial Intelligence, Virtual Reality and Augmented Reality push us to deal with cutting edge technologies that our customers near future products require. The solutions are related to variety of markets such as Automotive, Smartphones, Drones, Surveillance and more.We are now hiring an experienced System Software Developer, with focus on Machine learning. This developer will join the Machine Learning System team that develops and maintains systems software for complex Machine learning algorithms running on CEVA platform in variety of products. An example of these are drowns, cameras, and cars. The Machine Learning System team plays a vital role in enabling these products to run Machine Learning algorithms by building core... technologies and platform solutions that are not only competitive, but an industry-first.Requirements• B.S.c/M.S. in Engineering, Computer Science, or related technical field• 2+ years of software development experience advantage• Strong knowledge of software design, programming techniques, especially C/C++• Deep understanding of embedded systems architecture: CPU, memory, Operating Systems and device drivers - advantage• Knowledge of Python - advantage• Experience with DSP processors - advantage• Candidate must be highly motivated and have strong written and verbal communication skills• Looking for an experienced developer with an exponent learning curve• Candidate must have good communication skills and must be able to work in collaborative environment• Experience working for a Foreign Company• Good level of English• Candidate must have an experience of working as part of R&D organization or with colleagues located outside of Japan.• Candidate MUST be able to speak and communicate in Japanese"
MLOps Engineer,NA,2023-01-30 12:27:01,https://www.google.com/search?q=Machine+Learning+Jobs+Japan&ibp=htl;jobs&sa=X&ved=2ahUKEwiHoOeTg_D8AhXKAzQIHRG4DycQutcGKAF6BAgOEAU#htivrt=jobs&htidocid=xpcIoUAl6RkAAAAAAAAAAA%3D%3D&fpstate=tldetail,Woven Planet,Full-time,NA,"Tokyo, Japan","Woven Planet is building mobility for a safer, happier and sustainable world. A subsidiary of Toyota, Woven Planet innovates and invests in new technologies, software, and business models that transform how we live, work and move. With a focus on automated driving, smart cities, robotics and more, we build on Toyota's legacy of trust and safety to deliver mobility solutions for all.For nearly a century, Toyota has been delivering products and services that improve lives. Automation that originated to increase the efficiency of daily activities has evolved into the safe, reliable, connected automobiles we enjoy and depend on today. Now, we are looking to the next 100 years and to extending that dream for a better life for all people from cars to smart cities.Our unique global culture weaves modern Silicon Valley innovation and time-tested Japanese quality craftsmanship. The complementary strengths enable us to optimize safety, advance clean energy and elevate well-being. We... envision a human-centered future where world-class technology solutions expand global access to mobility, amplify the capabilities of drivers, and empower humanity to thrive.The work location of this position is in either Tokyo or Higashi-fuji.TEAMAimed at enabling mobility for all, our teams mission is to develop a fully autonomous vehicle capable of driving with no human involvement. We focus on Mobility as a Service (MaaS) applications, as increased vehicle use, common in rideshare, allows us to use rich sensors and computers to achieve the vital reliability for removing a human driver. We plan to explore a variety of approaches, including telemonitoring and remote assistance services to help us achieve our goals. We strive to make a significant and positive impact on peoples lives with our fully driverless vehicles. While working towards our mission we strive to build a diverse team of curious and dedicated individuals with a wide range of experiences. Teamed up with partners around the world as a global community, we strive to make a significant and positive impact on peoples lives with our fully driverless vehicles.WHO ARE WE LOOKING FORAs a Machine Learning Engineer, you will work alongside the engineers in our team and Machine Learning Engineers in other teams. You will be responsible for maintaining and improving the ML infrastructures for autonomous driving technology. We are looking for engineers who are passionate about building tools and ML infrastructures to enable productive ML models development in autonomous driving technology.RESPONSIBILITIES• Build workflows to build ML applications for autonomous vehicles• Improve and develop ML pipeline (training pipeline, annotation pipeline, and data ingestion pipeline) and other tools, to increase the efficiency of perception engineers to develop machine learning models• Design, communicate, and build new features to meet the needs in our team• Collaborate with other Machine Learning Engineers in other teams to develop ML pipeline and toolsMINIMUM QUALIFICATIONS• Bachelor's degree in machine learning, computer science, or a related field• 3+ years of experience in Machine Learning Area and understanding of machine learning development life cycle• Strong Python skills with strong ability to write high quality, unit-testable code• Experience in constructing a system using one of the cloud service AWS, Azure, GCP• Comfortable and proficient to work in EnglishPREFERRED QUALIFICATIONS• Master's in machine learning, computer science, or a related field• Experience to build ML pipeline• Experience in engaged in an automated driving project• Proficiency in writing C++• Experience in working in an agile environment with modern software development tools such as JIRA, Confluence, etc.If you are currently located outside of Japan, don't worry, we'll set an interview over Google Hangout Meet or Skype.WHAT WE OFFERCompetitive Salary - Based on skills and experienceWork Hours - Flexible working time with NO core-hoursPaid Holiday - 20 days per year (prorated)Sick Leave - 6 days per year (prorated)Holiday - Sat & Sun, Japanese National Holidays, and other days defined by the companyJapanese Social Security - all applicable (Health Insurance, Pension, Workers Comp, and Unemployment Insurance, Long-term care insurance)Employee BenefitsIn-house Training Program (software study/language study)By submitting your application you agree to the following terms:https://www.woven-planet.global/careers/privacy-policyOUR COMMITMENTWe are an equal opportunity employer and value diversity.We pledge that any information we receive from candidates will be used ONLY for the purpose of hiring assessment"
"Solution Engineer, Japan and Korea",NA,2023-01-30 12:27:02,https://www.google.com/search?q=Machine+Learning+Jobs+Japan&ibp=htl;jobs&sa=X&ved=2ahUKEwiHoOeTg_D8AhXKAzQIHRG4DycQutcGKAF6BAgOEAU#htivrt=jobs&htidocid=bIJ9zCyxxA0AAAAAAAAAAA%3D%3D&fpstate=tldetail,ViSenze - Artificial Intelligence for the Visual Web,Full-time,NA,"Tokyo, Japan","ViSenze is the world's smartest product discovery platform that allows retailers to increase revenue, save time and improve product performance. To further drive upon our success, we are looking for a self-starter, energetic and customer -orientated Solution Engineer, North Asia Business, North Asia with market focus in Japan and Korea.Using ViSenzes proprietary AI solutions, you will be helping our growing customer base to test, deploy and optimise our Retail AI platform features within their business. With a strong technical background and a learned understanding of our AI platform architectures, you will engage upfront with our pre and post sales teams. You will be the primary technical contact for our customers, whilst also facilitating discussions and feedback between customers and our product teams. You will also be responsible for addressing technical questions related to integration, product configuration and optimisation, and assisting customers with web/mobile deployment... related issues.To be successful in this role, there are several traits that we look for in you; you have a natural curiosity coupled with a deep passion for technology. You embrace learning and can demonstrate the aptitude to rapidly learn new technologies and apply new concepts. You embody a consultative and analytical approach and have great interpersonal skills that allow you to build relationships and partner with both internal and external teams. Importantly, you thrive on working in a fast-paced environment.This role reports to the Regional Business Head and will work in close conjunction with sales, product, and other cross-functional teams in ViSenze.Responsibilities• Your main role is client technical expert:• Work with the Engineering team to support customer data integration, product configuration and optimisation, upgrade and support• Advise and support customers on the design and implementation of customised SDKs, scripts, plugins, widgets that enable customers to integrate and deploy ViSenze solutions with the best practice• Design MOP and implement the upgrade and migration with the customer• You also work as a pre-sales engineer to support the Sales and Account Managers in closing customer deals• Collect feedback on desirable product feature requirements, and translate them into optimal solution designs• Combine the product knowledge and the customer insights to identify new business opportunities and engage the client and sales team to bring about ever closer collaboration• Demonstrate the ViSenze product functionalities to the customer.• Bachelors Degree (or commensurate training) in Computer Science, Engineering, Math, Information Systems or related disciplines• Fluency in either Japanese and/or Korean language is a prerequisite• Minimum 5 years experience as a technical consultant or in a customer-facing technical role that has allowed you to engage and support customers/ stakeholders at an enterprise level• Experience in implementing cloud based solution• Excellent communication skills with ability to lead discussions with technical and business audiences• Good at bridging and aligning business requirements and technical solutions• Knowledge of mobile and web technology stacks (HTTP, HTML, JavaScript, JSON, XML, Restful API);• Programming experience with scripting languages and data manipulation will be an advantage• Familiarity and/or strong interest with A.I. and Deep Learning concepts and methodologies is a plus• Willingness to travel when necessaryAbout VisenzeViSenze is the world's smartest product discovery platform. Retailers like ASOS, H&M, Rakuten, Zalora, Meesho, DFS, and EyeBuyDirect trust ViSenze to power their product discovery. ViSenze processes over a billion queries a month from retailers, supporting them in-store and on ecommerce sites.Our use cases range from visual search, product tagging, smart recommendations and merchandising analytics. ViSenzes automated AI platform empowers retail merchants to increase revenue by delivering exceptional experiences that make it easier for shoppers to discover products.• Gartner Hype Cycle for Retail Technologies 2021• CB Insights Retail Technology 100• Top AI Companies 2022• Leading Product Recommendation Vendor 2022To learn why the worlds leading brands trust ViSenze, visit http://www.visenze.comDiversity and Equal OpportunityViSenze is committed to the goal of equality of opportunity in employment and strives to create an operating environment that promotes fairness, equality and respect for social and cultural diversity, which is free from unlawful discrimination, harassment and vilification.The Company shall not take any disadvantageous measures against any Employee or prospective Employee with regards to wage, education, assignments, promotions, retirement age, separation or dismissal, on the basis of gender"
Senior Machine Learning / AI Engineer,NA,2023-01-30 12:27:02,https://www.google.com/search?q=Machine+Learning+Jobs+Japan&ibp=htl;jobs&sa=X&ved=2ahUKEwiHoOeTg_D8AhXKAzQIHRG4DycQutcGKAF6BAgOEAU#htivrt=jobs&htidocid=lt-qUiZP1gcAAAAAAAAAAA%3D%3D&fpstate=tldetail,thalescode,Full-time,JP¥8M–JP¥14M a year,"Tokyo, Japan","This position is for candidates in TokyoWe are seeking for Ai engineer who can implement research in papers in different apps, we mainly focus on image processing + OCR/NLP, the canddiate must understand well these technologies since we are looking for senior candidates in this position.Requirements:• Working experience with Python and ecosystems such as (NumPy, Pandas, Jupyter notebooks, Scikit Learn).• Background in image processing or NLP are a plus.• Proven experience in using modern deep learning frameworks like TensorFlow/Pytorch.• Experience in programming using C++14 and Python• Experience using OpenCV• Experience using CUDAAdditional Information:• Cloud experience• Software Developer (Fullstack/Backend/Frontend technologies)• Research and Papers• Project Management• Japanesethalescode focuses on Software Engineering. Their company has offices in Tokyo. They have a small team that's between 1-10 employees.You can view their website at... https://thalescode.com"
