Job-Title,Date-Posted,Date-Scraped,Url,Company,Job-Type,Salary,Location,Description
Machine Learning Engineer,2023-01-05,2023-01-30 12:16:33,https://www.google.com/search?q=Machine+Learning+Jobs+Croatia&ibp=htl;jobs&sa=X&ved=2ahUKEwi_udfrgPD8AhXGJzQIHcPeDEwQutcGKAF6BAgcEAU#htivrt=jobs&htidocid=jbx3maVX1oEAAAAAAAAAAA%3D%3D&fpstate=tldetail,ALFATEC Group,Full-time,NA,"Zagreb, Croatia","Possibility to work in Zagreb and Zadar!We are looking for people to work in our Department of Research and Development on new innovative solutions based on machine learning, analysis of large data sets, and business intelligence, also to participate in building new products, work with hype technologies, and grow to together. Sign up and become part of a successful team that functions as a start-up with all the advantages of a reliable and stable company! What we requestResponsibilities:Creation, testing and evaluation of machine learning modelsPreparing machine learning models for productionDeploying machine learning models to Cloud services (GCP, AWS)Continuous improvement, monitoring and testing of solutions in an agile environmentPreparing, processing and analysis of dataCreation of an API service for the needs of model serving and data processingMinimum qualifications:Minimum of two or more years of experience at similar jobsFaculty degree (Computing... Infomatics, Mathematics or similar)Advanced knowledge of Python programming languageAdvanced knowledge of PyTorch, TensorFlow, Pandas, Transformers, NumPyAdvanced knowledge of artificial neural networks and all their derivatives (CNN, RNN, LSTM, Transformers)Knowledge of natural language processing (NLP), computer vision and time series forecastingKnowledge of working with Cloud services such as AWS, Google Cloud, Microsoft AzureAdditional qualifications:Experience with Docker, Kubeflow, MLFlow or other MLOps systemsKnowledge of FastAPI, Django What we offerInternal and external educationIndividual approach to professional and personal development through a customized development planWorking in a stable company that develops its innovative solutionsPossibility of bonus and bonus salaryBonuses for Easter, Christmas, and vacationA gift for children100% paid sick leaveMultisport cardBudget for team building and gatheringsFlexible working hours with occasional work from homeQuality equipment, pleasant and spacious officeEncouraging environment and friendly working atmosphere"
Data Engineer - Machine Learning team,2023-01-17,2023-01-30 12:16:33,https://www.google.com/search?q=Machine+Learning+Jobs+Croatia&ibp=htl;jobs&sa=X&ved=2ahUKEwi_udfrgPD8AhXGJzQIHcPeDEwQutcGKAF6BAgcEAU#htivrt=jobs&htidocid=L3CJ7A5mcHYAAAAAAAAAAA%3D%3D&fpstate=tldetail,ReversingLabs,Full-time,NA,"Zagreb, Croatia","ReversingLabs application security and threat intelligence solutions have become essential to advance cybersecurity around the globe. Funded by our recent Series B investment , we're on a journey to expand and grow by hiring top talent across the security industry.Every application threatens businesses with new supply chain risks. ReversingLabs is the only company that can dissect any binary at unprecedented speed, scale, and explainability to protect the enterprise end-to-end.Our mission is to help IT professionals secure their code from supply chain threats. If this sounds interesting and you wondered what the Log4j fuss in the news was all about, you can become a part of our solution that secures the software release process for publishers, and manage third party risk for software buyers. We are seeking extraordinary talent to help forge this transformational journey at ReversingLabs. Your future role as a Data Engineer is extremely important to the success of our solution ... secure.software platform for software assurance. This is a game-changing opportunity.The machine learning team is a part of the static file analysis group in ReversingLabs. The projects include data-driven approaches to file type identification, malware classification, detection of hidden payloads, and extraction of file properties related to security. These projects complement the more conventional static analysis techniques developed by threat analysts and reverse engineers in the group, and aim to be practical for threats present in real-world data distributions. For data, we leverage the existing ReversingLabs file reputation collections and feeds of novel samples received from security industry feeds, threat intelligence, and in-house harvesting. Other than straightforward product-oriented projects, we also engage in more research-oriented endeavors aimed at threat hunting, threat intelligence, and data quality in our file metadata collections. The biggest challenge of the machine learning team is working with complex data and a shifting data distribution. This often requires an investigative mindset and cooperation with threat analysts and reverse engineers to create finely tuned and reliable solutions.We welcome various backgrounds who are willing to specialize in machine learning, particularly in ML Ops, such as all sorts of data professionals, Python developers or DevOps engineers with strong programming skills. As you will be an integral part of our machine learning team, knowing basic concepts of machine learning and data science beforehand might be beneficial. Knowledge exchange will be mutual so there will be plenty of opportunities to fill in the potential knowledge gaps. Your fellow team members in the Machine learning team will teach you a great lot about machine learning and data science, but you should be able to coach them about the best coding standards and be able to propose improvements to their (mostly) Python code.Responsibilities• Develop new and maintain existing data workflows• Maintain the machine learning teams GitHub repositories (mostly written in Python)• Provide expertise and guidance in setting standards, choosing tools, libraries, etc.• Perform code reviews• Identify bottlenecks and bugs, as well as devise solutions to these problems• Automate and maintain procedures for dataset updates• Automate and maintain procedures for machine learning models retraining• Develop other various automatization scripts in Python and/or Bash• Experience working with Python• Proficiency in NoSQL or relational databases• Experience designing data pipelines (familiarity with Airflow is a big plus!)• Experience with Automated Software Deployment tools such as Docker• Experience in working with a Linux-based OS and Bash• Identify bottlenecks and bugs, as well as devise solutions to these problems• Interest in machine learning and data science concepts• Enthusiasm for teamwork, constant learning, and adapting to new circumstances and cutting-edge technologies• Excellent knowledge of the English languageDesirable skills• Knowledge of ML Ops principles and best practices• Experience with CI/CD pipelines• Experience with queueing systems, e.g. RabbitMQ and Kafka• Experience in working with data visualization tools such as Grafana or Kibana• Experience with SQL databases like PostgreSQL and time series databases like ClickHouse• Basic knowledge of machine learning and data science concepts• Experience with cloud solutions, e.g. AWS• Hybrid work options (paid accommodation & transportation to Zagreb during onboarding for remote employees)• Flexible working hours• Generous compensation and a bonus system based on annual performance• Hefty personal education budget and possibility to attend leading conferences and seminars in the field• Company library and possibility to order books of choice via Amazon• Permanent contract in a fast-growing global company with Fortune 500 & governmental agencies as clients• Challenging projects in a dynamic, collaborative team• Opportunity to work on innovative solutions in malware analysis & software assurance, crafted in our very own Croatian R&D center• Great career advancement opportunities - clear goals & internal promotions• Employee referral bonus program: EUR 1,060 net for junior position, EUR 2,123 net for mid to senior positions, and EUR 2,654 net for principal/managerial positions• Multisport card, annual health checkup, newborn child allowance, rent-cost, and 3rd pillar pension benefits• Wellness Weekends - quarterly, company-wide three day weekend, starting with a company paid Friday off for all employees• Fully covered car garage in Radnika for all employees#LI-MV1"
Ads Assessor (Freelance Job) - Croatian speaker,2023-01-23,2023-01-30 12:16:34,https://www.google.com/search?q=Machine+Learning+Jobs+Croatia&ibp=htl;jobs&sa=X&ved=2ahUKEwi_udfrgPD8AhXGJzQIHcPeDEwQutcGKAF6BAgcEAU#htivrt=jobs&htidocid=FkUs2R_ZfcsAAAAAAAAAAA%3D%3D&fpstate=tldetail,TELUS International AI Data Solutions,Part-time,NA,"Split, Croatia","TELUS International AI-Data Solutions partners with a diverse and vibrant community to help our customers enhance their AI and machine learning models. The work of our AI Community contributes to improving technology and the digital experiences of many people around the world. Our AI Community works in our proprietary AI training platform handling all data types (text, images, audio, video and geo) across 500+ languages and dialects. We offer flexible work-from-home opportunities for people with passion for languages. The jobs are part-time, and there is no fixed schedule. Whoever you are, wherever you come from, come join our global AI community. www.telusinternational.comWho is suitable for this workWe are looking for dynamic people who have strong communication skills and use the Internet daily. This is a freelance, independent contractor position. You will have the flexibility and freedom to work from your own home, working your own hours.What does the work involveIn... this job you will be reviewing online advertisements in order to improve their content, quality and layout. You will be required to provide feedback and analysis on advertisements found in search engine results and provide ratings on their relevance to the search terms used. Another aspect of this opportunity will involve reviewing the language used in advertisements by examining grammar, tone and cultural relevance.As a Personalized Internet Ads Assessor your ultimate goal will be to contribute towards making internet search and online advertising more relevant and interesting for all Croatian speakers in Croatia.Requirements• You must be living in Croatia for the last 3 consecutive years• Suitable candidates must have full professional proficiency in English and Croatian• Access to and use of a broadband internet connection and associated computer and antivirus software to perform the work, all provided at your own expense• Experience in use of web browsers to navigate and interact with a variety of content• Access to and use of an Android (version 4.1 or higher) or IOS Smartphone (version 8 or higher) to complete tasks• A Barcode Scanner application must be installed on your smartphone to complete certain tasks• Active daily user of Gmail and other forms of Social MediaWorking on this project will require you to go through a standard recruitment process (including passing an open book assessment). This is a part time project and your work will be subject to our standard quality assurance checks during the term of this agreement.Benefits & Perks:• Flexible hours to work around home life• Better Work-Life balance• Remote work & location independence• Positive environmental impact• Independent contractor roleWhat' nextCreate an account using the ""Apply button or link below"", click the ""Sign Up"" button and fill the required fields. An email confirmation will be sent to your email to set your password and account. Then select CROATIA as your country and CROATIAN as your primary language. Then complete the registration process, do not forget to click the ""Apply"" button to start your application process for the project.• You can apply through Apply button or use this link: https://www.telusinternational.ai/cmp/contributor/jobs/available/136• *NOTE**: All qualified applicants will receive consideration for employment without regard to race, color, religion, sex, sexual orientation, gender identity, national origin, disability, or protected veteran status"
Conversational Artificial Intelligence Engineer,NA,2023-01-30 12:16:34,https://www.google.com/search?q=Machine+Learning+Jobs+Croatia&ibp=htl;jobs&sa=X&ved=2ahUKEwi_udfrgPD8AhXGJzQIHcPeDEwQutcGKAF6BAgcEAU#htivrt=jobs&htidocid=xVpFkrIHTOEAAAAAAAAAAA%3D%3D&fpstate=tldetail,Teva Pharmaceuticals,Full-time,NA,"Zagreb, Croatia","Who are weWe are looking for qualified and motivated candidate for the role of Conversational AI Engineer.The roleThe Conversational AI Engineer is responsible to build and deploy ChatBots and LiveChats to automate communication and customer services.As Conversational AI Engineer, you create applications that use AI and machine learning to communicate with humans (customers) via text or audio. You will work in a fascinating global environment and with variety of business units and variety of use cases.Main Responsibilities• Design, build and continuous improvement of those channels including management and support.• Collaborate with colleagues to develop & validate creative solutions to customer & business problems that create significant impact.• Leverage data to understand product performance and to identify improvement opportunities.• Utilize dashboards to monitor product health and adapt and enhance the chat experience to address issues as they arise.• Write clean... and functional code.• Integrate conversational AI solution into our existing platform APIs• Work on one or more technical areas of applications of Natural Language Understanding, dialog system, statistical NLP, contextual understanding.Main Requirements• Bachelor's degree in a computer science, information technology, or computer related discipline• Hands-on expertise in either Java or Python, Java Script• Knowledge in JSON, Web Sockets, Web Services using REST, SOAP• Knowledge in authentication and authorization techniques• Technical knowledge of the fundamentals of conversation, speech and language technologies• Experience in IT domain.• Experience in crafting demos that showcase the potential of conversational experiences• Experience in personal designing/writing and code documentation• Experience working very closely with cross-functional product teams.• Chatbots, Voicebots conversional design experience and will be added advantage• Strong collaboration, communication, and presentation skills• Strong organizational skills with the ability to handle numerous initiatives simultaneously, with a great attention to detail, operating with urgency, focus and discipline• Strong documentation skills on policies, process and procedures• Very good English (both conversational and written)FunctionInformation TechnologySub FunctionBusiness Process AnalysisAlready Working TEVAIf you are a current Teva employee, please apply using the internal career site available on ""Employee Central"". By doing so, your application will be treated with priority. You will also be able to see opportunities that are open exclusively to Teva employees. Use the following link to search and apply: Internal Career SiteThe internal career site is available from your home network as well. If you have trouble accessing your EC account, please contact your local HR/IT partner.Tevas Equal Employment Opportunity CommitmentTeva Pharmaceuticals is committed to equal opportunity in employment. It is Teva's global policy that equal employment opportunity be provided without regard to age, race, creed, color, religion, sex, disability, pregnancy, medical condition, sexual orientation, gender identity or expression, ancestry, veteran status, national or ethnic origin or any other legally recognized status entitled to protection under applicable laws.Teva Pharmaceuticals is committed to equal opportunity in employment. It is Teva's policy that equal employment opportunity be provided without regard to age, race, creed, color, religion, sex, disability, pregnancy, medical condition, genetic information, marital status, sexual orientation, gender identity or expression, ancestry, national or ethnic origin, citizenship status, military status or status as a disabled or protected veteran, or any legally recognized status entitled to protection under applicable federal, state, or local laws"
Backend Developer - Croazia (full remote),2023-01-09,2023-01-30 12:16:34,https://www.google.com/search?q=Machine+Learning+Jobs+Croatia&ibp=htl;jobs&sa=X&ved=2ahUKEwi_udfrgPD8AhXGJzQIHcPeDEwQutcGKAF6BAgcEAU#htivrt=jobs&htidocid=dW86A5KXHwIAAAAAAAAAAA%3D%3D&fpstate=tldetail,botshelf.ai,Full-time,NA,Croatia,"Botshelf.ai is focused on building intelligent and ready to use bots to automate backend tasks and make intelligent RPA. Our bots, powered by Machine and Deep Learning models, turn process automation into off-the-shelf solutions solving complex tasks that require cognitive and understanding capabilities.BOTShelf.AI enables Developers, Enterprise and PA to enter and leverage the hyper-automation revolution through CreAItor, our BOT-as-a-Service PlatformCreAItor allows fast prototyping, auto-training and Machine Learning/Deep Learning models to automate complex RPA tasks that require cognitive capabilities.What you will doAt Botshelf.ai we are looking for a talented Backend Engineer that will join our development team to build and maintain our SaaS platform.Primary responsibilities:• Implement and maintain the architectural AWS components of our platform with a focus on scalability, code quality and security• Maintain and evolve private and public APIs with a... customer-centric approach• Contribute to our fleet of serverless microservices• Contribute to our infrastructure and automation tools• Collaborate with our AI experts, Platform engineers and product ownersWho are youYou have a degree in technical / scientific disciplines and have gained 2-3 years of experience within ICT services companies where you have participated in development projects orSaaS products.You are also mentally open, curious, with enthusiasm and energy, excellent communication skills both in writing and in spoken presentation.MUST HAVE SKILLS.• Knowledge of Typescript/Javascript with Node.js framework• Knowledge of REST paradigm and OpenAPI specification (swagger).NICE TO HAVE SKILLS• Basic experience of AWS Cloud (S3, Lambda, EC2, ECS, VPC, SNS, SQS, IAM)• Basic experience in using the main Open Source development tools (GIT, NPM, Nexus).• Basic experience of Docker technology.• Knowledge of relation and non-relational databases (e.g. MySQL, Mongodb, DynamoDB).• Knowledge of microservices, serverless and event-driven architectures is welcome.• Attitude to teamwork, knowledge sharing and collaboration.• Written and spoken English.The Selection processAfter a first call with our People Manager who will present you the company and check if the role is fit for your skills and expectations, we will invite you to take part in some interviews (usually two, maximum three).You will first meet your future manager. It will be a deep and challenging chat and youll have the possibility to go through the technical aspects. During this meeting you will handle a technical test . A further technical challenge could be organized to go deeper in the technical skills.The last meeting will give you deeper details about our Botters and what our Mission is.All the meetings are remote but if you wish to meet the team, well be pleased to welcome you in our beautiful Rome offices.The selection process is important for technical and personal sides. Both aspects will be considered with attention. We will also give you all the information to make you consider Botshelf.ai on a 360overview.What do we offer you• A growth path aimed at improving your professionalism• Flexible working hours• Flexible Smart Working agreement ( from a minimum of 4 days/month to full remote )• Stimulating and international work environment with heterogeneous teams and the possibility of expanding your knowledge• Meal vouchers for all the working days• Fondo Est health insurance• Corporate welfare• Corporate Carpooling communityBotshelf.ai is an equal opportunities employer and does not discriminate on any grounds.The company Botshelf srl is the data controller of personal data. The data that the Company intends to process are: A) Personal data; B) Information about educational career, professional situation and field of expertise; C) Specific data: health data, data revealing racial or ethnic origin, political opinions, trade-union membership, religious or philosophical beliefs. The legal basis for points A and B is the performance of pre-contractual measures pursuant to art. 6, letter B) of the GDPR.The legal basis for point C is your express consent pursuant to art. 9 of the GDPR. The collected data will be processed to carry out the research, selection and evaluation of the personnel in order to manage your application with reference to a specific job advertisement and to manage your spontaneous application. In the event that you have provided your data by applying to a job advertisement, such data may also be processed for future selections after the explicit consent sent together with the curriculum or subsequently given. Your data will be kept for the time strictly necessary to fulfill the above mentioned purposes and in any case for a period not exceeding 36 months unless you withdraw, at any time, your consent to the processing of your data. In any case, your data may be processed due to legal obligations and in the exercise of certain rights before the Courts by the Company. You, as data subject of the processing of personal data, may exercise at any time the rights expressly granted by the European Regulation, and in particular: Right to access personal data (art. 15): Right to rectification (art. 16), Right to elimination (art. 17) , Right to restriction of processing of personal data (art. 18), Right to data portability (art. 20), Right to object (art. 21) Right to lodge a complaint with the competent supervisory authority, Right to withdraw consent . If you wish to exercise the rights listed above, please find here the address of the Controller: Via Angelo Inganni n. 93 Milano Italy or the e-mail address: Dpo.botshelfbotshelf.ai. The company Botshelf srl , considering the protection of personal data of the interested parties to be of the utmost importance, has appointed a data protection officer (DPO) who can be contacted by writing to the e-mail address Dpo.botshelfbotshelf.ai for any issue concerning the protection of personal data"
