Job-Title,Date-Posted,Date-Scraped,Url,Company,Job-Type,Salary,Location,Description
Machine Learning Software Developer,NA,2023-01-30 12:27:24,https://www.google.com/search?q=Machine+Learning+Jobs+Jordan&ibp=htl;jobs&sa=X&ved=2ahUKEwjisomhg_D8AhVZAzQIHU4-BmUQutcGKAF6BAgUEAU#htivrt=jobs&htidocid=FL4GZa388dgAAAAAAAAAAA%3D%3D&fpstate=tldetail,Acacus Group,Full-time,NA,Jordan,"Designing, developing and maintaining software code using different frameworks and toolsAbility to write efficient software code for enterprise environmentsExcellent grasp of current best practice database and software methodologiesDevelop software solutions using industry standards based on the needs of the customer and feedback provided by the client account manager and stakeholders"
Sr. Data Scientist,2023-01-25,2023-01-30 12:27:24,https://www.google.com/search?q=Machine+Learning+Jobs+Jordan&ibp=htl;jobs&sa=X&ved=2ahUKEwjisomhg_D8AhVZAzQIHU4-BmUQutcGKAF6BAgUEAU#htivrt=jobs&htidocid=6EEqDL8Vb6YAAAAAAAAAAA%3D%3D&fpstate=tldetail,Human Resources M.E,Full-time,NA,"Amman, Jordan","Job DescriptionJob Responsibilities• Perform advanced data mining/analysis using state-of-the-art methods• Establish and schedule the data analysis approach in conjunction with the business unit• Develop data extraction (reduction) and analysis techniques for data from the company's repositories• Develop and apply complex statistical models and innovative data visualizations to discover hidden insights and reveal business value• Expose comprehensive results, advise on way forward to a senior management/executive audience by translating data-driven insights into clear decisions and action plans• Create and deliver data driven products (like automated decision systems, AI based anomaly detection, etc) and execute corresponding performance monitoring until industrializing phase• Provide expertise to foster the adoption of advanced data analysis techniques (analytics) for all types of data with the company and work with the professions to co-construct the work tools of the... future• Experience in at least one of the Data visualization package, library or tools, such as , GGplot, Qlick, Elastic, ect, or Query languages sucha s SQL, Hive• Experience in Common data science toolkits, such as R, Python Data Science Libraries, MatLab, etcRequirementsJob Specifications• 5+ years of experience in Software IT sector• Excellent understanding of machine learning techniques and algorithms, such as k-NN, Naive Bayes, SVM, Decision Forests, etc.• Experience with common data science toolkits, such as R, Weka, NumPY, MatLab, etc• Excellent communication skills• Experience with data visualization tools, such as , GGplot, etc• Proficiency in using query languages such as SQL, Hive, Pig, etc• Experience with NoSQL databases such as MongoDB, Cassandra, HBase, etc• Experience with SQL databases such as Oracle, SQL Server, MySql, etc• Good applied statistics skills such as distributions, statistical testing, regression, etc• PowerBI experience is a plus• Experience with cloud based platforms (AWS, GCP, Azure) is a plus• Data-oriented personality"
Artificial Intelligence Engineer,2023-01-23,2023-01-30 12:27:25,https://www.google.com/search?q=Machine+Learning+Jobs+Jordan&ibp=htl;jobs&sa=X&ved=2ahUKEwjisomhg_D8AhVZAzQIHU4-BmUQutcGKAF6BAgUEAU#htivrt=jobs&htidocid=Wry5GPeO8psAAAAAAAAAAA%3D%3D&fpstate=tldetail,Migrate,Contractor,NA,"Amman, Jordan","• Strong knowledge in Machine Learning/Deep Learning models.• Solid experience with TensorFlow or Pytorch• Experience in data augmentation, pre-processing, and feature engineering• Good knowledge in OOP (Object Oriented Programing), Web services, and Restful API• Previous experience in CI/CD for ML/AI, and Git.• Experience from 4 to 10 years."
Data Scientist,NA,2023-01-30 12:27:25,https://www.google.com/search?q=Machine+Learning+Jobs+Jordan&ibp=htl;jobs&sa=X&ved=2ahUKEwjisomhg_D8AhVZAzQIHU4-BmUQutcGKAF6BAgUEAU#htivrt=jobs&htidocid=1dzLo43s6F8AAAAAAAAAAA%3D%3D&fpstate=tldetail,مستودع القصواء للادويه,Full-time,NA,Jordan,"Data ScientistLocation: JordanDuration: Contract / PermanentIndustry: ConsultancyThe Role:We are working with a global consultancy who who are building a delivery hub in Jordan.They need Data Experts who can support their Middle Eastern clients remotely from Jordan.The right candidates should have the following:• Arabic and English Speaking• Able to design, develop and execute the required analytical algorithms, techniques, and statistical methods to address BU use cases• Great Analytical Skills• Understand the algorithms/methodologies related implications of advanced analytics solutions, and assist in defining the solutions to support any future business requirements• Problem solver• Ideally has experience within consultingTechnical Skills:• SQL /Oracle• R• Python• Machine Learning• DASH• GIT• Mathematical thinkerAPPLY NOW to find out more! Or if this isnt quite the role for you but you know someone who would be great, get a reward by referring someone... here https://sgp.technology/referrals"
Junior data science - Analytics assistant,NA,2023-01-30 12:27:26,https://www.google.com/search?q=Machine+Learning+Jobs+Jordan&ibp=htl;jobs&sa=X&ved=2ahUKEwjisomhg_D8AhVZAzQIHU4-BmUQutcGKAF6BAgUEAU#htivrt=jobs&htidocid=oSTRVfluumQAAAAAAAAAAA%3D%3D&fpstate=tldetail,APCO Worldwide,Full-time,NA,"Amman, Jordan","APCO IN THE MIDDLE EASTHome to some of the fastest growing economies in the world, the Middle East and Africa region has a pivotal role to play in driving global conversations from environmental policies to religion and pop culture. The UAE and Saudi Arabia are clear leaders in this equation, although the wave of innovation continues to transcend borders.APCO launched its regional operations in 2006 in Dubai. Growing from a team of less than 30 consultants, APCO today has over 200 people from 32 countries working in teams across Dubai, Abu Dhabi, Riyadh, Manama and Kuwait. Our projects also take us to Cairo, Amman, Muscat, Beirut and other markets in the Levant.With a portfolio of over 100 clients, APCO s MEA offices deliver public relations and digital communication support across health, food, consumer retail, finance, technology, real estate hospitality, non profit and public affairs practices. The region also offers specialized services, created for the Middle East, such as our... Build Operate Transfer (BOT) model and our Compass and License to Operate offerings.In addition, APCO s global AI Comms Lab a first of its kind innovation center which utilizes artificial intelligence to build and protect the reputations of major global brands, governments and organizations is driven from the Dubai office.From helping governments connect with the private sector and civil society, to supporting the Pope s historic visit to the region and launching iconic brands and destinations, we understand the nuances of the Middle East and pride ourselves on making an impact.The Role:As a junior data science/analytics assistant you will be responsible for supporting our clients on data driven insights and working closely with colleagues from the MENA region to identify and implement different data science solutions that will add value to our business. The successful candidate will bring good knowledge of analytics and AI and a great grasp of digital transformationKey Responsibilities: Work closely with colleagues from different departments to identify use cases for data science that adds value to our business and our clients Support on the daily development of client deliverables and analysis of the client s data that requires analytics and data science know how Support the development of new business proposals for the clients with special focus on the analytics workstreams Supporting the digital team in several tasks such as data extraction, preparation, cleaning, analysis, visualizations and reports generations Converting complicated data science and analytics aspects into simple to understand concepts presented in a PowerPoint presentation form Look for opportunities to use insights/datasets/code/models across the clients Conduct research from which you ll develop prototypes and proof of conceptsEducation and Experience: A bachelor or master s degree in computer science (preferably with knowledge in Digital Communications) Knowledge of the basics of statistics and hypothesis testing Knowledge of a programming language (preferably R or Python) Basic knowledge of data science and AI/machine learning algorithms (e.g., linear regression) Basic understanding of web development principles including but not limited to post and get requests, REST API, etc.The CompanyFounded in 1984, APCO Worldwide is an award winning, independently owned global communication and business strategy firm with more than 30 offices in major cities throughout North America, Europe, the Middle East, Africa and Asia with a diverse global team of more than 800 experts.APCO combines a global perspective with local expertise to help clients around the world manage challenges, opportunities, perceptions and reputations. APCO clients include corporations and governments industry associations and nonprofit organizations and six of the top 10 companies on the Fortune 500. The firm is a majority women owned business and has been named the Best EMEA Network to Work For, 2017 and Public Affairs Agency of the Year, 2017 by the Holmes Report"
Senior Data Analytics Engineer,NA,2023-01-30 12:27:26,https://www.google.com/search?q=Machine+Learning+Jobs+Jordan&ibp=htl;jobs&sa=X&ved=2ahUKEwjisomhg_D8AhVZAzQIHU4-BmUQutcGKAF6BAgUEAU#htivrt=jobs&htidocid=QoPAMRqAh0YAAAAAAAAAAA%3D%3D&fpstate=tldetail,مستودع القصواء للادويه,Full-time,NA,Jordan,"Our Mission is to Simplify Life. We are looking to Simplify and automate complex decision-making for customer centric industries, like Utilities, Financial Services, Logistics, and commerce, that drive the world's economies and you have the chance to join the revolution. We are trying to solve huge challenges in today's enterprise that are directly impacting the employee and customer experience.What can we promise you:• Youll join a global family of awesome, passionate people that are working together to build a sustainable, scalable ecosystem committed to using logic to create a better experience.• We want you to help us become better. You will be empowered to drive change and innovate.• That we will invest in you. We will give you the opportunity to master your domain and drive excellence.Our team helps clients navigate various analytics applications to get the most value out of their technology investment and foster confidence in their business intelligence. As part of our... team, youll help implement enterprise data products and data management applications that improve operational effectiveness and provide actionable data analytics and insights.Main Job Responsibilities:• Implementation of data products for the• Provide data architecture and technical delivery knowledge• Utilize DevOps software team to create innovative applications.• Execute data-science and machine-learning efforts• Implement exploratory data analysis of sample data sets to advise the Data Lab leads on the incorporation of AI into their labs and applications• Analyze requirements, estimate production time, design solutions, code solutions, test solutions, and document work.• Assist in the definition of application architecture.• Mentor team of data scientists and provide algorithmic recommendations depending on the data set, acting as SME.• Ensure adherence to best practices, management processes, and technical constraints.• Design and conduct training on AI/ML, NLP techniques.• Assist in the drafting of business cases, project plans, test reports, risk assessments, and other project specific documentation.• Acts as client liaison in the development of application functional documentation, including technical specs document, technical data sheets, operational manuals, and training materials.Needed Competencies:• Leadership skills• Communication skills• Time management• Creativity• Analytical skillsEducation:Bachelor's degree in Mathematics, Computer Science or similar engineering discipline.Experience:Minimum 5+ years of relevant work experience in agile/scrum software development, data science settings with a focus on developing projects using Data warehousing and cloud environments (e.g. Azure, Google Cloud, Digital Ocean)Knowledge, Skills, and Abilities:• Must be functional in a Senior Software Developer role.• Experience in Design Thinking workshops and all related activities, designing solutions that balance user needs, commercial interests, and technological constraints, including design strategy, service design, and design research.• Strong Experience in Microsoft Development Toolkit (SSIS, SSAS, Azure Data Factory, Azure Synapse, Visual Studio)• Experience with Databricks• Experience with NoSQL, Relational, Multimodal, and Graph databases.• Experience in designing and implementing User Interfaces at an Enterprise Level.• Strong system architecture and design experience including deploying production• enterprise applications in cloud environments that use AI/ML.• Experience with Enterprise Data Modeling, including the use of EA Sparx• Experience with scripting and programming languages in Python, R, and Java.• Experience planning and executing customer design projects through a holistic understanding of problem areas, iterative solution design, executive stakeholder management, and integration of business and technical experts.• Experience conducting qualitative and quantitative research and synthesizing to provide insights, identify opportunities, and generate conceptual frameworks.Preferences:• Strong experience with Machine Learning algorithms, techniques and tools.• Experience with Jira, Confluence, Visio, MS DevOps, and MS Project.• Experience with Amazon Web Services deployments.• Masters degree in Data Science• Experience with open source development tools (GitHub, GitLab, etc.).Travel:No travelWork Schedule:Local office schedule"
NLP Data Scientist,2023-01-02,2023-01-30 12:27:27,https://www.google.com/search?q=Machine+Learning+Jobs+Jordan&ibp=htl;jobs&sa=X&ved=2ahUKEwjisomhg_D8AhVZAzQIHU4-BmUQutcGKAF6BAgUEAU#htivrt=jobs&htidocid=D029newcP4cAAAAAAAAAAA%3D%3D&fpstate=tldetail,مستودع القصواء للادويه,Full-time,NA,Jordan,"We are looking for an independent, creative, driven problem solver who is passionate about data science and applying NLP techniques to understand and extract information from text.RESPONSIBILITIES• Supporting requirements generation and providing guidance on statistical methods to be applied.• Defining analytical cohorts using self-service data platforms or retrieving cohort data using REST APIs or SQL statements.• Conducting statistical analyses / generating analyses and visualizations using Python.• Developing, testing, and documenting new analytical algorithms within a best-practice software engineering framework using Python.• Writing up, presenting, and supporting the dissemination of results.• Identify relevant data sources and sets to mine for client business needs, and collect large structured and unstructured datasets and variables• Devise and utilize algorithms and models to extract data from big-data stores; perform data and error analysis to improve models; clean... and validate data for uniformity and accuracy• Analyze data for trends and patterns, and interpret data with clear objectives in mind• Implement analytical models in production by collaborating with software developers and machine-learning engineersSKILLS REQUIRED• BSc degree in Data Science, Computer Science, Computer Engineering, or any related field.• 3+ years of experience in Data Science.• Proven experience with Python or another programming language.• Understanding and previous experience with classic statistical methods (such as distributions, statistical testing, regression, and survival methods).• Understanding software engineering with hands-on experience and with the usage of software development tools (such as Git, APIs, etc.).• Experience in manipulating and analyzing medium-sized to large real-world data sets.• Able to communicate effectively; fluent in English  both spoken and written• Strong analytic mindset and logical thinking capability.WHAT'S IN IT FOR YOU• A friendly and growth-encouraging environment.• A suitable salary with other incentives.• Flexible working hours with an option of working remotelyCapella is a leading data company trusted by industry-leading firms. For more information, visit: Capella.ioThe position is based in Capellas offices in northern Amman, Jordan. Capella has a strong corporate culture of innovation and trust and is committed to excellence in everything we do. We offer a competitive compensation and benefits package with great career opportunities for professional growth.We are a business built by software developers around software developers. Our goal is to grow both as individuals and as a company. We have a trusting independent working structure, and we need people who are continuously learning and improving themselves"
"Lead Data Scientist, Totogi (Remote) - $200,000/year USD",2023-01-04,2023-01-30 12:27:27,https://www.google.com/search?q=Machine+Learning+Jobs+Jordan&ibp=htl;jobs&sa=X&ved=2ahUKEwjisomhg_D8AhVZAzQIHU4-BmUQutcGKAF6BAgUEAU#htivrt=jobs&htidocid=nvhHZX0OMAYAAAAAAAAAAA%3D%3D&fpstate=tldetail,مستودع القصواء للادويه,Full-time,NA,Jordan,"Crossover is the world's #1 source of full-time remote jobs. Our clients offer top-tier pay for top-tier talent. We're recruiting this role for our client, Totogi. Have you got what it takesAre you a data science expert who excels at using data to answer critical business questions Are you tired of wasting your time in endless stakeholder meetings where no one speaks your language Does it feel like your company never makes full use of your valuable insights If youve answered yes, we might have a role for you!Totogi is a software company redefining the rules of the telecommunications industry by lifting it into the public cloud. We empower CSPs through 100% cloud-native, API-driven solutions that facilitate integration with legacy systems, implement new features and services in minutes instead of months, and deliver a BSS that generates 10x performance at a tenth of the cost.This is not a job where you passively wait for data streams to answer one-off questions. Were... looking for a take-charge data wizard to establish a high-impact data science practice at Totogi. In this role, you will have full ownership and governance and be responsible for building models from the ground up. You will not only have the freedom to implement ideas, but you will also be encouraged to do so.Your work will directly help us disrupt the telecommunications industry, so if you enjoy predicting and steering the future based on hard evidence hidden behind mountains of data, then this role is for you!What You Will Be Doing• Designing the product interfaces that customers will use to obtain predictions and input training data• Designing, building, and implementing APIs into data pipelines• Creating accurate, practical, and repeatable models to predict key metrics or derive critical insights that impact business performanceWhat You Wont Be Doing• Wasting your time explaining how your models work to non-technical stakeholders• Working on unfeasible ideas because executives have no understanding of what is and isnt possibleLead Data Scientist Key Responsibilities• Delivering new data products and insights that enable Totogi to achieve key business goalsBasic Requirements• 5+ years of experience in data science using public cloud services for development• Hands-on modeling and complex analysis using Python, SQL, and/or R• Experience with inference APIs, machine learning, and prediction and classification modelsAbout TotogiTotogi is focused on building telco software for the public cloud and is completely redefining how carriers engage with their subscribers to drive customer love! We are a product-driven telco software company made up of some of the best minds from the telecoms industry and the brightest engineering talent across the globe. Change the game with us.There is so much to cover for this exciting role, and space here is limited. Hit the Apply button if you found this interesting and want to learn more. We look forward to meeting you!Working with CrossoverThis is a full-time (40 hours per week), long-term position. The position is immediately available and requires entering into an independent contractor agreement with Crossover. The compensation level for this role is $100 USD/hour, which equates to $200,000 USD/year assuming 40 hours per week and 50 weeks per year. The payment period is weekly. Consult www.crossover.com/help-and-faqs for more details on this topic.What to expect next:• You will receive an email with a link to start your self-paced, online job application.• Our hiring platform will guide you through a series of online screening assessments to check for basic job fit, job-related skills, and finally a few real-world job-specific assignments.Important! If you do not receive an email from us:• First, emails may take up to 15 minutes to send, refresh and check again.• Second, check your spam and junk folders for an email from Crossover.com, mark as Not Spam since you will receive other emails as well.• Third, we will send to whatever email account you indicated on the Apply form - by default, that is the email address you use as your LinkedIn username and it might be different than the one you have already checked.• If all else fails, just reset your password by visiting https://www.crossover.com/auth/password-recovery if you already applied using LinkedIn EasyApply.Crossover Job Code: LJ-4907-JO-Amman-LeadDataScient"
