Job-Title,Date-Posted,Date-Scraped,Url,Company,Job-Type,Salary,Location,Description
Machine Learning Researcher/Engineer,2023-01-19,2023-01-30 12:11:15,https://www.google.com/search?q=Machine+Learning+Jobs+Australia&ibp=htl;jobs&sa=X&ved=2ahUKEwi9p8fG_-_8AhXbGDQIHYl9CL0QutcGKAF6BAgSEAU#htivrt=jobs&htidocid=bLTCy1CFB6MAAAAAAAAAAA%3D%3D&fpstate=tldetail,CONIGITAL,Full-time,NA,"Sydney NSW, Australia","ResponsibilitiesWe are looking for a researcher or engineer with experience in Machine Learning passionate about solving challenges in the autonomous vehicles space. You will work closely with our talented team of engineers creating our own self driving stack and other autonomous driving related technologies.You will be working developing machine learning models for perception (from vision, LiDAR, and imaging radar) for autonomous vehicles, including:• Object detection and classification• Semantic and panoptic segmentation• Road marking and road boundary detection• Sensor fusion• Traffic light and sign classification• Object trajectory prediction• Optimisation of machine learning models for deployment• Data processingRequirementsKnowledge and experience in:• Machine learning and neural network architectures relevant to autonomous driving• State of the art techniques for image and point cloud object detection and semantic segmentation• Image and point cloud... processing• Neural network optimisation and hardware acceleration• Python• PyTorch/TensorFlow, TensorRT, ONNX• Git/GithubAppreciated additional skills and knowledge• C++, CUDA• ROSJob Type: Full-timeSalary: $90,000.00  $130,000.00 per yearSchedule:• Flexible hoursEducation:• Bachelor Degree (Preferred)Experience:• Machine Learning: 2 years (Preferred)• Python: 1 year (Preferred)• C++: 1 year (Preferred)• Robotics related perception: 1 year (Preferred)• Image processing: 1 year (Preferred)• Pointcloud processing: 1 year (Preferred)Work Authorisation:• Australia (Preferred)Application Deadline: 28/02/2023"
Machine Learning Engineer,NA,2023-01-30 12:11:15,https://www.google.com/search?q=Machine+Learning+Jobs+Australia&ibp=htl;jobs&sa=X&ved=2ahUKEwi9p8fG_-_8AhXbGDQIHYl9CL0QutcGKAF6BAgSEAU#htivrt=jobs&htidocid=CYskwRHLgBQAAAAAAAAAAA%3D%3D&fpstate=tldetail,oOh!,Full-time,NA,"South Melbourne VIC, Australia","About oOh!:oOh! is a leading operator in Australia and New Zealands fast-growing Out Of Home advertising industry and our purpose is to make public spaces better! We create deep engagement between people and brands through Unmissable location-based media solutions that inform, entertain and inspire. Our network is unparalleled, with a diverse portfolio of 37,000 classic and digital signs across roadside, retail, airport and place-based media offering in CBD office towers, cafs, bars and universities.Investing heavily in technology, we use sophisticated data, industry leading insights and digital innovation, to enable clients to maximise their media investment, through unrivalled and accurate audience targeting. Our physical inventory integrates with experiential, social and mobile online channels to provide clients with greater connections with consumers.oOh! Culture:With 900+ professionals dispersed across Sydney, Melbourne, Brisbane, Adelaide, Perth and New Zealand - were... in the business of bold ideas, and you have the freedom to explore them. No two challenges are the same and the opportunities that variety brings are limited only by your imagination. The original thinking and unique perspectives that grow from a community as diverse as ours mean everyone here can have an impact. Youre encouraged to be bold and brave, to push the boundaries, to celebrate wins and also to learn from mistakes which is integral to innovation. Were united by courageous spirit; it ignites our passion every day and the bonds within our family keep it alight.Become part of a fun, open family thats unified and motivated by common goals and determination. Youre supported and encouraged at oOh!. Theres always someone to help you when you need it.The RoleWe are looking for an experienced Engineer to deliver end to end data and machine learning solutions! You will be responsible for building ML pipelines, models and algorithms at scale, as well as building a new recommendation engine for selecting optimal media and advertising campaigns.You Will Also• Design and implement data processing and machine learning deployments/MLOps.• Clearly articulate highly technical methods and results to diverse audiences to drive decision-making.• Evaluating suitability and transforming data science prototypes, and applying appropriate ML/optimisation algorithms and tools.• Works closely with Data Scientists and other Engineers to integrate data into the Lakehouse• Utilise MLOps, drawing from existing software-engineering best practises to enable faster delivery of more robust, risk-compliant software that provides new value to the customer.This role can be based either our of our South Melbourne or North Sydney locations in a hybrid / WFH capacity.About YouIf youre the type of Engineer that enjoys bouncing ideas off like-minded developers, have a curious mindset, enjoy rolling up your sleeves and getting the job done then this is an excellent opportunity for you! At oOh! youll contribute to a long-term Tech vision, celebrate team wins (and learn from team misses).Youll thrive in this role bringing the following skills and experience:• Minimum 4 years experience in a machine learning / data engineering role• Programming skills in Python, SQL and Spark.• Experience with Linux/Unix based systems in a cloud environment (AWS preferred).• Experience with the Databricks platform is a bonus.• Knowledge of Kubernetes, Airflow, and Git• Working knowledge of AI-type algorithms, including machine learning techniques such as regression, decision trees, clustering, Bayesian modelling.• Bachelor's degree in computer science, data science, mathematics, or a related engineering discipline.OOh Benefits• Whether youre in the office, or working from home, youll have the opportunity to work in a truly flexible capacity in an environment where you can bring your best self.• Camaraderie comes first at oOh! and youll work in a collaborative, fun, creative team and a culture that fosters growth and belonging. Our exciting social calendar allows our teams to build deep connection• Be authentically you  dress code is, there is no dress code! Your choice of laptop platforms (Mac or Windows)• Strive for your best self - Internal and external training plus structured and defined career paths• Inclusive paid parental leave policy that supports all parents and carers• 2 paid days/yr community service and volunteering leave• Free EAP confidential counselling and mental health support• Active Reward and Recognition Program for peer-to-peer kudos!• Novated leasing, discounted gym membershipIf youre curious, brave, and ready to leap into a career like no other, then apply now!If you meet some of the role the requirements, but not all, we encourage you to submit your application. oOh! actively seeks to include and value the unique talents, perspectives, experiences, and contributions of all people"
Graduate Machine Learning,2023-01-28,2023-01-30 12:11:16,https://www.google.com/search?q=Machine+Learning+Jobs+Australia&ibp=htl;jobs&sa=X&ved=2ahUKEwi9p8fG_-_8AhXbGDQIHYl9CL0QutcGKAF6BAgSEAU#htivrt=jobs&htidocid=Ix5RGtvcytsAAAAAAAAAAA%3D%3D&fpstate=tldetail,KJR,Full-time,NA,"Melbourne VIC, Australia","KJR is now hiring Graduate Machine Learning in Melbourne VIC. View job listing details and apply now.Kick start your tech career by joining our team as a Graduate Machine Learning Consultant and learning from an extremely talented bunch of technologists, both on and off the job.• Kickstart your career in technology consulting• Learn from an experienced team of technologists• Friendly, fun, and flexible team environmentAs a Machine Learning Graduate, you will have the opportunity to learn from Data Scientists, DevOps engineers, and our consulting team to learn and apply best-practice data science and software engineering.This is a fantastic opportunity for someone looking to launch their career within the Machine Learning space. The structure of the team allows you to work closely alongside the entire team and other key staff gaining mentorship, knowledge, and experience.What are we looking for• Completed software engineering/web development certifications;• Strong... scripting skills using python or equivalent languages,• Solid understanding of machine learning models and their application to business problems,• Have strong verbal and written communication skills;• Experience building and deploying machine learning models; and• Degree in computer science, preferably natural language processing, speech processing, computer vision.Most importantly, youre passionate about learning and have an insatiable hunger for exploring and understanding new technologies. Were a collaborative team so you will like working with others and wont be afraid to share your ideas, ask questions or chat with colleagues and customers about the work youre doing.Who are weKJR is a technology-focused strategic advisory firm, that delivers. We help organisations build, buy and apply technology better. Were trusted by ASX 100 companies, Australian federal and state government departments, and the start-up ecosystem alike to help drive digital advancement for industry advantage.Like all great tech companies, we started life in 1997 out of our Founders garage and have since grown to employ over 100 software quality specialists Nationally, supported by offices in Sydney, Melbourne, Brisbane, and Canberra.Our Consultants are a unique bunch with a diverse range of skills and experiences. We encourage our people to identify what motivates them so they can write their own story, leveraging their interests and passions to be the best KJR Consultant they can be. Our fun and inclusive culture ensure that everyone enjoys coming to work each day and to prove this, we've been voted one of Australia's Top 100 Coolest Companies for three years running. KJR also ranked number one for the 2019 APAC Talent Board Candidate Experience Awards Benchmark Program.Check us out - www.kjr.com.auInterestedSelect Apply, create a profile in our Talent Community and well be in touch"
Postdoctoral Research Fellow / Research Fellow – Machine Learning for...,2023-01-15,2023-01-30 12:11:16,https://www.google.com/search?q=Machine+Learning+Jobs+Australia&ibp=htl;jobs&sa=X&ved=2ahUKEwi9p8fG_-_8AhXbGDQIHYl9CL0QutcGKAF6BAgSEAU#htivrt=jobs&htidocid=uD6_vbZAAcYAAAAAAAAAAA%3D%3D&fpstate=tldetail,Macquarie University,Full-time,NA,"North Ryde NSW, Australia","PRIMARY DETAILWe are seeking a talented and experienced Postdoctoral/Research Fellow to engage and embark in our new project within machine learning for precision healthcare.THE ROLESalary Package: Postdoctoral Research Fellow (Level A), from $97,621 to $104,622 p.a. or Research Fellow (Level B) $110,274 to $130,472 p.a., plus 17% employer's superannuation and annual leave loading.Appointment type: Full-time, fixed-term position for 2 yearsMacquarie University (North Ryde) locationThe RoleWe are seeking an enthusiastic researcher to participate in an established research program in artificial intelligence and machine learning for precision healthcare. The goal of the program is to research, develop, and evaluate a new generation of machine and deep learning methods and applications, to support clinicians in making better healthcare decisions. The research will be conducted as part of an NHMRC Partnership project and will focus on personalised patient-centric diagnosis... and treatment of neurological conditions using clinical and genomic datasets. You will be working with a cross-disciplinary group of highly experienced and internationally recognised researchers at the Centre for Health Informatics, at the Australian Institute of Health Innovation (AIHI) at Macquarie University and collaborating with other research groups.About YouYou will bring your expertise in machine/deep learning to a multi-disciplinary team and help the team to develop real-world systems. We are looking both for academic rigour and outputs, as well as practical analytical skills, proven problem-solving experience, and ability to interact with internal and external stakeholders. Ideally, you will have the desire to research health/medical applications of machine learning, with experience in using modern methods in real-world applications and working in a collaborative cross-disciplinary setting. You will be a good communicator, passionate about your research, and enjoy working in a dynamic team.About UsMacquarie is the university of pioneering minds. Globally recognised as one of Australias leading research universities, Macquarie is a place where extraordinary new possibilities come to light. Weve helped people to hear, introduced wireless internet technology to the world, and broken through traditional boundaries by appointing Australia's first female vice-chancellor.Macquarie University's Faculty of Medicine, Health and Human Sciences builds on our aspiration to have the nation's first fully integrated Academic Health Sciences Centre under a university's leadership. It brings together the excellent work of medical and allied-health clinicians and researchers across the University and around the country, with unparalleled access to world-leading clinical resources and research facilities found only on our campus. Our Faculty hosts the Australian Institute of Health Innovation (AIHI), an internationally acclaimed powerhouse researching health systems, e-health and patient safety.The Centre for Health Informatics (CHI) explores the application of novel digital technologies in healthcare with a specific focus on Artificial Intelligence (AI) and its implications for transforming models of care, driving system-wide change and delivering more personalised healthcare. The Centre leads a number of large-scale NHMRC projects in digital health and in 2018 established the Australian Alliance for Artificial Intelligence in Healthcare. As the longest-running digital health research centre in Australia, CHI is a research partner to major healthcare providers, research institutions and governments, and has national and international industry partnerships. The Centre generates high-impact research and works with many large Australian and international Electronic Health Record datasets and have expertise in the development and implementation of state-of-the-art artificial intelligence (AI) methods.Macquarie is a university engaged with the real and often complex problems and opportunities that define our lives. Since our foundation 54 years ago, we have aspired to be a different type of university. Over the years, weve grown to become the centre of a vibrant local and global community. Connect with us today.To ApplyTo be considered for this position, please apply online by submitting your CV with a publications list and a separate (1-2 pages) cover letter that demonstrates how you meet the selection criteria below. We ask that applicants also include a one-page summary of your top-3 publications explaining (a) the importance of these publications, and (b) your part in these publications.Selection Criteria:EssentialPhD in Computer Science, Data Science, Statistics, Health Informatics, or a closely related field.Experience in Machine/Deep Learning, Data Science/Analytics, or AI, and strong analytical skills.Excellent research track record evidenced by first-author publications in selective journals and conferences.Proven experience with relevant machine learning and data analytics environments, used to develop practical applications.Excellent written and verbal communication skills with an ability to communicate across discipline boundaries.Proven ability to conduct research independently and as part of a collaborative team.DesirablePublications in top-tier AI journals and conferences, such as IJCAI, NeurIPS, KDD, ICML, ICDM, etc.Understanding of medical and health applications, and experience with application of AI to health/medical problems.Experience in writing research proposals and securing research/industry funding.Experience in supervising Honours and high-degree research students.Appointment to either Postdoctoral/Research Fellow will be in accordance with demonstrated skills, and experience.Please see: Australian Institute of Health Innovation Recruitment prospectusSpecific Role Enquiries: Prof. Shlomo Berkovsky, Centre for Health Informatics, Australian Institute of Health Innovation at shlomo.berkovskymq.edu.auRecruitment Enquiries: Shubha Moorthy, HR Officer at shubha.moorthymq.edu.auApplications Close: Sunday 19 February at 11:55pm AEDTIf you're already part of the Macquarie Group (MQ University, UMQ, MQ Health, MGSM), you'll need to apply through your employee Workday account. To apply for this job: Login to Workday and go to the Careers App  Find Jobs.Applications Close:19/02/2023 11:59 PMDiversity and InclusionInnovation and ingenuity thrive at Macquarie University when diversity, equity and inclusion take centre stage. At the University, we embrace a culture where diversity of background, experience and perspective are fundamental to our success.We do not discriminate on gender identity, age, culture, disability, sexuality, Indigeneity, family and caring responsibilities or religion. See our journey towards leadership in Equity, Diversity and Inclusion in Higher Education.Flexible WorkAt Macquarie, we believe by providing flexibility in when, where and how work is done, we can support our staff to manage their personal commitments, while optimising their work performance and contributions to the University. See how we lead in flexible work to enable an outcome focused and inclusive workplace. To learn more about our culture and hiring process, explore our Candidate Resource Hub"
Machine Learning Engineer with Python and MLOps or DevOps,NA,2023-01-30 12:11:17,https://www.google.com/search?q=Machine+Learning+Jobs+Australia&ibp=htl;jobs&sa=X&ved=2ahUKEwi9p8fG_-_8AhXbGDQIHYl9CL0QutcGKAF6BAgSEAU#htivrt=jobs&htidocid=Dgi2tMRFpNUAAAAAAAAAAA%3D%3D&fpstate=tldetail,ZSoft Technologies Pty Ltd,Contractor,NA,"Canberra ACT, Australia",Machine Learning Engineer with Python and MLOps or DevOps - Canberra• Experience applying machine learning techniques within software development• Experience writing high quality Python code• Experience with MLOps or DevOps• Experience working as part of a team• Excellent communication skills• Relevant experience and/or qualifications in data science and software engineeringCanberra12 monthsAustralian Citizen with Baseline security clearance#MLOPS #DEVOPS #Python #datascience
Staff/Lead Software Engineering (ML Platform) [Hybrid/Remote] - AU,2023-01-25,2023-01-30 12:11:17,https://www.google.com/search?q=Machine+Learning+Jobs+Australia&ibp=htl;jobs&sa=X&ved=2ahUKEwi9p8fG_-_8AhXbGDQIHYl9CL0QutcGKAF6BAgSEAU#htivrt=jobs&htidocid=ScFPTktv8I0AAAAAAAAAAA%3D%3D&fpstate=tldetail,Employment Hero,Full-time,NA,"Sydney NSW, Australia","About UsMutinex is a rapidly growing data and marketing analytics company that is improving a multibillion-dollar industry with technology that is disrupting the traditional consulting-based approach to marketing mix modelling. Were building out our team, and are welcoming experienced talent into the organisation to collaborate in building a globally used product, GrowthOS, which is transforming how marketing is measured and valued. We empower marketers by helping them to understand the value of their past decisions, and the impact of future marketing spend.We have offices in both Melbourne and Sydney, and support remote work. We encourage you to work in the way that allows you to perform best.Whats the roleMachine learning is the central nervous system of our business, with our marketing insights driven by models using groundbreaking data science. Mutinex is looking for a Staff/Lead Software Engineer to build out a cutting edge platform to support the scale and pace of our... machine learning efforts across the company. By enabling our data scientists to experiment, train, and deploy models with minimal friction, you will be the owner of infrastructure and tooling that is a scale multiplier for our teams.Day to dayBuild scalable performant cloud infrastructure for model serving.Own and develop internal products to power ML prototyping using distributed infrastructure.Work with data science teams to improve the ergonomics and simplicity of our ML workflowsCreate ML observability through alerting and monitoring, allowing timely detection of model problems.Contribute to the design and implementation of contracts that ensure the data architecture, model, and product feature requirements are well defined and synchronisedMentor and provide technical feedback to others working in the ML engineering spaceQualificationsStrong background in infrastructure with 5+ years of industry software development.Demonstrated initiative in designing and developing systems end to end.Experience productionising machine learning models using distributed technologies.Experience mentoring and providing constructive feedback to team members.A curiosity for machine learning and GCP experience is a plus.Why you should join usWere improving a multibillion dollar industry with product technology that is disrupting the status quo of consulting based approaches to marketing mix modelling. Were well positioned to win - weve got brilliant people, a market leading product, and we are regularly closing household name customers (Samsung, Carlton United Breweries, Intuit, Mars Wrigleys, etc) on the strength of our product in the market.As a technology driven data science company we recognise that excellence in engineering will provide an edge that allows us to move faster and build richer more innovative products. Were putting our money where our mouth is, and investing substantially in the quality of our codebase and platform, and holding a high hiring bar for engineers in our teams.Youll also be joining a company thats harnessing the artificial intelligence and data science wave that is currently rolling through the industry. Data is in our DNA, and were positioned to join disruptive companies like Snowflake, OpenAI, Fivetran, Amplitude, Segment, Monte Carlo that have garnered multi billion dollar valuations. As we grow therell be an opportunity to share in the wealth upside with equity part of your package.The opportunity to work in a data science centred product company in Australia is not to be passed over lightly. Wed love to hear from you"
