Job-Title,Date-Posted,Date-Scraped,Url,Company,Job-Type,Salary,Location,Description
Junior/Mid Software Engineer in AI Team,NA,2023-01-30 12:16:35,https://www.google.com/search?q=Machine+Learning+Jobs+Croatia&ibp=htl;jobs&sa=X&ved=2ahUKEwi_udfrgPD8AhXGJzQIHcPeDEwQutcGKAF6BAgcEAU#htivrt=jobs&htidocid=nMKOl4_t5J4AAAAAAAAAAA%3D%3D&fpstate=tldetail,Photomath,Full-time,€207K–€337K a year,"Zagreb, Croatia","Photomath is a fast-growing EdTech company whose mobile app is the #1 app in the world to learn math.Powered by advanced machine learning technology, the app instantly scans, accurately solves, and intuitively explains printed and handwritten math problems to users through step-by-step explanations.With over 270 million downloads globally, Photomath is the most popular mobile application from Croatia and one of the most popular educational apps of all times.Since its launch in 2014, our award-winning app has topped App Store & Google Play Store education charts and Apple has recently declared it the application of the day.Today, we employ more than 150 people and have offices in Zagreb and San Mateo, California. We are constantly expanding what Photomath can do and the types and quality of our content - we have so much more ahead of us and we need your help to get there.What is the roleWe would like to enhance our end2end AI team where 20 dedicated engineers cover all... development activities from data engineering to model training and finally serving APIs ready for consumption by other teams or services.The role of the AI team is to tackle seemingly unsolvable problems using cutting-edge technology, focused on the solutions based on the fast-changing and always stunning field of deep learning.As a Software Engineer in our AI team, you will be involved in the whole lifecycle of research and development of AI-powered products from the idea to the final product. You will be responsible for the development of the tools and libraries that enable machine learning pipelines, all of that with the constant guidance of a dedicated mentor. You will also have the opportunity to work on the infrastructure together with our MLOps team and other developers in the AI team.Teams dev stack:• Python (PyTorch, TensorFlow, Flask), Docker, Kubernetes, Jenkins, PostgreSQLWhat will you do at PhotomathParticipate in the iterative AI problem-solving workflow:• defining the problem, metrics, and brainstorming about the potential solutions• defining the data source and annotation process (we are using a dedicated in-house annotation team)• the implementation of the required data preprocessing pipelines• proof-of-concept development• integrating a solution as a server-side or on-device service• running hyperparameter optimization to improve the accuracy and resource consumption• optimizing training/evaluation codebase to speed up hyperparameter optimization• supporting constantly growing dataset• jump to 5Our ideal candidate has:• Ability to write high quality and easy to maintain code• A keen eye for code complexity and performance• Familiarity with Python through personal projects or in the industry• An understanding of basic machine learning concepts taught at university courses or equivalent online courses (if you dont have it, our engineers have prepared useful resources to jump-start your machine learning adventures)• A desire to work on the whole interdisciplinary AI process from the idea to the actual implementation of the solution• Willingness to learn and implement new trends and technologies• Ability to work in a team, accept criticism, help younger colleagues, and maintain an open and friendly atmosphereAn additional plus if you have:• Experience in developing SaaS products and RESTful API's• Familiarity with relational databases• Experience in other relevant programming languages (Go, Kotlin, Java, C++)• Familiarity with image formats, processing, and computer graphicsSalary range:• Starting from 17.000 kn gross I for a junior candidate and beyond depending on candidate's competencies, you are welcome to give us a suggestion here• Stock optionsWhat we offer:• An opportunity to work on innovative AI projects with global impact in a team of top AI engineers• An opportunity to work with the cutting edge machine learning models (i.e. transformer-based architectures for tasks combining computer vision and natural language processing)• An opportunity to define and implement our infrastructure at scale• An opportunity to make an impact and define processes and ways of working in the fast-growing team• Experimenting with new technologies• Flexible working hours and work from home arrangements• Dedication to a healthy work-life balance and various benefits for parents• A diverse environment with agile and talented individuals across the career spectrum - to teach and be taught• A friendly, collaboration-heavy team atmosphere• A culture that recognizes and rewards dedication and success• Dedicated person (mentor/buddy) to help you navigate your first weeks in a new role• Learning and growth opportunities through knowledge sharing, education and conferences, individual development plan with a dedicated budget, weekly time devoted to learning new things• Cutting edge hardware and equipment, budget for additional equipment• Company events and celebrations, company retreat, team budget for team building activities• Birthday and holiday presents for employees and their kids• Generous vacation and paid leave policy, sick leave without a doctor's note, annual physical exam (check-up)• Multisport card for various discounts at sport facilities• Underground bicycle parking garage• Modern office design, great view :) and great location (Zagreb, Strojarska 20"
Senior ML Ops,2023-01-24,2023-01-30 12:16:35,https://www.google.com/search?q=Machine+Learning+Jobs+Croatia&ibp=htl;jobs&sa=X&ved=2ahUKEwi_udfrgPD8AhXGJzQIHcPeDEwQutcGKAF6BAgcEAU#htivrt=jobs&htidocid=ljjeakBB3EwAAAAAAAAAAA%3D%3D&fpstate=tldetail,EPAM Anywhere,Full-time,NA,Croatia,"Are you a tech professional looking for remote work in a global setting If yes, this job is for you.Welcome to EPAM Anywhere - a global job platform offering remote work opportunities in the technology sector. Join us to build a career around your lifestyle working on modern projects for global brands and exciting startups.Currently, we are looking for a remote Senior ML Ops with Python skills and Google Vertex AI skills to join our team.Our customer is a major company that aggregates broad and deep property data and generates analytics.You will help transform the systems to the cloud that will enable cost optimization, improve availability and reliability through architectural improvements, and enable further analytics and improved TTM.You will be focused on streamlining the process of taking machine learning models to production, and then maintaining and monitoring them.Responsibilities• Framing ML problems from business objectives• Data solutions for the problem•... Data preparation and processing• Model training and experimentation• Building and automating ML pipelines• Deploying models to the production system• Monitor, optimize, and maintain modelsRequirements• 3+ years of relevant experience in a Cloud Infrastructure Engineer role• Design and implement Cloud solutions GCP / AWS Cloud experience• Experience with the ML systems lifecycle• Experience with Docker, Kubernetes• MLOps pipelines (data pipeline engineering, training models, deployment, monitoring)• Knowledge of ML frameworks TensorFlow, PyTorch• Experience with Python and Python package management tools such as Poetry, and setup tools• Experience with CI/CD• Fluent English (B2+) is a must-haveThis is a remote position and we welcome applications from anywhere in CroatiaOnce you apply, you'll receive a confirmation email with a link to EPAM Anywhere platform. Sign up with this link to automate your prescreening, be able to monitor your application statuses, and enjoy a faster job application process.Please note that even though you are applying for this position, you may be offered other projects to join within EPAM Anywhere.EPAM Anywhere is a part of EPAM Systems, Inc. (NYSE: EPAM). Since 1993, EPAM has leveraged its advanced software engineering heritage to become the foremost global digital transformation services provider"
Data Science Team Lead - Kontxt,NA,2023-01-30 12:16:36,https://www.google.com/search?q=Machine+Learning+Jobs+Croatia&ibp=htl;jobs&sa=X&ved=2ahUKEwi_udfrgPD8AhXGJzQIHcPeDEwQutcGKAF6BAgcEAU#htivrt=jobs&htidocid=IYbFoxImQyEAAAAAAAAAAA%3D%3D&fpstate=tldetail,RealNetworks,Full-time,NA,Croatia,"RealNetworks KONTXT team in Zagreb seeks a Data Science Team Lead to take a critical role in the development of KONTXT, RealNetworks AI platform built to protect consumers from robocalls, fraud and spam calls and messages, along with state-of-the-art spam and grey route controls.In this role, you will work on ambitious new AI initiatives through research and development of NLP and speech products such as multilingual implementations of current models; highly optimized versions of SOTA models; model deployment techniques that preserve performance while increasing throughputs; models that combine speech and text capabilities; and ML engineering and data engineering processes that leverage our vast data resources to better our product.Our technical environment involves SOTA hardware, a codebase based around both SOTA and emerging NLP and speech frameworks and varying levels of experience in most supporting technologies. Some of the technologies used daily by our team include... Python, PyTorch, Huggingface Transformers, ONNX, Postgres, Docker, FastAPI, git, etc.You will work alongside our Distinguished Scientist as a link between Zagreb R&D and our New York-based Product/Engineering to:• Develop and package deep learning models for SMS traffic categorization on a large scale;• Provide guidance, expertise, and mentorship to colleagues on data curation, research, model implementation, and deployment;• Leverage your project management skills to oversee the team tasked with providing the ground truth for our many models;• Research and develop NLP and speech models (both ML- and deep learning-based) for a wide variety of other applications;• Work cross functionally with product, sales, data science, and service delivery teams on product development and support; and• Provide input, influence, and drive (where needed) initiatives to improve processes and best practices for data, product evaluation, and deployment.To be successful in this role, a candidate should have:• An advanced degree in in data science, computer science, electrical engineering, math, or related field• Experience conducting and presenting research in a primary AI field like CV, NLP, or speech (preferably NLP and speech), internal and/or published;• 3+ years experience with deep learning frameworks like Tensorflow or Pytorch, model packaging tools and optimization tools like ONNX, and/or model deployment tools like Tensorflow Serving or similar;• Natural leadership ability with experience mentoring/managing team members;• Experience with Python, and its many data science related packages (pandas, numpy, sklearn, etc); and• Experience with SQL, code versioning tools (git), an additional programming language.Our ideal candidate will also have experience:• With packaging applied research work into APIs or dockerized;• With writing optimized and clean code; and• Developing and supporting with high throughput models in production.Benefits:We have a dynamic, flexible work environment (flexible hours and work from home), and while we work hard, we value good work/life balance. In addition to competitive salaries, we provide a competitive benefit package that includes paid yearly health check-up, bonuses, perks and benefits, paid education, a fully stocked kitchen and more.We look forward to meeting you"
Engineering Manager - AI,NA,2023-01-30 12:16:36,https://www.google.com/search?q=Machine+Learning+Jobs+Croatia&ibp=htl;jobs&sa=X&ved=2ahUKEwi_udfrgPD8AhXGJzQIHcPeDEwQutcGKAF6BAgcEAU#htivrt=jobs&htidocid=3ojO_cRghrMAAAAAAAAAAA%3D%3D&fpstate=tldetail,Photomath,Full-time,NA,"Zagreb, Croatia","As an Engineering Manager you will have the opportunity to build and support great engineering teams at Photomath. You are expected to nurture the growth mindset and our unique engineering-driven innovation culture. You will identify growth opportunities for engineers and help them deliver great experiences to our users. You will have a chance to come up with creative ways to hit our goals by leveraging amazing engineering potential and in-house innovation capabilities. We do not expect you to write code and do hands-on technical work, but we expect technical excellence in order to drive roadmapping, system design and similar activities and understand and empathise with our engineers.Our Dev Stack• Kubernetes, Docker, Google Cloud Platform, Jenkins, Terraform, Ansible, Kotlin, Java, Python, PostgreSQL, MySQL, MongoDB, BigQuery, Redis, Elastic Search, C++, Boost, PyTorch, ArgoCD, React, Typescript, NodeJS, Swift.As Our Engineering Manager You Will Help Us WithScope and... Strategy-• Manage a team or several smaller teams of individuals that deliver on multiple projects in your domain of expertise in an end 2 end fashion (from plan to deployment and maintenance)• Understand product and company strategy, collaborate with cross-functional partners and drive goal setting, prioritisation and roadmapping• Actively propose and implement improvements in internal processes and procedures within the team, Org and companyTechnical Direction-• Be able to replace any engineer in the team in activities like roadmapping, planning, prioritization, reviews and technical decision making. Preferably, an engineering manager is also able to replace engineers in some technical work if needed, although pure tech work is not expected• Detect blind spots in team's technical plans and execution and help in removing any roadblocksGrow our Engineers-• Look for opportunities for individuals to grow and develop, match their strengths with project/product needs and helps them come up with their own career goals• Coach engineers in technical work as well as non-technical work like planning, delegation, unblocking themselves, communication & cross-functional work, project management and similar activities• Demonstrate growth mindset and self-reflection. Actively seek constructive feedback from team members and give constructive feedback to them on a regular basis.• Participate in the performance management process• Inspire and motivate team towards maximum happiness and outputOur Ideal Candidate Has• Strong technical background and at least 5 years in the industry• At least 3 years of leadership experience as being a Team Lead, Engineering Manager or equivalent role• Track record of delivering successful products as an engineer and a team lead• Experience guiding the continuous improvement of processes and technology• Thrive on providing and receiving honest but constructive feedback• Flexibility to work in diverse environments (in office or remotely, across different business locations and time zones, occasional flexible work hours)• Excellent English language skills (speaking and writing)An Additional Plus Is If You Have• Strong technical skills in the team's domain• Experience of being an Engineering Manager in international environmentIn Your First Week On The Job, Expect To• Follow your personalised ramp up plan• Meet key people and watch introduction lectures• Start reading our documentation, strategy, rhythm of business of your target teamIn Your First Month You Will• Start having 1:1s with your team members• Learn about the tech stack, projects and challenges of your target team• Learn about the work and people in other teams• Learn about our culture and what is engineering-driven innovation• Learn how Engineering Management at Photomath works now and how we envision it in the future• Start learning about our cross-functional partners from Product, Content, Math R&D and other teamsAfter First Three Months You Will Be Able To• Propose improvements in the way how your team and other engineering teams work• Actively participate in technical and product related discussions• Drive the roadmapping of a certain project• Start understanding the strengths and aspirations of your team mates• Enroll in our Engineering Management Academy programAfter First Six Months You Will• Support your team in driving projects from ideation to production• Collaborate with cross-functional teams to drive roadmapping and project execution• Conduct performance reviews which means asking for and collecting feedback, figuring out growth opportunities for your team members and giving them guidance on how to improve and grow further• Be able to understand existing processes, company and product strategy and OKRs• Interview new potential team membersAfter a Year And Beyond You Will• Have at least one major initiative or project completed with clear positive impact on the product• Create a roadmap and define OKRs for your team for the next year• Be able to effectively curate and align bottom-up engineering initiatives with the company and product goals and OKRs• Be able to propose and implement continuous improvements in Engineering Org and maybe even beyond (company-wide impact)Salary Range• Starting from 4,778.02 EUR gross and beyond, depending on the candidate's experience. You are welcome to give us a suggestion here.• Stock optionsWhat We Offer• User friendly, agile selection process consisting of just 3 clear steps• An opportunity to work on innovative projects with global impact in close• Flexible working hours and work from home arrangements• Dedication to a healthy work-life balance and various benefits for parents• A diverse environment with agile and talented individuals across the career spectrum - to teach and be taught• A friendly, collaboration-heavy team atmosphere• A culture that recognises and rewards dedication and success• Dedicated person (mentor/buddy) to help you navigate your first weeks in a new role• Learning and growth opportunities through knowledge sharing, education and conferences, individual development plan with a dedicated budget, weekly time devoted to learning new things• Cutting edge hardware and equipment, budget for additional equipment• Company events and celebrations, company retreat, team budget for team building activities• Birthday and holiday presents for employees and their kids• Generous vacation and paid leave policy, sick leave without a doctor's note, annual physical exam (check-up)• Multisport card for various discounts at sport facilities• Underground bicycle parking garage• Modern office design, great view :) and great location (Zagreb, Strojarska 20)And what do we doPhotomath is a fast-growing EdTech company whose mobile app is the #1 app in the world to learn math. Powered by advanced machine learning technology, the app instantly scans, accurately solves, and intuitively explains printed and handwritten math problems to users through step-by-step explanations.With over 300 million downloads globally, Photomath is the most popular mobile application from Croatia and one of the most popular educational apps of all times. Since its launch in 2014, our award-winning app has topped App Store & Google Play Store education charts and Apple has recently declared it the application of the day.Today, we employ 200+ people and have offices in Zagreb and Silicon Valley. We are a team of people with diverse backgrounds, experiences and skills, united by passion for technology and innovation. We believe that math is an increasingly crucial skill, particularly as problem-solving and quantitative analysis become prerequisites for many occupations.We are constantly expanding what Photomath can do and the types and quality of our content - we have so much more ahead of us and we need your help to get there.Join us in our mission to revolutionize learning math and help students across the globe gain math superpowers"
