Job-Title,Date-Posted,Date-Scraped,Url,Company,Job-Type,Salary,Location,Description
Data Engineer,2023-01-10,2023-01-11 18:15:33,https://www.google.com/search?q=Machine+Learning+Jobs+New+Zealand&ibp=htl;jobs&sa=X&ved=2ahUKEwjy6ofR7cD8AhWvIEQIHX1RBTQQutcGKAF6BAgSEAU#htivrt=jobs&htidocid=bONh7v3Szp8AAAAAAAAAAA%3D%3D&fpstate=tldetail,Vector Limited,Full-time,NA,"Auckland, New Zealand","Job Description About Us The energy sector is transforming at a rate of knots and we want you to join us and be part of this exciting transformation. Vector is a proudly Aotearoa-owned company, we operate a range of innovative businesses delivering energy and communication services to more than one million homes and commercial customers across Australasia and the Pacific. Because we live in a world that is changing fast, we continue to identify and develop better options that will provide value, choice and service for our customers throughout New Zealand and beyond, so the environment and communities we love continue to thrive. To do this, our people are creating a new energy future where power will flow through brilliant infrastructure, smart technology, and clever systems. We need the best and the brightest to capitalise on the convergence of technology, sustainability and customer focus that forms the basis of our strategy. Exciting partnerships with AWS and X, the moonshot... factory are key to fulfilling our long-stated ambition to partner with like-minded organisations to accelerate the future of energy for our customers. Join the team and be part of the solution! About the role As a Data Engineer in our DevOps team, you will be responsible for the design and implementation of Vector's cloud-based data solutions. You will design, develop, and release Behavior Driven Development (BDD) and Test-Driven Development (TDD) data solutions to enable our data engineering, BI and data science teams to perform data transformation and analytical activities. You will design, build and/or implement:  Data flow and processing pipelines for ingestion into AWS data lake using cloud-based tools and services such as Apache Spark, AWS Glue, EMR and Lambda  Unit tests for the data processing pipelines as well as CI/CD pipelines in AWS cloud  Data integration between machine learning models and other data processing pipelines using cloud-based services such as AWS Sage Maker From time to time, you will also be required to provide DevOps support to the Enterprise Data Warehouse and BI Platform team as well as 24x7 on call support as and when is needed. The salary range for this role is approximately $85-110,000, depending on experience. This is a full time position at 40 hours per week, and based in our Auckland Newmarket offices. Who we are looking for Ideally youre a seasoned Developer with experience in a Data Engineer, Software Developer or BI Developer role and have worked in an agile environment. Youve got experience and are capable of leading AWS cloud-based data engineering development, and have a comprehensive knowledge of Behavior-Driven Development and Test-Driven Development. Youll have hands on and technical experience with modern data and analytics services and technologies, such as:  Distributed Data Processing Framework such as Apache Spark  AWS data lake technology stack (S3, Glue, Athena)  Data integration services (AWS EMR, Lambda)  CI/CD pipeline development (CodePipeline, Terraform)  Programming languages (Scala, Java and/or Python)  Unit testing frameworks  Machine Learning service such as AWS SageMaker In addition, youve worked on large-scale data engineering projects including requirements gathering, design and have working knowledge of Data Warehouse and Business Intelligence stack (SQL, ETL, database and dimensional modelling). What we can offer you We love working together to create a new energy future. If you want to be part of an organisation with a real and tangible purpose, Vector could be the place for you. We offer:  A fun, flexible and stimulating work environment, full of interesting work being done by smart and innovative people.  Flexibility, including the choice of working from home a couple of days a week, and flexible start and finish times so you can balance work and life.  Health and wellbeing support  Great benefits that reflect the importance of family. Vector engages a workforce made up of people and teams with diverse skills, values, backgrounds, and experiences. We respect and value people who are different from each other, including gender, ethnicity, disability, age, sexual orientation, race, and religion. We are proud of what we have achieved so far -  First corporate Living Wage Accredited employer  First Accessibility Tick employer  Rainbow Tick accredited  Winner of three gongs at the 2019 Diversity Awards NZ, including the Supreme Award in 2019 and 2020. If you require assistance or accessibility support from us during the application and selection process, please do get in touch with us on 09 978 7636. Due to Covid-19 immigration restrictions, we can only accept applications from candidates who are either NZ/AU citizens/permanent residents or hold a current valid work visa for employment in New Zealand. Applications will close Monday 30 January 2023; interviews may be held earlier as applications are received, so apply today"
Data Scientist,NA,2023-01-11 18:15:34,https://www.google.com/search?q=Machine+Learning+Jobs+New+Zealand&ibp=htl;jobs&sa=X&ved=2ahUKEwjy6ofR7cD8AhWvIEQIHX1RBTQQutcGKAF6BAgSEAU#htivrt=jobs&htidocid=7hoiqXbSA6UAAAAAAAAAAA%3D%3D&fpstate=tldetail,KPMG New Zealand,Full-time,NA,"Auckland, New Zealand","KPMG New Zealand is part of the international KPMG network, one of the worlds leading professional services organisations. We provide audit, tax, and advisory services to individuals, SMEs, not-for-profit organisations, multi-nationals and government agencies. KPMG Digital Lighthouse is comprised of several specialist chapters who combine to design, deliver and operate cutting edge digital solutions on a variety of architectures, supporting our cross-sector clients to digitally transform their organisations and thrive on a global scale. We are a passionate, inclusive and supportive team who care about our clients, our people and the work we do. Join us today and accelerate your digital career with KPMG. The opportunity:  As a Data Scientist, you will be responsible for applying advanced analytics to large data sets, developing and applying custom models and algorithms to obtain insights and drive strategic and tactical decisions Day to day you will:  Use advanced analytics ... statistical techniques such as predictive modelling, machine learning, clustering and natural language processing to solve challenging business questions in a novel way  Process and transform raw data, and enrich data by integrating it with disparate data sources  Review models and algorithms developed by your colleagues or by a client  Work with clients and stakeholders throughout the organisation to identify opportunities to leverage data and analytics to drive business solutions  Keep up with latest industry trends and contribute to thought leadership on trending topics that are relevant to our clients What you'll bring to the team:  Qualification in Computer Science, Engineering, Statistics, Mathematics, Physics, Information Science, or another quantitative field and a strong problem-solving aptitude  Experience using programming or scripting languages (e.g., Python, R, SQL, Scala etc.) and familiarity withy mainstream data science and visualisation frameworks and tools (e.g., Pandas/NumPy, Scikit-learn, Databricks, Power Bi, Tableau)  Prior experience preparing data for analysis, building predictive models and machine learning models on large scale platforms, and helping to drive innovation in the modelling process/offerings  Experience with Cloud Platforms (e.g., Azure, AWS, and/or Google Cloud)  Excellent written and verbal communication skills, with proven ability to work with cross-functional teams and bridge technical and non-technical audiences KPMG New Zealand has a summer shutdown period from the 23rd December 2022 to the 16th January 2023 (inclusive). During this time, please expect a delay in response to any new applications. Most recruitment processes will commence interviewing in February 2023. Life at KPMG We offer rewarding careers to talented individuals and a holistic range of benefits to support your life balance, whatever your circumstance. We want you to do Work That Matters, Thrive and Grow and know that you Belong here with us, at KPMG. As a KPMG employee, we will offer you:  Access to the firm's annual incentive scheme  Opportunities for local and international secondments  Hybrid working across a mix of office, client and home hubs to recognise that people have individual circumstances and preferences when it comes to where and how they work  A technology starter pack to get your 'home hub' set up  The ability to work from overseas and extend time connecting with friends and family outside New Zealand  Flexible leave options, including the ability to purchase additional annual leave.  Gender-neutral support for all stages of the parental journey, including access to 18 weeks of fully paid parental leave for all new parents  A paid professional association membership of your choice  Unlimited digital accreditations through our partnership with Microsoft, LinkedIn Learning, with bespoke learning pathways for all employees  A wide-range of special offers and discounts on insurances, banking services, and lifestyle goods and services.  The support, allyship and opportunity to join our many Inclusion, Diversity and Equity Affinity networks, including the Kiwa, Pride, Ethnicity, Accessibility and Wahine groups  The opportunity to participate in Green Team activities, as we work toward reducing the firms environmental footprint and become carbon zero by 2030  An invitation to join our local Social club and enjoy events aimed at bringing people together for social, sporting, cultural, family and fundraising activities  Paid time off for volunteering and involvement in citizenship activities  A paid professional association membership of your choice.  An array of health and wellness benefits such as free flu vaccinations, subsidised sporting events, free confidential counselling services, additional leave to support you and your family in the recovery from COVID-19, access to our Wellbeing portal with an extensive range of advice and resources and much much more! We believe that diversity of background and experience strengthens relationships and delivers meaningful benefits to our people, clients and communities. Our goal is to be recognised as an employer of choice for all, irrespective of gender, ethnicity, generation, flexible work status, family circumstances, sexual orientation or disability. Further info can be found on our website We are a 2022 Circle Back Initiative Employer  we commit to respond to every applicant"
Professor in Data Science,NA,2023-01-11 18:15:34,https://www.google.com/search?q=Machine+Learning+Jobs+New+Zealand&ibp=htl;jobs&sa=X&ved=2ahUKEwjy6ofR7cD8AhWvIEQIHX1RBTQQutcGKAF6BAgSEAU#htivrt=jobs&htidocid=DHnGVbhGKQAAAAAAAAAAAA%3D%3D&fpstate=tldetail,Maori Pacific Jobs,Full-time,NA,"Auckland, New Zealand","Job Description Professor in Data Science Teach, research, lead and collaborate Lead our computing disciplines in interdisciplinary analytics initiatives Join AUTs dynamic School of Engineering, Computer and Mathematical Sciences Auckland University of Technology (AUT)is vibrant, achievement-oriented and a compensateing place to work. Ranked in the top 250 of world universities, Information technology is also one of the worlds top 40 young universities and #1 for global research impact in Australasia. Were poised for the next stage of growth and offer a stimulating teaching and research environment with strong connections to government, business and industry. AUT has close to 30,000 students and around 3,000 staff across our three teaching campuses and is located in New Zealands (NZs) largest city,Auckland consistently ranked as one of the worlds most liveable cities. OurComputer Science and Software Engineering department (CSSE)is part of AUTs large, unique, dynamic... and interdisciplinarySchool of Engineering, Computer and Mathematical Sciences (ECMS).The department constitutes world-leading research skills in AI/Machine Learning, Networks and Cybersecurity, Software Engineering, and Information Systems, with special emphasis on the discovery and application of expertise. Data Science has been an area of strength where we are expecting significant growth in our programmes and courses. Industry and academic interest in this area is high and is expected to continue to rise, our newData Science majoris part of our BCIS degree and We are seeking to expand to postgraduate offerings in the near future. We host the Data Science Research Group, whom along with other colleagues within the school have active research projects with a range of external stakeholders in the area. This is an exciting opportunity for a forward-thinking Professor of Data Science with skills in at least two of the following data science related areas  large databases and data warehousing, artificial intelligence, data mining, machine learning or data visualisation. Recognising the growth and increasing significance of data across a wealth of disciplines, AUT is looking at pan-university collaboration in analytics as a strategic direction. The appointee would be expected to take a leading function in representing the computing disciplines in these interdisciplinary initiatives. As we continue to grow our programmes, there are also opportunities to guide course development and build interdisciplinary linkages and models. Other key focus areas include:  Providing leadership abilities to the Data Science theme, including securing external research grants and leading teams of colleagues and students to achieve high-quality research results (grants, publications).  Providing leadership abilities to the planning and delivery of applied, innovative and theoretically underpinned Data Science curricula, which would include collaboratively working with internal and external stakeholders.  Providing leadership abilities to develop the departments profile both internally and externally for its strengths and innovations in Data Science research and teaching. You will be recognised as a senior academic who displays attributes of tolerance, empathy, trustworthiness, confidence and kindness. Your capability to listen, connect, collaborate, communicate and influence will be critical  as is your level of strong respect for others coupled with an open and engaging attitude that is flexible to changing requirements. Youll enhance the positive energy within AUT, value diversity and work inclusively. A resolute, robust and positive attitude is essential. NOTE: The School of ECMS is also currently advertising for a Head of Department and Professor of Mechanical Engineering to further bolster its academic leadership abilities, clickHEREFor more information. Applications and Selection Criteria Please submit a curriculum vitae (including full publication record), cover letter and a statement covering the following key selection criteria :  A record of distinguished academic achievement and research appropriate for appointment as a Professor. A PhD/Doctorate is required.  In-depth expertise of at least two of the following data science related areas  large databases and data warehousing, artificial intelligence, data mining, machine learning or data visualisation.  Evidence of an consciousness of the growing significance of issues such as security and privacy of data, big data and bias, and commitment to the ethical uses of data.  International standing in the area of data science research, leading and working within moderate to large size research teams.  Evidence of curriculum design and implementation.  Evidence of contributions in the mentoring and the career growth of academic colleagues, especially underrepresented groups  A demonstrated record of commitment to Te Tiriti o Waitangi and consciousness of New Zealand as a bi-cultural society.  candidates are welcome to add further comments they may feel of relevance. more information:  Start Date: The prosperous candidate will ideally join AUT in February 2022 (or earlier by negotiation).  A competitive remuneration package will be agreed with the prosperous applicant, commensurate with skills and practice.  Referees will only be engaged for shortlisted candidates and will not contacted without the prior consent of the applicant. When applying, candidates should provide names, contact details and clarification of relationship for at least three potential referees. For academic enquires: Contact Professor Aman Maung Than Oo (Head of School, Engineering, Computer and Mathematical Sciences) aman.ooaut.ac.nz. For recruitment information: Contact Mike Wood (AUT Executive Recruitment Partner) mike.woodaut.ac.nz. Advertising Closing date: Sunday, 17 October at 23:55pm (New Zealand standard time). We expect interviews to take place during November 2021. Listing reference: 79493 Please note: In response to COVID-19, the New Zealand Government has imposed travel restrictions and are currently only allowing New Zealand residents, citizens and visa holders meeting a strict exception policy to enter the country, all of whom must currently enter Government approved isolation/quarantine for two weeks upon arrival. Its uncertain when these border restrictions will change, and this may impact the manner in which an offshore candidate will be able to participate in the recruitment process although remote options will be in place. Visit the Immigration New Zealand website or the New Zealand Governments official Covid-19 website For more information and updates on the border restrictions. At AUT we strive to be a place where people love to work and learn. We are committed to inclusivity and the Treaty of Waitangi and aspire to be the University of choice for Mori and Pacific communities. We welcome people of all ethnicities, genders, sexual orientations, religious and political beliefs, socio-economic situations and accessibility needs. Please note that all applications must be submitted through the online application process. For more information, please send us an enquiryhereor call 921 9499. Please note we are happy to answer your questions but we do not accept applications by email. You will need to apply through the standard registration process. How to submit the application: Click Here to apply:https://careers.aut.ac.nz/jobdetailsajiddYWsb Advertising Closing date: Sunday, 17 October at 23:55pm (New Zealand standard time). We expect interviews to take place during November 2021. Listing reference: 79493 Skills: Job Category: Language requirements: Employment type: Salary: Unspecified Degree: Unspecified Experience (year): Unspecified Job Location: Auckland Company Type Employer Post Date: 2023/01/02 / Viewed 2963 times Contact Information Company: Maori Pacific Jobs Contact Email: aman.ooaut.ac.nz"
Data Intelligence (Application Engineer),2023-01-09,2023-01-11 18:15:35,https://www.google.com/search?q=Machine+Learning+Jobs+New+Zealand&ibp=htl;jobs&sa=X&ved=2ahUKEwjy6ofR7cD8AhWvIEQIHX1RBTQQutcGKAF6BAgSEAU#htivrt=jobs&htidocid=1IvE362S51YAAAAAAAAAAA%3D%3D&fpstate=tldetail,Spark New Zealand,Full-time,NA,"Auckland, New Zealand","The Company Spark operates in an exciting and constantly evolving industry, where the pace of change brings new and unique challenges every day. We have adopted an ""Agile"" way of working to allow us to meet the fast-changing needs of our customers. Agile facilitates a transparent, collaborative environment with highly productive teams who are empowered to deliver better outcomes for our customers. It is our belief is that this way of working provides an enriched career experience for you, both in terms of the role you perform and your professional growth. We pride ourselves on being a truly inclusive company where everyone can be, and bring, their true selves every day. The Data Story at Spark Spark has been on a journey with data, with data getting increasingly embedded into business decision-making. Data Democratization, Machine Learning and Artificial Intelligence are at the forefront of our new opportunities. We are actively looking at ways to create data products to make our... data more accessible than ever before to help both Spark and our valued customers win big in a digital world. One of the key aspect of building these data products is to create beautiful and intuitive user interfaces using web development and data visualisation tools/ techniques (incl. React, JavaScript, R Shiny, Python, GIS) and enable interaction with insights driven by deep data analytics and commercial levers. About The Role This role is focussed on building data applications with beautiful, highly interactive and intuitive user interfaces along with creating and managing the microservice architecture behind these applications. It requires skills in software engineering, web development, data visualisation and DevOps (full-stack development skills). It's also an opportunity to get exposure to exciting field of Data Science, Artificial Intelligence, Automation. Our people work across the organisation delivering complex, high impact initiatives. Day to day  Work in cross-functional squads delivering data applications  Setup, maintain and make use of end-to-end cloud environment / architecture for software application  Consult across teams as a SME for how we can enable or create big data driven applications  Engage with teams across the organisation to understand their data needs  Demo and showcase work to stakeholders About You You come with ""batteries included"", showing up with a positive attitude and energy every day. You're also a self-starter with a bias for action who seeks out the best way of doing everything you get involved in. You question the status quo, see the bigger picture and are good at ""joining the dots"", plus you tick (at least a few of) these boxes:  Degree in Technology, Business or Science  Experience in full-stack development  Knowledge of microservice architecture  Frontend development using ReactJS, NextJS, Typescript etc.  Backend development - REST API, GraphQL, R / Python API  Data visualisation using R Shiny, D3.js  SQL Server, PostgreSQL, MongoDB, MySQL  Knowledge of Git, GitHub, Azure, Azure DevOps, Docker, Kubernetes, Terraform  Clear communicator  Excellent problem solving ability  Great interpersonal skills  Team player (Mandatory)  Understand sources of business and customer value If that sounds like you, and you want to work with a great team who sound like that too, Apply now"
Senior Machine Learning Platform Engineer,NA,2023-01-11 18:15:35,https://www.google.com/search?q=Machine+Learning+Jobs+New+Zealand&ibp=htl;jobs&sa=X&ved=2ahUKEwjy6ofR7cD8AhWvIEQIHX1RBTQQutcGKAF6BAgSEAU#htivrt=jobs&htidocid=iBPNyrD6lSsAAAAAAAAAAA%3D%3D&fpstate=tldetail,Tencent,Full-time,NA,"Auckland, New Zealand","About Us LightSpeed Studios is one of the worlds most innovative and successful game developers. With team across China, United States, Singapore, Canada, United Kingdom, France, Japan, South Korea, New Zealand, and United Arab Emirates. We are expanding to more countries. Founded in 2008, LightSpeed Studios has created over 50 games across multiple platforms and genres for over 4 billion registered users. It is the co-developer of worldwide hits PUBG MOBILE, Apex Legends Mobile, and League of Legends: Wild Rift (Chinese Version). LightSpeed Tech Center is a centralized platform for LightSpeed Studios, including game engine, audio, QA, AI, tech partnership, research & development, and other tech-related teams. Responsibilities - Participate in architecture design and coding around building a good AI platform for training and online service. - Bring AI capabilities to the gaming business by building ML Ops processes. Qualifications - Bachelor's degree or above in computer... science, engineering or a related field strongly preferred - Experience in end-to-end ML implementationincluding data pre-processing, feature engineering, ML experimentation, and DevOps principles - Experience in Cloud native development, including docker, k8s - An ability to write good code in your favorite programming language (experience with C++/Python/Go may be helpful), and familiarity with common ML frameworks and tools - Passionate about learning and applying new, relevant technologies"
