Job-Title,Date-Posted,Date-Scraped,Url,Company,Job-Type,Salary,Location,Description
Volunteer / Internship in Nepal - Trainer Volunteers - BIG DATA /DATA...,NA,2023-01-30 12:31:04,https://www.google.com/search?q=Machine+Learning+Jobs+Nepal&ibp=htl;jobs&sa=X&ved=2ahUKEwivuqqJhPD8AhU3HjQIHYXID64QutcGKAF6BAgcEAU#htivrt=jobs&htidocid=wC4yazEVKuQAAAAAAAAAAA%3D%3D&fpstate=tldetail,EcoHomeStay Nepal,Internship,NA,Nepal,"What is Data SciencePeople have tried to define data science for over a decade now, consisting of math and statistics, subject expertise (knowledge about the domain to abstract and calculate), and hacking skills. Essentially if you can do all three, you are already highly knowledgeable in the field of data science.Data science is a concept used to tackle big data and includes data cleansing, preparation, and analysis. A data scientist gathers data from multiple sources and applies machine learning, predictive analytics, and sentiment analysis to extract critical information from the collected data sets. They understand data from a business point of view and can provide accurate predictions and insights that can be used to power critical business decisions.Skills Required to Become a Data ScientistAnyone interested in building a strong career in this domain should gain critical skills in three departments: analytics, programming, and domain knowledge. Going one level deeper... the following skills will help you carve out a niche as a data scientist:• Strong knowledge of Python, SAS, R, Scala• Hands-on experience in SQL database coding• Ability to work with unstructured data from various sources like video and social media• Understand multiple analytical functions• Knowledge of machine learningWhat is a Data AnalyticsA data analyst is usually the person who can do basic descriptive statistics, visualize data, and communicate data points for conclusions. They must have a basic understanding of statistics, a perfect sense of databases, the ability to create new views, and the perception to visualize the data. Data analytics can be referred to as the necessary level of data science.Skills Required to Become a Data AnalystA data analyst should be able to take a specific question or topic, discuss what the data looks like, and represent that data to relevant stakeholders in the company. If youre looking to step into the role of a data analyst, you must gain these four key skills:• Knowledge of mathematical statistics• Fluent understanding of R and Python• Data wrangling• Understand PIG/ HIVEData Science vs. Data AnalyticsData science is an umbrella term that encompasses data analytics, data mining, machine learning, and several other related disciplines. While a data scientist is expected to forecast the future based on past patterns, data analysts extract meaningful insights from various data sources. A data scientist creates questions, while a data analyst finds answers to the existing set of questions.What is Machine LearningMachine learning can be defined as the practice of using algorithms to extract data, learn from it, and then forecast future trends for that topic. Traditional machine learning software is statistical analysis and predictive analysis that is used to spot patterns and catch hidden insights based on perceived data.A good example of machine learning implementation is Facebook. Facebooks machine learning algorithms gather behavioral information for every user on the social platform. Based on ones past behavior, the algorithm predicts interests and recommends articles and notifications on the news feed. Similarly, when Amazon recommends products, or when Netflix recommends movies based on past behaviors, machine learning is at work.Skills Required to Become a Machine Learning EngineerMachine learning is just a different perspective on statistics. The following are critical skills that can help you jumpstart your career in this fast-growing domain:• Expertise in computer fundamentals• In-depth knowledge of programming skills• Knowledge of probability and statistics• Data modeling and evaluation skillsData Science vs. Machine LearningBecause data science is a broad term for multiple disciplines, machine learning fits within data science. Machine learning uses various techniques, such as regression and supervised clustering. On the other hand, the data in data science may or may not evolve from a machine or a mechanical process. The main difference between the two is that data science as a broader term not only focuses on algorithms and statistics but also takes care of the entire data processing methodology.Source: QuoraData science can be seen as the incorporation of multiple parental disciplines, including data analytics, software engineering, data engineering, machine learning, predictive analytics, data analytics, and more. It includes retrieval, collection, ingestion, and transformation of large amounts of data, collectively known as big data. Data science is responsible for bringing structure to big data, searching for compelling patterns, and advising decision-makers to bring in the changes effectively to suit the business needs. Data analytics and machine learning are two of the many tools and processes that data science uses.Nepalese Diploma, Graduates & Undergraduates youths are very much in need of learning the knowledge & Skills of Python , BiG Data ,Data Science , Data Structre ,Data Analytics ,Data Analysis ,Machine Learning , AI ,GIS-RS and so on ,Therefore,We are inviting Potential Volunteers to come visit Nepal ,exchange cross culture ,experience Nepal Himalyas ,Pokhara ,Chitwan Lumbini and many more and please help our youths learning above said Data Science ,Machine Learning and so on .If you require further information ,we can do an online orientation interaction Meeting for further informations if required any .Why Nepal Why EcoHomeStay Nepal Volunteers Nepal is one of the most beautiful, culturally rich and welcoming country in the world. Nepal is very rich in diversity where temperature and culture differs every minutes of distance . It is home to Mount Everest, the birthplace of Lord Buddha, and an astonishingly beautiful and diverse landscape, ranging from the well-known peaks of the Himalayas to the low-lying regions of the Terai-Madesh. The Nepali people are as diverse as the geography, with over 70 languages or dialects and scores of traditional festivals celebrated throughout the year.However, Nepal is among the poorest and least developed countries in the world with low rates of literacy, high rates of poverty and a persistent gender imbalance. The government is frequently unable to provide adequate education and health facilities throughout the country and both urban and rural areas are forced to live without the necessary resources to promote the growth and development of their communities:• 42% of the population live below the poverty line on less than $240 a year• 15,000 orphans are living on Kathmandu's streets• 42% of the population of Nepal are unemployed• 51% illiteracy rate throughout Nepal• 2.5 doctors are available for each 100,000 inhabitants• 54% of Nepali children are malnourished• More than 80% population are engaged into Family Farming ( FAO )Our VISION, Mission ,Goals & Projects We envision contributing towards creating Jobs & reducing all types of Poverty, Preparedness of FMNs ( Futurist Mothers of Nepal ),conservation, Climate Change, Sustainable, Digital & More Organic Nepal. Our vision is to contribute toward United Nation's Sustainable Goals through FMN ( Futurist Mothers of Nepal ),SAF AgriTech, SAF Agri solution, SAF, SAF Food Tech, SAF Environment& Conservation Tech, SAF Fin Tech, SAF Medi Tech, SAF Media Tech, SAF Hospitality & Tourism Tech, EcoHomestay Nepal, PCRC -Red Panda Conservation & Research Center & more...We envision creating jobs and contributing to Nepal's Rural Sustainable Tourism, Poverty, Unemployment, Conservation and Climate change, carbon footprint, Food Safety & Food Scarcity, Environment, Public Health, Preparedness of FMNs and so on. Our vision is to contribute toward Organic Food, Cleaner, Greener, Digital and more Sustainable Organic Nepal.We believe in turning challenges into opportunities and we also believe that problem solving can be a Career, Job & business opportunity. Tourism helps flow Consumers & encourage Consumers in consuming Goods & Services. Therefore, Tourism is the key for every sector.Why Agropreneur's ,EcoHomeStay ,UFC, FMN,SAF Nepal VOLUNTEERS We seek to address the issues of environment, Climate Change, Preparedness & Financial Freedom of FMNs ( Futurist Mothers of Nepal ) ,Agriculture, Wild Lives, Conservation, Red Panda, Birds ,Forestation ,Organic,Technology,Farmers Market, Innovation ,Research, Youth & Women Empowering, Education & Children, Nutrition ,Waste Management ,Food & Public Health, Rural Development , Rural & Sustainable Tourism, literacy, poverty and gender imbalance by partnering with institutions, organizations & Individuals and ensuring that the progress made is sustainable. We also run a cross-cultural exchange program, Nepali language and cultural classes, Mentorship, Internship, Fellowship,OJT, Volunteering, Practicum, Research , Innovation , Workshop , Training , Meditation , Yoga , Organic Farm Stay and EcoHomeStay program in Nepal.Volunteering, Internship Research ,Innovation work in Nepal can be an extremely rewarding and life-changing experience. Your efforts can bring great changes in the lives of individual people and the wider community. This cannot be said enough. In the difficult times that Nepal is now facing post Pandemic Crisis, your contribution of time or resources is extremely valuable.We envision creating jobs and contributing to Nepal's Rural Sustainable Tourism, Poverty, Unemployment, Conservation and Climate change, carbon footprint, Food Safety & Food Scarcity, Environment, Public Health, Preparedness of FMNs and so on. Our vision is to contribute toward Organic Food, Cleaner, Greener, Digital and more Sustainable Organic Nepal.Why We are hiring Volunteers & Interns Our Vision,mission,Goal,Core Objectives are to help local farmers,Futurist Mothers of Nepal(FMNs ),youth entrepreneurs,grassroots people,reduce poverty,contribute to environment,climate change,waste,management,education,PublicHealth,employment,Technology ,Innovation ,Research ,Capacity building ,Marketing , Promotion ,Digitization ,Sustainability.Our finding is that main challenges are marketing , promotion ,branding , Also ,Our Local Nepalese Youths, Students,FMNs,Entrepreneurs,Farmers dream to learn these special skills by considering our Volunteers & Interns as their Mentors & apply these learning Methods- "" by learning by doing "" , Learning by Making Mistakes ""We welcome international Volunteers & Interns to participate in these projects & our Nepal Volunteering Program so that Our Local Youths, Farmers,Futurist Mothers ,Entrepreneurs and International Volunteers will make a big team and learn from each others.What is included in internship/volunteeringAs a volunteer, you will receive an introduction that includes Nepali lessons and sightseeing, and we take you to your host family and workplace.Why volunteer/Internship with us• As a volunteer /Intern you will have an amazing time with us as you:• Will engage in the ongoing development process of Nepal• Develop your personal and life skills• Grow an understanding of the Nepali people, their language and culture• Take part in local festivals, and weddings, and visit small villages• Immerse yourself in the spectacular natural beauty and surroundings of NepalResponsibilities - The main responsibility shall be collaborating with our Local Youths,farmers,women groups, Entrepreneur's, and actively participate in the projects and Programs. Any of your skills can be of most value.Qualification - Any level of Degree or Education is fine, but the Volunteers should have interest and desire to learn and teach in a TeamworkJob Description - An online Orientation shall be provided through which we will be able to explain to you the specific job description. Please do not worry ! As we believe in Learning by doing & Learning by making Mistakes as well as Learning by Sharing.Fresher & Learners ! - If you are highly self-motivated with will power to take the challenge and learning by making mistakes and Learning by Doing then you can choose our Volunteer or Internship option for any role of your interest. Please contact us for further details about volunteer & Internship with us .Working Hours - This position requires flexible working hours so no hard rules apply. This is team work too so everyone shall have to remain happy with flexible and extra working hours and consider the work not as the work but Work as the Fun !Accommodation - We have our own and & our Members Family Farmers Homestay Houses almost in every Part of Nepal with Nepalese Normal single bedroom with clean blanket , bed sheet , pillow , mattress , common bathroom with shower ,Wi Fi internet , Electricity. If you need more Luxurious than this you have freedom to add but with your own money.Food -1 Tea & breakfast - Organic Green Tea /black tea and fresh Milk tea with Nepalese typical breakfast such as boiled egg potatoes ,bread chapati Bread ,chiura ,soup2.Lunch - Daal bhat sabji - Veg and Non Veg Lunch shall be provided with Nepalese typical food3.Dinner - Nepalese typical daal bhat ( Lentil Soup & Steam Rice )with veg or non veg shall be provided. If you need more than this you have full freedom to buy on your ownVisa & Others - Visa and others are your own responsibility .We shall assist you with the documentation and processing wherever neededArrival and OrientationOrientation begins on the morning of next day your arrival and covers everything you need to know for your volunteer program in Nepal  an introduction to Nepal, Nepalese customs, language training details, rules and expectations, safety, travel opportunities in Nepal, and an introduction to your project and placement. The orientation will also give you a chance to visit local temples, sample authentic Nepali food, meet other volunteers and swap contact details for weekend travel and socializing. The program may vary depending on your time of arrival. We will manage to include all below mentioned activities in you introduction program.• Arrival and introduction host family• Survival Nepali lessons and cultural discussion• Local amenities and sightseeing and project startWe believe in turning challenges into opportunities and we also believe that problem solving can be a Career, Job & business opportunity. Tourism helps flow Consumers & encourage Consumers in consuming Goods & Services. Therefore, Tourism is the key for every sectors.Namaste Nepal! Naturally Nepal!, Once is not Enough !Rethink Nepal !Mission Statement - ""Cleaner ,Greener ,Digital & More Sustainable Organic Nepal "
MLOps Engineer,NA,2023-01-30 12:31:05,https://www.google.com/search?q=Machine+Learning+Jobs+Nepal&ibp=htl;jobs&sa=X&ved=2ahUKEwivuqqJhPD8AhU3HjQIHYXID64QutcGKAF6BAgcEAU#htivrt=jobs&htidocid=Lfg8MxlFIpoAAAAAAAAAAA%3D%3D&fpstate=tldetail,Fusemachines,Full-time,NA,"Kathmandu, Nepal","About FusemachinesFusemachines is a leading AI strategy, talent, and education services provider. Founded by Sameer Maskey Ph.D., Adjunct Associate Professor at Columbia University, Fusemachines has a core mission of democratizing AI. With a presence in 4 countries (Nepal, the United States, Canada, and the Dominican Republic and more than 250 full-time employees) Fusemachines seeks to bring its global expertise in AI to transform companies around the world.About the roleThis is a full-time roleResponsibilities• Design the data pipelines and engineering infrastructure to support our clients enterprise machine learning systems at scale• Build and turn offline models into a real machine learning production system• Develop and deploy scalable tools and services for our clients to handle machine learning training and inference• Identify and evaluate new technologies to improve performance, maintainability, and reliability of our clients machine learning systems• Apply... software engineering rigor and best practices to machine learning, including CI/CD, automation, etc.• Support model development, with an emphasis on auditability, versioning, and data security• Facilitate the development and deployment of proof-of-concept machine learning systems• Communicate with clients to build requirements and track progressQualifications• 3+ years experience building production-quality software.• Experience building end-to-end systems as a Platform Engineer, ML DevOps Engineer, or Data Engineer (or equivalent)• Proficiency in AWS compatible ML Technologies  AWS Sage maker• Experience with cloud stacks, e.g. AWS and Infrastructure as Code e.g. Terraform Experience• Fluency in Python• Comfort with Linux administration• Experience working with cloud computing and database systems• Experience building custom integrations between cloud-based systems using APIs• Experience developing and maintaining ML systems built with open source tools• Experience developing with containers and Kubernetes in cloud computing environments• Familiarity with one or more data-oriented workflow orchestration frameworks (KubeFlow, Airflow, Argo, etc.)• Ability to translate business needs to technical requirements• Strong understanding of software testing, benchmarking, and continuous integration• Exposure to machine learning methodology and best practices• Exposure to deep learning approaches and modeling frameworks (PyTorch, Tensorflow, Keras, etc.Education• Bachelor's or Master's degree and/or equivalent professional experienceEqual Opportunity Employer: Race, Color, Religion, Sex, Sexual Orientation, Gender Identity, National Origin, Age, Genetic Information, Disability, Protected Veteran Status, or any other legally protected group status"
Artificial Intelligence (AI) / Machine Learning Intern,2023-01-10,2023-01-30 12:31:05,https://www.google.com/search?q=Machine+Learning+Jobs+Nepal&ibp=htl;jobs&sa=X&ved=2ahUKEwivuqqJhPD8AhU3HjQIHYXID64QutcGKAF6BAgcEAU#htivrt=jobs&htidocid=qegEkEoi2aEAAAAAAAAAAA%3D%3D&fpstate=tldetail,Greenie Web,Full-time,NA,"Pokhara, Nepal","Greenie Web is a ClimateTech startup that enables the the green transition through technology.The RoleYour Responsibilities Will Include• Creating predictive and prescriptive models that could have a positive impact on the business.• Driving data modelling activities ranging from conceptualization, visualization to operationalization.• Performing statistical analysis on historical data to validate models.• Working across stakeholders to identify and capitalize on opportunities to leverage data to drive business solutions.• Gathering and evaluating user feedback.• Providing code documentation and other inputs to technical documents.• Supporting continuous improvement by investigating alternatives and new technologies and presenting these for architectural review.• Troubleshooting and debugging to optimize performance.Ideal ProfileSkills Required• You possess a minimally a bachelor's degree, ideally in Mathematics, Statistics, Computer Science or related field.• You... have at least 1 year experience, ideally within a Software Engineer or Data Scientist role.• Ability to write and execute complex queries in SQL or similar• You are highly goal driven and work well in fast paced environments• You are a self-starter and demonstrate a high level of resilience• You pay strong attention to detail and deliver work that is of a high standardWhat's on Offer• Opportunity to make a positive impact• Flexible working options• Leadership Role"
ML Engineering Manager,NA,2023-01-30 12:31:05,https://www.google.com/search?q=Machine+Learning+Jobs+Nepal&ibp=htl;jobs&sa=X&ved=2ahUKEwivuqqJhPD8AhU3HjQIHYXID64QutcGKAF6BAgcEAU#htivrt=jobs&htidocid=EkDU63i9dKUAAAAAAAAAAA%3D%3D&fpstate=tldetail,Fusemachines Nepal Pvt. Ltd.,Full-time,NA,"Kathmandu, Nepal","ML Engineering ManagerAbout FusemachinesFusemachines is a leading AI strategy, talent, and education services, provider. Founded by Sameer Maskey Ph.D., Adjunct Associate Professor at Columbia University, Fusemachines has a core mission of democratizing AI. With a presence in 4 countries (Nepal, the United States, Canada, and the Dominican Republic and more than 250 full-time employees) Fusemachines seeks to bring its global expertise in AI to transform companies around the world.Qualification and Experience• Minimum 3 years of experience in large team/department-level management in the software engineering environment• Bachelors or Masters degree in Computer Science, Management or related fieldRequired Skills/ Competencies• Proven ability to recruit, develop and retain talent.• Excellent interpersonal, planning & organizational skills.• Highly adept at project/resource management in a demanding fast-changing environment with tight deadlines and scarce resources... Ability to multi-task is key.• General understanding of machine learning: algorithms, evaluation procedures, frameworks and libraries will be a plus• Software development experience with knowledge of software engineering best practices will be a plus pointKey Responsibilities• Manage and develop a department of high-performing machine learning engineers to keep them motivated, grow their technical expertise and meet their career aspirations• Assist upper-level management and oversee departmental budget/initiatives/strategic planning (training, infrastructure, team engagement, hiring etc.)• Collaborate with other department/team leads for cross-team (department) initiatives ( like hiring, marketing, customer success etc.)Equal Opportunity Employer: Race, Color, Religion, Sex, Sexual Orientation, Gender Identity, National Origin, Age, Genetic Information, Disability, Protected Veteran Status, or any other legally protected group status.Tagged as: Engineering Management Post, IT company, Jobs in Kathmandu(Old"
AI Computer Vision Engineer,NA,2023-01-30 12:31:06,https://www.google.com/search?q=Machine+Learning+Jobs+Nepal&ibp=htl;jobs&sa=X&ved=2ahUKEwivuqqJhPD8AhU3HjQIHYXID64QutcGKAF6BAgcEAU#htivrt=jobs&htidocid=-6DdTAsDMLkAAAAAAAAAAA%3D%3D&fpstate=tldetail,Fusemachines,Full-time,NA,"Kathmandu, Nepal","AI Computer Vision EngineerLocation: Kathmandu, NepalType: Full TimeDepartment: Asia TechnologyExperience: Mid LevelAbout FusemachinesFusemachines is a leading AI strategy, talent, and education services provider. Founded by Sameer Maskey Ph.D., Adjunct Associate Professor at Columbia University, Fusemachines has a core mission of democratizing AI. With a presence in 4 countries (Nepal, the United States, Canada, and the Dominican Republic and more than 250 full-time employees) Fusemachines seeks to bring its global expertise in AI to transform companies around the world.About the roleThe AI Computer Vision/Machine Vision Engineer will develop novel AI-driven object recognition and video analysis components supporting object, image, and action recognition in multiple domains with a heavy emphasis on pose estimation. This is a full-time position.Role scope• Design, implement, train, and improve new and existing AI Computer Vision algorithms• Analyze and curate... appropriate image and video datasets to support recognition tasks• Set up test and evaluation environment for image processing and machine vision applications including data collection, processing, and annotation• Collaborate with engineers to identify and leverage the latest best practices around image processing, machine vision, and machine learning• Select and tune the appropriate algorithm, models, and techniques to given situations, problems, and issues• Performs ad-hoc analysis and presents results in a clear manner• Prepares reports, charts, graphs, and other statistical informationRequirements for the role• Proven work experience as an AI Computer Vision Engineer/Machine Vision Engineer or similar role• Expertise in one of the major AI libraries (PyTorch, Tensorflow, Open.ai)• Pose estimation, prefer MediaPipe• Python expertise, with at least basic object-oriented python experience• Object detection for bounding boxes, semantic and instance segmentation• Recurrent Neural Networks with LSTM• Multidimensional neural networks• Tuning neural networks• Automated preparation and organization of training and test data• Experience with Linux and GPU-accelerated AI• Familiarity with OpenCV and similar frameworks• Experience with developing computer vision AI systems targeting object/feature recognition for single images and motion/activity recognition for video sequences• Excellent problem solver• Time management skills• Excellent communication skills• Strong analytical skills• High degree of organization, individual initiative, and personal accountability• Astute with high resilience and the ability to achieve results and milestones in uncertain development situationsQualification RequirementsBachelors degree in computer science, data science, IT, or related field of study or equivalent experience5+ years of experience as an AI Computer Vision Engineer/Machine Vision EngineerEqual Opportunity Employer: Race, Color, Religion, Sex, Sexual Orientation, Gender Identity, National Origin, Age, Genetic Information, Disability, Protected Veteran Status, or any other legally protected group status"
