Job-Title,Date-Posted,Date-Scraped,Url,Company,Job-Type,Salary,Location,Description
Computer Vision Engineer,2023-01-10,2023-01-30 12:27:04,https://www.google.com/search?q=Machine+Learning+Jobs+Japan&ibp=htl;jobs&sa=X&ved=2ahUKEwiHoOeTg_D8AhXKAzQIHRG4DycQutcGKAF6BAgOEAU#htivrt=jobs&htidocid=nj-nmwX8pygAAAAAAAAAAA%3D%3D&fpstate=tldetail,Citadel AI,Full-time,NA,"Shibuya City, Tokyo, Japan","Were hiring a computer vision engineer to work with our small, full-stack team to build products to test, monitor, and improve the reliability of machine learning systems. We work with customers that deploy computer vision systems across a wide range of high-risk domains, and they rely on our products to ensure that their systems are reliable and interpretable.ResponsibilitiesAs a computer vision engineer, youll be responsible for developing state-of-the-art methods to test the robustness and interpretability of computer vision models. Youll also be responsible for researching different computer vision problem domains and working with customers in those domains (e.g. medical imaging, autonomous driving, manufacturing).Our backend is primarily in Python, and we use many Python ML libraries (PyTorch, Tensorflow, etc.). Some other (non-ML) technologies we use are: Docker, PostgreSQL, Redis, RQ, Gunicorn, Flask, TensorFlow Extended, Pytest.RequirementsOur company, technology... and market are new and changing rapidly, so a large part of the job is to adapt and learn new things. We value learning fast over pre-existing knowledge (slope is more important than y-intercept).You should have at least 1 year of computer vision software engineering experience. We dont require past experience with specific programming languages or frameworks.We prioritize candidates in Tokyo, but may consider remote for exceptional candidates.Nice to havesThese arent required, but be sure to mention them in your application if you have them.You can work full-stack, youve worked at a startup before, you have experience with production machine learning, or you have research experience in machine learning"
Senior Data Scientist,2023-01-11,2023-01-30 12:27:05,https://www.google.com/search?q=Machine+Learning+Jobs+Japan&ibp=htl;jobs&sa=X&ved=2ahUKEwiHoOeTg_D8AhXKAzQIHRG4DycQutcGKAF6BAgOEAU#htivrt=jobs&htidocid=1_ny_EMcHGoAAAAAAAAAAA%3D%3D&fpstate=tldetail,Amazon,Full-time,NA,"Tokyo, Japan","DESCRIPTIONAt Amazon, we're working to be the Earth's most customer-centric company. The goal of JP Last Mile Technology Team is to exceed the expectations of our customers by ensuring that their orders, no matter how large or small, are delivered as quickly, accurately, and cost effectively as possible. To meet this goal, Amazon is continually striving to innovate and provide best in class delivery experience through the introduction of pioneering new products and services in the last mile delivery space.JP Last Mile Technology Team is seeking a Senior Data Scientist to design, evangelize, and implement state-of-the-art solutions for never-before-solved problems, helping last mile space, based in Tokyo, Japan.The Senior Data Scientist will work closely with other research scientists, machine learning experts, and economists worldwide, to design and run experiments, research new algorithms, and find new ways to improve last mile analytics to optimize the Customer experience. The... Scientist will partner with technology and product leaders to solve business and technology problems using scientific approaches to build new services that surprise and delight our customers. Science at Amazon is a highly experimental activity, although theoretical analysis and innovation are also welcome. Our scientists work closely with software engineers to put algorithms into practice. They also work on cross-disciplinary efforts with other scientists within Amazon worldwide.Related informationDepartment https://www.amazon.co.jp/bnode5637343051Data Analyst/Engineer https://www.amazon.co.jp/bnode5609906051Location https://www.amazon.co.jp/bnode5589794051Amazon is committed to a diverse and inclusive workplace. Amazon is an equal opportunity employer and does not discriminate on the basis of race, national origin, gender, gender identity, sexual orientation, protected veteran status, disability, age, or other legally protected status. For individuals with disabilities who would like to request an accommodation, visit https://www.amazon.jobs/disability/jpKey job responsibilitiesThe key strategic objectives for this role include:• Understanding drivers, impacts, and key influences on last mile delivery dynamics.• Drive actions at scale to provide low prices and increased selection for customers using scientifically-based methods and decision making.• Helping to build production systems that take inputs from multiple models and make decisions in real time.• Automating feedback loops for algorithms in production.• Develop input and assumptions based preexisting models to estimate the costs and savings opportunities associated with varying levels of network growth and operations• Communicating with and supporting various internal stakeholders and external audiences• Utilizing Amazon systems and tools to effectively work with terabytes of data.About the teamLast Mile Execution Analytics (LMEA) team of JP works as an integral part of Amazon Logistics to ensure that its business intelligence, analytics, tools and planning needs are met. By providing information, insight, and decision support, we strive to enable success of all parts of Amazon Logistics. Our customer set includes senior management, station operations, external vendors, long-term planning, Ops technology (Voice of the Delivery Station, Voice of the Customer), network planning, and pretty much every BI and Ops teams in Amazon Logistics.BASIC QUALIFICATIONS• Masters in quantitative field (Computer Science, Mathematics, Machine Learning, AI, Statistics, or equivalent)• Knowledge and expertise with Data modelling skills, SQL with Oracle, MySQL, and Columnar Databases• Skilled with Java, C++, or other programming language, as well as with R, SAS, MATLAB, Python or similar scripting language• 5+ years of experience working in data science in a consumer product company, managing Machine Learning Scientists, Data Scientists, Research Scientists, Applied Scientists, Economists or equivalent fields• Experience in leading experienced scientists• Business level of EnglishPREFERRED QUALIFICATIONS• A PhD in a quantitative field (Computer Science, Mathematics, Machine Learning, AI, Statistics, or equivalent)• 10+ years of experience working in data science in a consumer product company• 5+ years of experience managing Machine Learning Scientists, Data Scientists, Research Scientists, Applied Scientists, and/or Economists• Extensive knowledge and practical experience in several of the following areas: machine learning, statistics, NLP, deep learning, recommendation systems, dialogue systems, information retrieval, XGBoost, LightGBM, ElasticNet.• Functional knowledge of AWS platforms such as S3, Glue, Athena, Sagemaker.• Ability to distill informal customer requirements into problem definitions, dealing with ambiguity and competing objectives• Ability to manage and quantify improvement in customer experience or value for the business resulting from research outcomes• Demonstrated industry leadership in the fields of Database and/or Data Warehousing, Data Sciences and Big Data processing.• Deep understanding of data, application, server, and network security• Superior verbal and written communication skills, ability to convey rigorous mathematical concepts and considerations to non-experts• Successful record of developing junior members to a successful career track• Excited about working in a diverse group and contributing to an inclusive culture.Please check the website below for measures to eliminate unwanted second-hand smoking in each facility:https://www.amazon.jobs/en/landingpages/passivesmokinghttps://www.amazon.jobs/jp/landingpages/passivesmokingThe salary information can be provided individually prior to the 1st interview"
Data engineer,2023-01-16,2023-01-30 12:27:05,https://www.google.com/search?q=Machine+Learning+Jobs+Japan&ibp=htl;jobs&sa=X&ved=2ahUKEwiHoOeTg_D8AhXKAzQIHRG4DycQutcGKAF6BAgOEAU#htivrt=jobs&htidocid=uaV7XUKkEKAAAAAAAAAAAA%3D%3D&fpstate=tldetail,Boyd & Moore Executive Search,Full-time,NA,"Tokyo, Japan","Job DescriptionDesign, build, and maintain distributed batch and real-time data pipelines and data models.Facilitate real-life actionable use cases leveraging our data with a user- and product-oriented mindset.Be curious and eager to work across a variety of engineering specialties (i.e., Data Science, and Machine Learning to name a few).Support teams without data engineers with building decentralized data solutions and product integrations, for example around DynamoDB.Enforce privacy and security standards by design.Conceptualize, design and implement improvements to ETL processes and data through independent communication with data-savvy stakeholders.Preferred QualificationsExperience with RESTful APIs, Pub/Sub Systems, or Database Clients.Experience with analytics and defining metrics.Experience with measuring data quality.Experience productionalizing a machine learning workflow; MLOpsExperience in one or more machine learning frameworks, including but not limited to... scikit-learn, Tensorflow, PyTorch and H2O.Language ability in Japanese and English is a plus (We have a professional translator but it is nice to have language skills).Experience with AWS services.Experience with microservices.Knowledge of Data Security and Privacy.Working ConditionsEmployment StatusFull TimeOffice LocationWFA(Work From Anywhere at Anytime)Remote JobYou can live anywhere in JapanWork HoursSuper Flex Time (No Core Time)In principle, 10:00am-6:45pm (actual working hours: 7h45m + 1h break)HolidaysEvery Sat/Sun/National holidays (In Japan)/New Year's break/Company-designated Special daysPaid leaveAnnual leave (up to 14 days in the first year, granted proportionally according to the month of employment. Can be used from the date of hire)Personal leave (5 days each year, granted proportionally according to the month of employment)SalaryAnnual salary paid in 12 installments (monthly)Based on skills, experience, and abilitiesReviewed once a yearSpecial Incentive once a year *Based on company performance and individual contribution and evaluationLate overtime allowance, Work from anywhere allowance (JPY100,000)BenefitsSocial Insurance (health insurance, employee pension, employment insurance and compensation insurance)401KLanguage Learning supportTranslation/Interpretation supportVISA sponsor + Relocation support"
Particle/ASTRO/COSMO/NUCL PD under Machine learning initiative,NA,2023-01-30 12:27:06,https://www.google.com/search?q=Machine+Learning+Jobs+Japan&ibp=htl;jobs&sa=X&ved=2ahUKEwiHoOeTg_D8AhXKAzQIHRG4DycQutcGKAF6BAgOEAU#htivrt=jobs&htidocid=y48WMZmS8GcAAAAAAAAAAA%3D%3D&fpstate=tldetail,"KEK, Theory Center, Institute of Particle and Nuclear Studies",Full-time,NA,"Tsukuba, Ibaraki, Japan","Job DescriptionThe position is dedicated to the theoretical study of particle physics and related fields (astrophysics and cosmology) under the KAKENHI projecton ""Innovative advances in particle physics through machine learning""in the project area ""Foundation of ""Machine Learning Physics"" --- Revolutionary Transformation of Fundamental Physics by A New Field Integrating Machine Learning and Physics.""https://mlphys.scphys.kyoto-u.ac.jp/en/https://mlphys.scphys.kyoto-u.ac.jpTerm 2+ 1 yearsQualificationApplicant must have a Ph.D. before starting the job at KEK. Candidates who do not have experience in machine learning may be considered, but successful candidates should be interested in machine learning application to physics study.Method of SelectionAfter document screening, an interview will be held if necessary.SalaryThe expected salary range is about 300,000 JPY per month. Salary and various allowances are determined according to the KEK rules. (Annual salary... system)Working HoursIn principle, a discretionary work system for professional work is applied, and working hours will be deemed as 7 hours and 45 minutes per daPlease submit1) Curriculum vitae(possible starting date should be written)2) Research experience3) List of publications4) Research plan5) Two letters of Recommendation or Reference written about the personApplications should be submitted through Academic Jobs Online:https://academicjobsonline.org/ajo/jobs/23019For more information: please contactMihoko NojiriE-mail: nojiripost.kek.jpOthers1) KEK is promoting gender equality. By the intent of the ""Basic Act for Gender Equal Society,"" when the finalists for a position comprise both males and females whose qualifications and merit, including experiences, education, research achievements, and social contributions, have been deemed equal, preference will be given to the female candidate.2) An option for working at home is available to improve work-life balance or to cope with the exceptional working environment.3) Sufficient research budget will be allocated for this position. Please contact for the detail"
Senior Research Scientist (Reinforcement Learning),NA,2023-01-30 12:27:06,https://www.google.com/search?q=Machine+Learning+Jobs+Japan&ibp=htl;jobs&sa=X&ved=2ahUKEwiHoOeTg_D8AhXKAzQIHRG4DycQutcGKAF6BAgOEAU#htivrt=jobs&htidocid=900Eh0nWUJAAAAAAAAAAAA%3D%3D&fpstate=tldetail,Sony AI,Full-time,JP¥4.5M–JP¥7.51M a year,Japan,"Sony AI is seeking highly motivated, self-driven individuals with expertise in deep reinforcement learning (deep RL) and Machine Learning. Were currently looking for smart, enthusiastic people who want to join our team of world renowned researchers as we push the boundaries applying AI in support of human creativity. In this role, the successful candidate will apply reinforcement learning and other forms of machine learning to challenging domains like computer games, robotics, gastronomy and ethics.Roles and Responsibilities• Lead research programs applying deep RL to real domains in Gaming, Robotics• Investigate new algorithms and approaches to solving AI problems• Write code to support research, usually in python• Write reports and give presentations for internal audiences• Write papers for, and give presentations at academic conferences• Work closely with a team of AI researchers and programmers in the US, Switzerland and Japan on ambitious AI projectsRequired... Qualifications and Skills• D. in reinforcement learning or equivalent experience• 3 or more years of industry experience• Experience managing or mentoring small teams• Experience designing and debugging neural networks• Passion for making AI work in realistic domains• Excellent written and oral communication skills, as well as interpersonal skills including the ability to articulate to both technical and non-technical audiencesOther Required Knowledge• The ability to deliver on tight deadlines and adapt to evolving or changing requirements• Excellent verbal and written communication skills in English, and willingness in learning JapanesePreferable major: Computer Science, Machine Learning, Artificial IntelligenceWorking Location: Tokyo, Japan/ US (location within US is flexible)Apply now at Sony AI"
Research Engineer,NA,2023-01-30 12:27:07,https://www.google.com/search?q=Machine+Learning+Jobs+Japan&ibp=htl;jobs&sa=X&ved=2ahUKEwiHoOeTg_D8AhXKAzQIHRG4DycQutcGKAF6BAgOEAU#htivrt=jobs&htidocid=05cAuUuL75YAAAAAAAAAAA%3D%3D&fpstate=tldetail,SyntheticGestalt,Full-time,NA,"Shinjuku City, Tokyo, Japan","SyntheticGestalt seeks to develop autonomous systems to invent new drug candidate compounds for patients suffering from diseases, and new genes for synthetic organisms that will improve the global environment. As a Research Engineer, you will define and implement the steps necessary for the successful development of such a system. Specifically, you will develop the machine learning models that compose the system, which will be difficult as they differ from the typical models in terms of the data and their purpose. You will be required to propose, with the help of members with various specialisations, hypotheses on what improvements would bring you closer to achieving your objectives, and to act as a pioneer in actually implementing and verifying these hypotheses.The development of machine learning systems at SyntheticGestalt consists of teams that take on various roles, e.g. developing models for the generation of compounds, developing models for predicting protein function... searching for new training data, designing features for small molecule compounds, etc. Your interests and aptitude will determine the team you belong to and your area of focus, but you will often collaborate with other teams. This is where the real thrill of working together to develop one system for a long time for shared objectives comes in.ResponsibilitiesAll of the following are areas of responsibility, but one of them will be a dedicated area depending on the team belonging to.• Develop a machine learning model dealing with chemical compound information, propose hypotheses to improve the model, validate the performance of it.• Propose and create new features based on data and purpose• Implement MLOps and distributed computing environments• Explore and add data to be used for training and inference• Search for relevant papers, apply and validate their conceptsRequirementsWe have different requirements depending on whether youve worked with chemical compound information or not.If you have experience working with chemical compound information, were looking for• 2+ years of working experience as a machine learning engineer or a data scientist working with chemical compound information• 1+ publication in an international conference / journal as a first authorIf you have a general background in machine learning, were looking for• 4+ years of working experience as a software/machine learning engineer• 3+ years of working experience as a machine learning engineer• 2+ year of working experience as a deep learning engineer• 1+ year experience of each in developing 2+ types of deep learning models: e.g., image 1yr and natural language 1yr, or graph 1yr and generative model 1yrNice to havesThese arent required, but be sure to mention them in your application if you have them.• PhD in computer science, mathematics, physics, or a related field• Experience in Chemoinformatics, Bioinformatics or a related field• Experience in distributed computing / high performance computing• Experience in cloud computing• Working experience as a data scientist"
MLOps Engineer,2023-01-06,2023-01-30 12:27:07,https://www.google.com/search?q=Machine+Learning+Jobs+Japan&ibp=htl;jobs&sa=X&ved=2ahUKEwiHoOeTg_D8AhXKAzQIHRG4DycQutcGKAF6BAgOEAU#htivrt=jobs&htidocid=kDXJm1LIWecAAAAAAAAAAA%3D%3D&fpstate=tldetail,CTW,Full-time,"US$45,360–US$84,240 a year",Japan,"Job Overview As an MLOps engineer, you will be responsible for enabling model deployment automation to production systems to increase the number and quality of users as the G123 platform grows its portfolio of games and expands globally. Build and turn offline model data into a real machine learning production system Apply software engineering rigor and best practices to machine learning (i.e. CI/CD, automation etc.) Requirements Proven proficiency in Python Expertise in AWS and its services such as SageMaker, EC2, ECS etc Experience using DAGs to define data pipelines with airflow Master SQL and manipulating database systems (TiDB, etc) Knowledgeable in ML libraries (e.g. TensorFlow & PyTorch) Knowledgeable in CI/CD & Devops principles Proficient in Software Engineering fundamentals Language Requirements Can work in Chinese OR Japanese OR English Can read and understand technical documents in English Benefits Visa support Free lunch catering (*after 3 months employment) and... early-bird breakfast Free in-office Starbucks, coffee, tea, beverages, snacks, sweets, & vitamins/supplements Modern office space in the heart of Tokyo, with views of Tokyo Tower and Mount Fuji Industry-leading work-life harmony: overtime is rare and discouraged Commute expenses covered 30,000 yen rent support if you live 2 stops from Roppongi 1-chome or Kamiyacho stations Bonus for continuous employment (50,000 yen/month added to base salary after 5 years of continued employment) Health insurance Diverse & international environment Working hours: 10:00  19:00, Monday to Friday (in-office) About CTW.inc Founded in 2013, CTW is Japans No.1 browser game company. Our primary service is the G123 IP game platform  which publishes video games based on famous Japanese IP. Weve been experiencing steady growth in revenue in the past few years as our player base has exploded to over 50 million users worldwide. We must grow quickly to keep up with market demand. Our CEO founded and named this company with the aspiration to ""Change the World."" As a fast-growing startup, we hope our team will drive themselves to try new things and accelerate their careers to match the rapid expansion of the company. Our core values are- ambition- drive- simplicity With global hits like Vivid Army, Queen's Blade, and many more, were looking to go from a market leader in Japan to an industry leader globally"
"Data Scientist, Analytics",NA,2023-01-30 12:27:08,https://www.google.com/search?q=Machine+Learning+Jobs+Japan&ibp=htl;jobs&sa=X&ved=2ahUKEwiHoOeTg_D8AhXKAzQIHRG4DycQutcGKAF6BAgOEAU#htivrt=jobs&htidocid=ahlAa30U4jQAAAAAAAAAAA%3D%3D&fpstate=tldetail,Appier,Full-time,NA,"Tokyo, Japan","Appier is an AI SaaS company on a mission to make AI easy, by making software intelligent. Founded in 2012, Appier has 17 offices across APAC, U.S. and Europe and is listed on the Tokyo Stock Exchange. Visit www.appier.com for more information.You are going to work in the AiDeal product team. AiDeal is one of our products, which presents discount offers to e-commerce site visitors at the most appropriate timing, personalized by technology to detect the visitors growing desire to buy. We do this by analyzing browser behavior data (mouse-moving, scrolling, clicks, gestures) in real-time.About the roleWe are looking for Data Scientists in Japan that will be part of our data science team. You will work closely with Machine Learning Scientists, Engineers, and other product related roles to perform data analytics for achieving Appiers product and business goals.Task of the role• Drive initiatives and experimentations in product (e.g., enhance the efficiency to deliver ads to end... users in real-time-bidding scenarios).• Evaluate and define product and business metric framework.• Build key data sets/pipelines to empower operational and exploratory analysis.• Conduct data analysis reports to illustrate the results and insight (dashboards, reports)About youEssential• 2+ years of industry experience in the data analytics area.• Can write efficient Python scripts for data analysis and job automation.• Statistics knowledge and skills, using SQL to do basic data extraction and aggregation.• Sufficient know-how of machine learning and basic experience of using machine learning tools.• Fluent in Pandas or PySpark.• Good analytical skills to extract meaningful insights from the data.• Ability to communicate data analysis insight to audiences with different backgrounds.• Proficient oral and written communication skills in English.Nice to have• Working experiences in digital advertising industries"
