Job-Title,Date-Posted,Date-Scraped,Url,Company,Job-Type,Salary,Location,Description
Data Scientist - QuantumBlack,2023-01-11,2023-01-11 18:15:41,https://www.google.com/search?q=Machine+Learning+Jobs+New+Zealand&ibp=htl;jobs&sa=X&ved=2ahUKEwjy6ofR7cD8AhWvIEQIHX1RBTQQutcGKAF6BAgSEAU#htivrt=jobs&htidocid=Zw7fip_QP5AAAAAAAAAAAA%3D%3D&fpstate=tldetail,McKinsey,Full-time,NA,"Auckland, New Zealand","As a Data Scientist at QuantumBlack in Australia or New Zealand, you will work with other data scientists, data engineers, machine learning engineers, designers and project managers on interdisciplinary projects, using maths, statistics and machine learning to derive structure and knowledge from raw data across various industry sectors. Who you are You are a highly collaborative individual who is capable of laying aside your own agenda, listening to and learning from colleagues, challenging thoughtfully and prioritising impact. You search for ways to improve things and work collaboratively with colleagues. You believe in iterative change, experimenting with new approaches, learning and improving to move forward quickly. As a Data Scientist at QuantumBlack... You will work in multi-disciplinary environments harnessing data to provide real-world impact for organisations globally. You will influence many of the recommendations our clients need to positively change their businesses... and enhance performance. Role responsibilities  Work on complex and extremely varied data sets from some of the world's largest organisations to solve real world problems  Develop data science products and solutions for clients as well as for our data science team  Write highly optimized code to advance our internal Data Science Toolbox  Work in a multi-disciplinary environment with specialists in machine learning, engineering and design  Add real-world impact to your academic expertise, as you are encouraged to write 'black' papers and present at meetings and conferences should you wish  Attend conferences such as NeurIPS and ICML as one global team as well as Data Science retrospectives where you will have the opportunity to share and learn from your co-workers.  Work within one of the largest and most advanced data science teams in London, support the Lead Data Scientists to develop data science products What you'll learn  How successful projections on real world problems across a variety of industries are completed through referencing past deliveries of end to end machine learning pipelines  Build products alongside the Core engineering team and evolve the engineering process to scale with data, handling complex problems and advanced client situations  Be able to focus on modelling by working alongside the Data Engineering team which focuses on the wrangling, clean-up and transformation of data.  Best practices in software development and productionise machine learning by working with our Machine Learning Engineering teams which optimise code for model development and scale it  Work with our UX and Visual Design teams to interpret your complex models into stunning and user-focused visualisations  Using new technologies and problem-solving skills in a multicultural and creative environment You will work on the frameworks and libraries that our teams of Data Scientists and Data Engineers use to progress from data to impact. You will guide global companies through data science solutions to transform their businesses and enhance performance across industries including healthcare, automotive, energy and elite sport.  Real-World Impact- No project is ever the same; we work across multiple sectors, providing unique learning and development opportunities internationally.  Fusing Tech & Leadership- We work with the latest technologies and methodologies and offer first class learning programmes at all levels.  Multidisciplinary Teamwork- Our teams include data scientists, engineers, project managers, UX and visual designers who work collaboratively to enhance performance.  Innovative Work Culture- Creativity, insight and passion come from being balanced. We cultivate a modern work environment through an emphasis on wellness, insightful talks and training sessions.  Striving for Diversity- With colleagues from over 40 nationalities, we recognise the benefits of working with people from all walks of life. Our projects range from helping pharmaceutical companies bring lifesaving drugs to market quicker to optimising a Formula1 car's performance. At QuantumBlack you have the best of both worlds; all the benefits of being part of one of the leading management consultancies globally and the autonomy to thrive in a fast growth tech culture:  Healthcare Efficiency- We helped a healthcare provider improve their clinical trial practices by identifying congestion in diagnostic testing as a key indicator of admissions breaches.  Environmental Impact- We designed and built the first data-driven application for a state of the art centre of excellence in urban innovation by collecting real-time data from environmental sensors across London and deploying proprietary analytics to find unexpected patterns in air pollution.  Product Development- We worked with the CEO of an elite automotive organisation to reduce the 18-month car development timeframe by improving processes, designs and team structures. Please submit your CV in English Visit our Careers site to watch our video and read about our interview processes and benefits.  Outstanding academic record in Computer Science, Machine Learning, Applied Statistics, Mathematics; Masters, PhD are beneficial (Please include academic transcripts with application.)  Experience in statistical modelling and machine learning techniques  Programming experience in at least two of the following languages: R, Python, Scala, SQL  Experience in applying data science methods to business problems  Experience in applying advanced analytical and statistical methods in the commercial world  Good presentation and communication skills, with the ability to explain complex analytical concepts to people from other fields  Flexibility to travel to client locations across Australia & New Zealand"
"Director, Data Strategy",NA,2023-01-11 18:15:41,https://www.google.com/search?q=Machine+Learning+Jobs+New+Zealand&ibp=htl;jobs&sa=X&ved=2ahUKEwjy6ofR7cD8AhWvIEQIHX1RBTQQutcGKAF6BAgSEAU#htivrt=jobs&htidocid=16ArcrTvd4cAAAAAAAAAAA%3D%3D&fpstate=tldetail,Xero,Full-time,NA,"Wellington, New Zealand","The Data team is responsible for driving the adoption of data driven decision making across Xero - for both our internal users and our global customers of small business owners, bookkeepers and accountants. We are the center of expertise for data strategy, data architecture, data modelling, machine learning, ethical data usage and artificial intelligence service design. We lead the effort to raise the data and AI literacy levels across Xero and to embed our commitments to responsible data use into culture and practices across our fast-growing organisation. Data strategy is an emerging specialist group, building global collaborations to define, communicate and drive a cohesive approach to data usage that combines commercialisation, consent, ethics and sustainability. They work with colleagues from diverse backgrounds to drive robust and mature decision making around using data as a commercial asset, aligned to our belief in the primacy of customer consent. Key questions for this... opportunity  Can you lead the thinking on complex questions of data use where customer trust is our biggest asset, and they rely on us for increasingly insightful products in an open ecosystem  Do you combine deep expertise in strategy with experience in data-driven product development and a passion for ethics and doing the right thing for customers  Are you fired up by the opportunity to use data to make meaningful change in the lives of millions of small businesses and their communities What you'll do  Creating and embedding decision-making frameworks to assess the commercial value of data in products and partnerships  Partnering with our Science, Engineering, Product and Strategy teams to develop commercial evaluation and prioritisation methods for machine-learning products  Applying understanding of data supply chains and the complexities of manufacturing and distributing data-driven products to assess trade-offs and recommend courses of action  Partnering with our corporate development team to create methods for evaluation of the data assets and capabilities of potential acquisitions  Ensuring that our data strategy implementation evolves with changing regulatory requirements, market dynamics and customer expectations.  Building and developing a high-performing team focused on developing and implementing pragmatic advice around sustainable, commercial and ethical data use About you  You have a special blend of strategic thinking and wisdom gained from building solutions and delivering change programs  You have a deep understanding of the concepts of data supply chains and the complexities of manufacturing and distributing data-driven products  You have a pragmatic and commercial mindset to assess trade-offs and make recommendations in context of our strategy and our values  You have exceptional written and verbal communication skills with a track record of articulating complex ideas to both technical and non-technical audiences  You bring consulting skills around shaping the problem space, critical thinking, communications and influence  You bring strong personal credibility and leadership skills; youll be able to comfortably guide senior people through difficult tradeoff discussions and creatively build consensus What you'll bring with you  A track record of creating and implementing data strategy including one or more of platform, ecosystem, open data or machine-learning strategies  Know how to build business cases and evaluation frameworks for data-driven products through commercial, ethical and technical sustainability lenses  Probably have prior consulting or SaaS experience  Know how to drive change in fast moving, complex environments with multiple competing priorities  Proven experience facilitating discussions between technical and non-technical audiences at all levels  Skills in building high performing teams  Familiarity with relevant regulatory and certification frameworks such as GDPR, CCPA, ISO 27001/SOC2, and Open data/open banking regimes"
Personalized Internet Assessor - English Speaker in New Zealand,2023-01-06,2023-01-11 18:15:42,https://www.google.com/search?q=Machine+Learning+Jobs+New+Zealand&ibp=htl;jobs&sa=X&ved=2ahUKEwjy6ofR7cD8AhWvIEQIHX1RBTQQutcGKAF6BAgSEAU#htivrt=jobs&htidocid=YEArS0DoU6sAAAAAAAAAAA%3D%3D&fpstate=tldetail,TELUS International AI Data Solutions,Part-time,NA,New Zealand,"TELUS International AI-Data Solutions partners with a diverse and vibrant community to help our customers enhance their AI and machine learning models. The work of our AI Community contributes to improving technology and the digital experiences of many people around the world. Our AI Community works in our proprietary AI training platform handling all data types (text, images, audio, video and geo) across 500+ languages and dialects. We offer flexible work-from-home opportunities for people with passion for languages. The jobs are part-time, and there is no fixed schedule. Whoever you are, wherever you come from, come join our global AI community. www.telusinternational.com We are hiring Personalized Internet Assessors in New Zealand (English Language) In this role you will be reviewing online search results in order to improve their content and quality. You will be required to provide feedback and analysis on content found in search engine results and provide ratings on their... relevance to the search terms used. Another aspect of this role will involve reviewing the language used in the search results by examining grammar, tone and cultural relevance. Through this work you will be making a valuable contribution by expressing your opinion on the quality and content of what is currently out there on the web. You will play a part in improving the quality of one of the largest search engines in the world using both your PC and Smartphone. Who is suitable for this role We are currently seeking dynamic and creative people who have a strong interest in social media, specifically those who are an active daily user of their Gmail account. We also require suitable candidates to own & use a smartphone  Android or iPhone  and have a familiarity with other forms of social media and Google products. You should also be flexible, reliable and have the ability to interpret and follow established guidelines. You will have the flexibility and freedom to work from your own home, working your own hours. We are currently seeking people who have a specific smartphone device (Android V4.2 or higher or iPhone running iOS version 13.0 or higher) to complete tasks. What are the main requirements for the role  You must have full professional proficiency in both written and verbal English  You must be living in New Zealand for the last 5 consecutive years  You must own and use a Smartphone (Android V4.2 or higher or iPhone running iOS version 13.0 or higher) to complete tasks  The majority of the task types will require both a desktop/laptop and a smartphone  Gmail must be your primary email  Active daily user of Gmail and other forms of social media  You must have familiarity with current and historical business, media, sport, news, social media and cultural affairs in New Zealand  Access to and use of a broadband internet connection and associated computer and software to perform the work, all provided at your own expense  Experience in use of web browsers to navigate and interact with a variety of content Working on this project will require you to go through a standard recruitment process (including passing an open book assessment). This is a long-term project and your work will occasionally be subject to quality assurance checks. Why Join the TELUS International AI Community  Earn extra income  Access to our community wellbeing initiative  Remote work & Location Independence  Be your own boss  Flexible Hours to fit in with your lifestyle  Be a part of an online community Whats next If this sounds like a role youd be interested in taking on, please apply below. https://jobs.telusinternational.com/enUS/careers/PipelineDetail/Personalized-Internet-Assessor-New-Zealand/27547"
"Product Design Manager, Design System & Machine Learning",2022-12-23,2023-01-11 18:15:43,https://www.google.com/search?q=Machine+Learning+Jobs+New+Zealand&ibp=htl;jobs&sa=X&ved=2ahUKEwjy6ofR7cD8AhWvIEQIHX1RBTQQutcGKAF6BAgSEAU#htivrt=jobs&htidocid=bTT2A2VJT6MAAAAAAAAAAA%3D%3D&fpstate=tldetail,GitLab,Full-time,NA,New Zealand,"The GitLab DevOps platform empowers 100,000+ organizations to deliver software faster and more efficiently. We are one of the worlds largest all-remote companies with 2,000+ team members and values that guide a culture where people embrace the belief that everyone can contribute. Our handbook is public. You can find the details of our vision & direction , check out how we structure our R&D teams , and understand how our UX team operates . As a Product Design Manager at GitLab, you will be responsible for managing a team of 5 talented Product Designers. These Product Designers are embedded in groups with a focus on our design system, foundational experiences, integrations with our platform, or data science offerings. What you can expect in a Product Design Manager role at GitLab:  Youll advocate for good product design practices, ensure the visibility of product design across functions, create space for collaboration, and develop a deep level of subject matter expertise in the... product areas your reports are operating in.  You'll mentor designers, engineers, and PMs on how to effectively contribute to our Pajamas design system.  Youll work with your direct reports to build out a UX strategy for our design system, navigation experience, integrations, and Data Science capabilities that aligns with our mission, vision, strategy .  Youll approach management in a way that is informed by our view on what is required of a Manager at GitLab . We default to asynchronous communication , so your management style will need to work in the context of our all-remote, global team .  Youll collaborate with our R&D Leadership team to manage OKRs for our product design practice. These OKRs will shape your teams process, define your responsibilities as a manager, and feed into the responsibilities of your direct reports while enabling our company to meet its goals.  Youll play a key part in the evolution of our design culture and drive initiatives that enable Product Designers to achieve greater results.  Youll champion the importance of participation in critiques, content creation, and speaking engagements.  Youll foster a safe space for your team, where theyre comfortable sharing feedback and advocating for change they see as necessary.  Youll play a big part in hiring a team of world-class Product Designers. Youll need to be highly engaged in the recruiting process as we scale our global team.  Youll work with cross-functional partners to identify and remedy pain points in our product development process , ensuring effective collaboration with our Product, Development, and Quality counterparts.  You'll mentor others in how to make contributions to our product through git-based workflows where you're working locally in the terminal and creating Merge Requests. You should apply if:  Youve got, at minimum, a few years of experience managing Product or UX design teams of 3+ direct reports. Alternatively, you're able to demonstrate leadership skills and experiences impacting design quality at a team level as a Product Designer on a design system team.  You have worked on complex web applications, enterprise software, or developer tooling.  Youve got hands-on experience leading a design system.  You have knowledge of accessibility requirements (for example, Web Content Accessibility Guidelines (WCAG)) and have experience leading a team to create accessible experiences.  Your knowledge, vision, and experience will enable you to play a key role in shaping the next evolution of developer tooling.  You enjoy advocating for user research and usability testing, and you continually look to improve your teams user research and usability testing abilities.  You want to manage a team that is designing a complex product with cross-functional users and continually evolving needs.  You understand frontend code, Git, and the limitations of frontend technology. You are comfortable with Git-based workflows and bring experience with the command-line.  Youre comfortable with design reviews and occasionally being hands-on with design tools such as Figma.  Mentoring, leading, and growing your team is truly motivating to you.  Our values of collaboration, results, efficiency, diversity, iteration, and transparency resonate with you.  You'll thrive in an environment where self-learning and self-service are encouraged and instilled as a part of our culture. What it's like to work at GitLab : The culture at GitLab is something we're incredibly proud of. You'll spend your time collaborating with kind, talented, and motivated colleagues from across the globe. Some of the benefits you'll be entitled to vary by the region or country you're in. However, all GitLab team members are fully remote and are encouraged to put family and friends first with our paid time off policy that doesn't count the number of days you take off annually. You can work incredibly flexible hours, enabled by our asynchronous approach to communication. We'll also help you set up your home office environment , pay for your membership to a co-working space, and, every year or so, we'll invite you to our Contribute event . Our Hiring Process And Compensation The hiring process for this Product Designer position typically follows five stages. The details of this process can be found at the bottom of our job family page. Our compensation calculator will be shared with candidates selected for a team interview. Country Hiring Guidelines: GitLab hires new team members in countries around the world. All of our roles are remote, however some roles may carry specific location-based eligibility requirements. Our Talent Acquisition team can help answer any questions about location after starting the recruiting process. Privacy Policy: Please review our Recruitment Privacy Policy. Your privacy is important to us. GitLab is proud to be an equal opportunity workplace and is an affirmative action employer. GitLabs policies and practices relating to recruitment, employment, career development and advancement, promotion, and retirement are based solely on merit, regardless of race, color, religion, ancestry, sex (including pregnancy, lactation, sexual orientation, gender identity, or gender expression), national origin, age, citizenship, marital status, mental or physical disability, genetic information (including family medical history), discharge status from the military, protected veteran status (which includes disabled veterans, recently separated veterans, active duty wartime or campaign badge veterans, and Armed Forces service medal veterans), or any other basis protected by law. GitLab will not tolerate discrimination or harassment based on any of these characteristics. See also GitLabs EEO Policy and EEO is the Law . If you have a disability or special need that requires accommodation , please let us know during the recruiting process"
