Job-Title,Date-Posted,Date-Scraped,Url,Company,Job-Type,Salary,Location,Description
Head of Data,NA,2023-01-30 12:27:42,https://www.google.com/search?q=Machine+Learning+Jobs+Kenya&ibp=htl;jobs&sa=X&ved=2ahUKEwjs89Wpg_D8AhVJHDQIHSpgAe4QutcGKAF6BAgcEAU#htivrt=jobs&htidocid=GwiogMy1H8UAAAAAAAAAAA%3D%3D&fpstate=tldetail,Sendy,Full-time,NA,"Nairobi, Kenya","About SendySendy specializes in connecting on-demand, trusted, and transparent service providers with individuals and businesses looking to move packages. Thus, we believe its a natural extension of our core expertise to also connect our users to quality certified transportation providers. As of today, Sendy users can now request a package delivery using a motorcycle, van, pickup, or 3 ton truck, or a passenger RIDE with a boda boda or cab  all from within the same Sendy mobile app (available on Android and iOS) and web platform. All delivery and ride services are available 24 hours a day, 7 days a week and can be paid for using cash, Mpesa, or card.We believe that Africa does better when everyone has room to grow and thrive. No one should be left out because the distance between seeing an opportunity and making a living from it is too great. We started by delivering small packages but havent stopped there. Today, were empowering businesses to send raw materials to their... production facilities and finished goods to their customers. Were helping small scale farmers get their produce to the market. Were making it possible for the hardworking delivery driver to earn a decent living. We are here to make it easy to trade in Africa so that everyone has room to grow.We are looking for a Head of data who wishes to help us improve trading and movement of goods in Africa by helping us efficiently maximize the data we collect as we provide our services.Job purposeThe overall purpose of the Head of Data is to provide strategic leadership and drive initiatives of the different data teams in the organization. The individual will lead data scientists, data analysts, data engineers and other technical team members in supporting different stakeholders with insights, reports and services to aid achieving different business objectives.. Furthermore, the role focuses on continuously improving internal processes and our data tool stack . Previous experience in developing and deploying machine learning models in production is a strong plusKey duties and responsibilities• Develop and ensure execution of the Data strategy in line with the overall business strategy.• Develop a road map for data in alignment with all stakeholders.• Manage, grow and motivate the direct reports within the data team.• Lead teams in developing ML models and ensure they provide value to the stakeholders.• Manages overall data architecture and manages, develops, prioritizes and recommends initiatives to improve and build upon the data architecture to support the business.• Ensures consistency of processes and champions best practices in data management. Oversees data accuracy processes and goals.• Responsible for user experience with data reporting and tools.• Devise and evaluate methods for collecting data and constantly try new tools to improve our setup.• Support the team in developing and maintaining KPI reports and dashboards that communicate key business trends and highlight opportunities for growth and improvement.• Perform analytics and leverage existing analytical tools to improve decision making and customer strategy development for key stakeholders across Sendy.• Work with the data engineering team to store accurate and required data in an accessible manner.• Any other duties that may be assigned by the supervisor.Working relationshipsInternal RelationshipsThe Head of Data Data will be: Directly accountable to the VP Growth & Data Required to work with stakeholders from all departments across the companyExternal Relationships: Partners CustomersKnowledge, experience and qualifications required Bachelors degree in Computer Science, Electrical Engineering , Statistics, Mathematics or any other related fields. Minimum 5 years experience working in the technology industry Minimum of 3 years working with data science / machine learning related projects.Technical competencies Proven ability in building and deploying machine learning models in production. Proven ability in data analytics & visualization. Skilled in SQL, R, python, etc. Experience with AWS,GCP, Snowflake, etc. Strong knowledge of the software development cycle.Core competencies Strong leadership skills. Analytical, creative thinking and problem solving skills. Strong project management skills Strong creativity skills and idea generation. High-level interpersonal and cross-cultural skills. Must be a self-starter and highly organized. Ability to work well with people at all levels in the organization. Excellent communications skills Flexibility and adaptability. Open to change. Calm under chaos.What We Offer• Comprehensive health insurance  Inpatient / Outpatient / Dental / Optical• Flexible vacation• All risk Insurance• Monthly Lunch allowance• Education Stipend• Opportunity for company stock optionsWorking EnvironmentThe job can be done both remotely and in person, with a strong preference for in person availability.Salary is negotiable based on experience.This Job is no Longer Taking Applications"
Data Scientist,NA,2023-01-30 12:27:43,https://www.google.com/search?q=Machine+Learning+Jobs+Kenya&ibp=htl;jobs&sa=X&ved=2ahUKEwjs89Wpg_D8AhVJHDQIHSpgAe4QutcGKAF6BAgcEAU#htivrt=jobs&htidocid=zlORrN1v1mAAAAAAAAAAAA%3D%3D&fpstate=tldetail,ENGIE Energy Access,Full-time,NA,"Nairobi, Kenya","Job Title: Data ScientistLocation: Kampala, Nairobi or LagosPosition: Full-timeTeam: DigitalHay Grade: 15Reporting To: Head of DataApplication Deadline: 14th December, 2022About ENGIE Energy AccessENGIE Energy Access is one of the leading Pay-As-You-Go (PAYGo) and mini-grids solutions provider in Africa, with a mission to deliver affordable, reliable and sustainable energy solutions and life-changing services with exceptional customer experience. The company is a result of the integration of Fenix International, ENGIE Mobisol and ENGIE PowerCorner; and develops innovative, off-grid solar solutions for homes, public services and businesses, enabling customers and distribution partners access to clean, affordable energy. The PAYGo solar home systems are financed through affordable installments from $0.19 per day and the mini-grids foster economic development by enabling electrical productive use and triggering business opportunities for entrepreneurs in rural... communities. With over 1,700 employees, operations in 9 countries across Africa (Benin, Cote dIvoire, Kenya, Mozambique, Nigeria, Rwanda, Tanzania, Uganda and Zambia), over 1.5 million customers and more than 8 million lives impacted so far, ENGIE Energy Access aims to remain the leading clean energy company, serving millions of customers across Africa by 2025.www.engie-energyaccess.comJob Purpose/MissionWe are looking for a talented, full-stack data scientist to join the digital team to help deliver affordable solar power to emerging markets. This position offers a great opportunity to work alongside an elite team of data scientists and business professionals and directly contribute to the success of a mission driven company with social and environmental impact. Candidates will get the opportunity to work in a diverse technology stack at scale. .Responsibilities• Deploy and maintain data pipelines and machine learning models to predict repayment, solar system device performance, credit scoring and other metrics which are key to the business.• Contribute to design and maintenance of an analytics database to empower data-driven decisions by analysts and strategists across the organization.• Design randomized, controlled experiments to understand levers available to improve customer repayment.• Perform analyses, with statistical components as appropriate, for department leaders to evaluate the impact of pilots and other interventions.• Leverage external data sources to help EEA grow its business and maximize social impact on customers in emerging markets.• Train data users across nine markets and the global team on data tools / skills to grow data capacity and culture at EEA.Knowledge and skillsExperience:• 3+ years of relevant experience• Strong Python, especially in a data analytics/science capacity (ex. pandas, numpy, sklearn, matplotlib)• Facility with MySQL/Redshift• Experience with experimental design, statistical analysis, and interpretation of qualitative and quantitative data.• Good knowledge of statistical tests and analysis• Ability to communicate model outputs and analyses to stakeholders at various levels of technical expertise• Experience deploying predictive models at scale• Keen eye for detail and thoughtful investigation of data before relying upon it• Demonstrated expertise in strategic analysis to impact decisions• Thrives on teamwork• Bonus: Experience with financial data or credit scoringQualifications:• MA or PhD in a relevant discipline (Data Science, Software Engineering, Statistics, or another relevant STEM field)Language(s):• English• French, Swahili or Portuguese is a plusTechnology:• Python or R, jupyter notebooks• Airflow (or other workflow management systems, such as Luigi)• Knowledge of Amazon Web Services (AWS) and its services, such as, but not limited to, Cloudwatch, RDS, Redshift, Lambda, EMR, S3, SQS, EC2• AWS environment: Cloudwatch, RDS, Redshift, Lambda, EMR, SQS, EC2• Statistical analysis and predictive modeling in python (scipy, stats, sklearn, etc)• Tableau/PowerBIWe thank all applicants for their interest, however due to the large volume of applications we receive, only shortlisted candidates will be contacted.ENGIE is an equal opportunity employer, promoting diversity and committed to creating an inclusive environment for all. All applications are screened based on business needs, job requirements and individual qualifications, without any regard to origin, age, name, sexual identity, orientation or preference, religion, marital status, health, disability, political opinions, union involvement or citizenship. Our differences are our strengths"
Research Scientist Intern - Artificial Intelligence,NA,2023-01-30 12:27:43,https://www.google.com/search?q=Machine+Learning+Jobs+Kenya&ibp=htl;jobs&sa=X&ved=2ahUKEwjs89Wpg_D8AhVJHDQIHSpgAe4QutcGKAF6BAgcEAU#htivrt=jobs&htidocid=zVoQneW6X0gAAAAAAAAAAA%3D%3D&fpstate=tldetail,IBM,Internship,NA,"Nairobi, Kenya","IntroductionAt IBM, work is more than a job - it's a calling: To build. To design. To code. To consult. To think along with clients and sell. To make markets. To invent. To collaborate. Not just to do something better, but to attempt things you've never thought possible. Are you ready to lead in this new era of technology and solve some of the world's most challenging problems If so, lets talk.Your Role and ResponsibilitiesJoin us for a unique 12-week paid internship at the IBM Research  Africa lab in Nairobi, that offers personal and professional development including mentorship from leading technology researchers. This program will give you an opportunity to work on meaningful technology solutions, develop scalable software systems, interact and collaborate with top research scientists in AI, health informatics, statistics, among others - all of which requires research, asking the right questions, curiosity, and thinking outside the box.IBM Research Africa is looking for a... Ph.D-level intern to join their AI research group which is exploring foundational models and anomalous pattern detection techniques. Foundational models are flexible, re-useable models that can be applied to many downstream tasks. These models are set to replace the task-specific models that have been in place for the past decade. AI Researchers at the Africa lab are studying the inner representation space of these large models to better measure the quality of generated content.Required Technical and Professional ExpertiseApplicants should meet the following criteria:- Currently enrolled in a Ph.D program from an accredited university in quantitative fields such as Computer Science, Machine Learning, Statistics, Physics, Information Systems- Demonstrable interest in anomalous pattern detection and foundational model applications- 4 years coding experience with scientific Python stack (numpy, scipy, pandas, matplotlib, etc.)- Availability to relocate to Nairobi, Kenya for the duration of the internshipFounded in 2013, IBM Research Africa is the first industrial research lab on the continent with offices in Nairobi, Kenya and Johannesburg, South Africa. We are driving innovation by developing commercially viable solutions to transform lives and spark new business opportunities in key areas such as healthcare, climate, and Artificial Intelligence.IBM Research - Africa encourages applications from all genders and minority groups. We strongly encourage qualified researchers from the African continent to apply for this opportunity.Preferred Technical and Professional ExpertiseKindly refer to JDAbout Business UnitWith more than 3,000 researchers in 12 labs located across six continents, IBM Research brings together hundreds of researchers who possess unparalleled industry expertise to address some of the world's most challenging problems. Join us as we do pioneering work in areas such as cognitive computing, augmented intelligence, quantum computing, and blockchain, to name a few.Your Life  IBMIn a world where technology never stands still, we understand that, dedication to our clients success, innovation that matters, and trust and personal responsibility in all our relationships, lives in what we do as IBMers as we strive to be the catalyst that makes the world work better.Being an IBMer means youll be able to learn and develop yourself and your career, youll be encouraged to be courageous and experiment everyday, all whilst having continuous trust and support in an environment where everyone can thrive whatever their personal or professional background.Our IBMers are growth minded, always staying curious, open to feedback and learning new information and skills to constantly transform themselves and our company. They are trusted to provide on-going feedback to help other IBMers grow, as well as collaborate with colleagues keeping in mind a team focused approach to include different perspectives to drive exceptional outcomes for our customers. The courage our IBMers have to make critical decisions everyday is essential to IBM becoming the catalyst for progress, always embracing challenges with resources they have to hand, a can-do attitude and always striving for an outcome focused approach within everything that they do.Are you ready to be an IBMerThis job requires you to provide your COVID-19 vaccination status with supporting documentation, where legally permissible.About IBMIBMs greatest invention is the IBMer. We believe that through the application of intelligence, reason and science, we can improve business, society and the human condition, bringing the power of an open hybrid cloud and AI strategy to life for our clients and partners around the world.Restlessly reinventing since 1911, we are not only one of the largest corporate organizations in the world, were also one of the biggest technology and consulting employers, with many of the Fortune 50 companies relying on the IBM Cloud to run their business.At IBM, we pride ourselves on being an early adopter of artificial intelligence, quantum computing and blockchain. Now its time for you to join us on our journey to being a responsible technology innovator and a force for good in the world.Location StatementFor additional information about location requirements, please discuss with the recruiter following submission of your application.Being You  IBMIBM is committed to creating a diverse environment and is proud to be an equal opportunity employer. All qualified applicants will receive consideration for employment without regard to race, color, religion, gender, gender identity or expression, sexual orientation, national origin, genetics, pregnancy, disability, age, veteran status, or other characteristics. IBM is also committed to compliance with all fair employment practices regarding citizenship and immigration status"
CONFLUX AI Big data analytics and data science Course,NA,2023-01-30 12:27:44,https://www.google.com/search?q=Machine+Learning+Jobs+Kenya&ibp=htl;jobs&sa=X&ved=2ahUKEwjs89Wpg_D8AhVJHDQIHSpgAe4QutcGKAF6BAgcEAU#htivrt=jobs&htidocid=ZnQWXqZ2_2UAAAAAAAAAAA%3D%3D&fpstate=tldetail,ConfluxAI,Full-time,NA,"Nairobi, Kenya","Conflux AI is a company registered in Kenya, consisting of a group of experts who aim to offer a training course in big data analytics and data science.The team has experience in building AI-based solutions and products for Banking, Telecom, Retail, Healthcare, Finance and Transport sectorsThis course is aimed to empower working professionals and students with all the required tools and technologies to solve any Data Related Industrial or Community problem. From Big Data Storage to data engineering, cloud to local infrastructures, machine learning to Deep Learning, different topics will be covered to empower you to create solutions that result in making data-driven decisions.Course syllabusThe course is broken down into 9 modules which will ensure you learn end to end Data Science, Machine Learning, Deep Learning, and Big Data concepts. After completing the first foundational course module, each of the subsequent modules has a project at the end to enhance real-world... application of the course. The following are the 9 modules covered and their corresponding projects :No.ModuleProject1Basic foundations2Business and Big data discoveryNew York FLV Champion AnalysisS&P Stock Data Analysis3Statistical methods and modelsStock Portfolio OptimizationSales van route optimizationForecasting retail Store salesHouse price prediction4Data Engineering for modelling needsRetail repeated buyers data preparationTaxi trip duration prediction data preparationCredit risk default for Home Loans5Machine learning ModelsRetail repeated buyers data preparationTaxi trip duration prediction data preparationCredit risk default for Home Loans6Text miningPrice suggestion based on project description7Deploying models and APIPipeline, deploy and build web API8Computer vision with Deep LearningDigit RecognizerTraffic sign recognition9Big data engineeringCustomer 360 for BankingScalable credit scoring engines for banksAt the end of every module, a hackathon is held by the training team, and the best learners are awarded cash prizes ranging from KSH 3,000 to KSH 10,000. Learners will also have access to a wide variety of books in data science, big data and machine learning for extra study.More details on the Course modules and trainers for this course can be found on this linkCourse Duration and schedulesThe Course will last 5 months starting on 14th March 2020, and can be attended through the following different timings:• Morning Cohort , Monday to Thursday , 8AM to 12PM with Saturday Masterclass• Afternoon Cohort  Monday to Thursday, 1PM to 5PM with Saturday Masterclass• Professional Cohort  Monday to Thursday , 6PM to 8PM with Friday MasterclassCourse LocationWaiyaki Way Opposite Lion Place, Haven Court, Westlands, Nairobi Kenya.Course cost and applicationConflux AI is charging KES 90,000 for this course, payable in one installment and KES 99,000 if paid in more than one installmentApplications to the course can be done by filling in this form, after which you will be contacted for follow up"
Messaging Automation/ NLP Intern,NA,2023-01-30 12:27:44,https://www.google.com/search?q=Machine+Learning+Jobs+Kenya&ibp=htl;jobs&sa=X&ved=2ahUKEwjs89Wpg_D8AhVJHDQIHSpgAe4QutcGKAF6BAgcEAU#htivrt=jobs&htidocid=-vpRbAo-VlwAAAAAAAAAAA%3D%3D&fpstate=tldetail,Elewa network,Full-time,NA,Kenya,"AboutThe Elewa Network is the last piece of the puzzle. Through the Elewa network, we connect all schools, teachers and individual volunteers that are taking the step towards 21st century education with us. Facing similar challenges and sharing experiments, everyone in the network grows as we learn together, share new things and try out new ideas. As we grow, the power of hundreds of schools and teachers will be at your disposal through the ETAs and ETFs. These two furthermore help adapt those ideas to the context of your school.Read more about this companyMessaging Automation / NLP InternJob TypeFull TimeQualificationMBA/MSc/MAExperienceLocationNairobiJob FieldInternships / VolunteeringJob DescriptionThe Role Responsibilities• The NLP/Messaging Automation Intern will be responsible for;• Platform Implementation• Liase with our conversational learning experts to implement rich learning experiences over a variety of supported platforms.• Enhancing the NLP-capabilities of... our platform to better serve the students.• Support of our Full-Stack software development team by acting as a bridge between the learning experts and the rest of the tech-department (of which you are a part).• Implementation of new activity types and learning experiences that can plug into our platform.• Learning Production• Assisting with the production of several activities using a variety of tools i.e. Photoshop, Premier Pro, Illustrator, • Monitoring of platform usage and assistance to clients with technical issues.Background, competencies and attributes• A masters degree, or at least undergrad, in Computer Science.• Demonstrate-able experience in practical software development in one or multiple of the following software development languages: JavaScript/Node.JS/TypeScript/C#/.NET/Angular. Python a plus.• Demonstrated creativity, problem-solving and analytical skills• Ability to analyse and think through challenges, turning a limited set of tools and constructs into a rich domain language consisting out of reusable blocks.• Experience with Natural Language Processing and Machine Learning a plus.• An eye for design and an innate desire to develop rich user-focused experiences.• Demonstrable experience with at least Photoshop. Video editing skills a big plus.• Ability to work in team and a natural communicator• Familiarity with Kenyan and global education market trends.To apply, email your CV and motivation to jobselewa.co.ke"
