Job-Title,Date-Posted,Date-Scraped,Url,Company,Job-Type,Salary,Location,Description
Product Manager - Machine Learning,2023-01-16,2023-01-30 12:10:57,https://www.google.com/search?q=Machine+Learning+Jobs+Australia&ibp=htl;jobs&sa=X&ved=2ahUKEwi9p8fG_-_8AhXbGDQIHYl9CL0QutcGKAF6BAgSEAU#htivrt=jobs&htidocid=J42eZxPp1GUAAAAAAAAAAA%3D%3D&fpstate=tldetail,Entain,Full-time,"US$65,520–US$121,680 a year","Bowen Hills QLD, Australia","About the RoleReporting directly to the Head of Personalisation, your main goal is to understand our customers needs and provide high-quality personalized recommendations for an enhanced and engaging betting experience. You will lead our efforts to build state-of-the-art context-aware recommendations, working closely with a talented team of data scientists, analysts and engineers working on solving complex consumer problems through AI and Machine Learning. About EntainHere at Entain, we are building an exciting, word class approach to Personalisation for our Australian online bookmaking brands, Ladbrokes and neds. To do so, were looking for data-obsessed leaders with an innate desire to problem solve and deliver a market-leading, state-of-the-art customer experience. What you will do Collaborate closely with data scientists, analysts and engineers while working in agile software development environment. You will be someone who can bridge business requirements with technical... capabilities. Obsess over how we can further use data to improve the customer experience, particularly in the areas of promotional spend and generosity. Create a vision. You will be responsible for developing and driving the roadmap of solutions delivered via our Machine Learning Platform. Manage the product process - from ideation and investigation, through to delivering and monitoring on-going reporting. Co-ordinate a test and learn pipeline with clearly defined success metrics, identifying and reacting to the most valuable opportunities. Understand and document module requirements. Prioritise feature requirements and expected release points, balancing value add with level of difficulty. Work closely with leadership teams to schedule and co-ordinate product release. Play a lead role in evolving our use of cross-functional agile teams. Help to facilitate backlog grooming sessions, organising designs, and creating tasks. Manage expectations with wider teams, effectively communicating value driven and taking on feedback for further improvements. Who were looking for You will have proven experience in managing data products, ideally with experience in or exposure to Machine Learning products. You will have both theoretical and practical knowledge of product management frameworks, processes and methodologies, with a proven record in defining product requirements based on research, data and insights. Strong leadership skills to guide initiative teams through the delivery and governance life cycle. Ability to galvanize multi-disciplinary Agile teams to deliver strategic change. You will obsess over how we can use data to add value for our customers, through considering the big picture opportunities and identifying the companys growth levers. You will be responsible for growing a young product area to solve customer problems in the space of recommendations, personalisation, and cross-selling in a way that benefits both our customer and the business. You will be comfortable working with data scientists and data engineers on complex topics, but most importantly be able to identify clear value adding opportunities, and the most direct path to delivering these. You have prior knowledge and understanding of the industry (sports betting, gaming and sports) or a strong desire to learn in order to best meet our customers needs. Why Entain Genuinely flexible work arrangements  we aim to be in the office two days a week, but we want you to work the way that best suits you and your life. 9-day fortnights  Yep thats right! Up to 12 weeks Paid Parental leave. Heavily subsidised gym memberships and other paid-for services as part of our wellness calendar. Free onsite barista and fully stocked fridge and pantry for breakfast and lunch. Extensive learning and development programs so you can expand your expertise. Company-wide events to recognise and celebrate the great work of our team. We LOVE Entertainment, and Racing and Sports are at the heart of everything we do. So, it only makes sense that we provide access to free and discounted tickets to sporting and racing events. As a global employer, Entain is committed to providing a safe, fun, and inclusive culture where our people feel like they truly belong. We are a multicultural business that values, celebrates and respects individual differences, so whatever your sexuality, gender, gender identity, ability, age, race, religion or belief, you will have a voice here, and the space to do your best work. Our diverse internal networks provide the support for you to express your views and make a positive difference.Our HQ is in Brisbane Australia; however, we have offices in Sydney and Melbourne. This role has the opportunity to be located in any of these 3 locations.For more information, please reach out to us at careersentaingroup.com.au or hit apply now"
GAMMA Senior AI Software Engineer,NA,2023-01-30 12:10:57,https://www.google.com/search?q=Machine+Learning+Jobs+Australia&ibp=htl;jobs&sa=X&ved=2ahUKEwi9p8fG_-_8AhXbGDQIHYl9CL0QutcGKAF6BAgSEAU#htivrt=jobs&htidocid=F5ZLVHxWDJsAAAAAAAAAAA%3D%3D&fpstate=tldetail,"BCG, BCG GAMMA, Boston Consulting Group",Full-time,NA,"Sydney NSW, Australia (+3 others)","Who We AreBoston Consulting Group partners with leaders in business and society to tackle their most important challenges and capture their greatest opportunities. BCG was the pioneer in business strategy when it was founded in 1963. Today, we work closely with clients to embrace a transformational approach aimed at benefiting all stakeholdersempowering organizations to grow, build sustainable competitive advantage, and drive positive societal impact.Our diverse, global teams bring deep industry and functional expertise and a range of perspectives that question the status quo and spark change. BCG delivers solutions through leading-edge management consulting, technology and design, and corporate and digital ventures. We work in a uniquely collaborative model across the firm and throughout all levels of the client organization, fueled by the goal of helping our clients thrive and enabling them to make the world a better place.Practice Area ProfileBCG GAMMA combines innovative... skills in computer science, artificial intelligence, statistics, and machine learning with deep industry expertise. The BCG GAMMA team is comprised of world-class data scientists and business consultants who specialize in the use of advanced analytics to get breakthrough business results. Our teams own the full analytics value-chain end to end: framing new business challenges, building fact-bases, designing innovative algorithms, creating scale through designing tools and apps, and training colleagues and clients in new solutions.Here at BCG GAMMA, youll have the chance to work with clients in every BCG region and every industry area. We are also a core member of a rapidly growing analytics enterprise at BCG  a constellation of teams focused on driving practical results for BCG clients by applying leading edge analytics approaches, data, and technology.What You'll DoOVERVIEW OF GAMMA ENGINEERING:The Gamma Engineering team is building the next generation of analytics tools:With your help, Gamma will develop a platform that fuels BCG Gammas global data and analytics offerings. Data scientists depend on easy to use interfaces to easily code, increase productivity, answer questions, and envision their results.Clients need to easily interact with our analytics applications to measure the success of their new analytics enabled organization or quickly make decisions based on what and how they see analytic output. Our clients will use our analytics solutions to derive insights around business trends. We open the doors to data for our clients giving them fast and trusted options to search, frame, and share data.POSITION SUMMARY:As a Senior Software Engineer, you will be responsible for advancing software solutions to support BCG Gammas analytics platform and clients. Your strong analytical skills and ability to develop innovative problem solving solutions will support mission critical decision analytics for our clients. Additional responsibilities will include developing feature enhancements to our platform, developing industry-leading analytics software solutions and methodologies and provide talks and papers in industry leading conferences on behalf of BCG Gamma. We are looking for talented individuals with a serious commitment to software development, data science, large data analytics and transforming organizations into analytics led innovative companies.RESPONSIBILITIES:• Apply software development practices and standards to develop robust and maintainable software• Develop abstract analytic models to solve complex problems for decision analysis• Maintain an active role in every part of the software development life cycle• Help mentor and guide junior developers• Guide non-technical teams and consultants in understanding analytics at scale, infrastructure as code and best• practices for robust software development• Optimize and enhance computational efficiency of algorithms and software design• Design data structures and visualization of results to provide users actionable intelligence and situational awareness of supporting data• Interact directly with clients on new features for future product releases• Provide thought leadership to software design and solutions#LI-DNIWhat You'll Bring (Experience & Qualifications)• Masters Degree or PhD in Computer Science, Statistics, Operations Research, or related field• 5 to 8 years of experience in a software development environment• Proficiency with analytic software programming• Experience with Hashicorp Vault, Terraform & Consul• Exposure to analytics applications or experience building analytics tools• Familiarity with data science methods and scaling data science methods• Proficiency with infrastructure as code principles• Familiarity with the storage, manipulation and management of relational, non-relational and streaming data structures• Analytic reasoning and complex problem solving involving mathematical programming and big data problems• Understanding of parallel computingTECHNOLOGIES:• Languages programming: Python, GO, C++, Java, Scala, JavaScript, TypeScript• DevOps: Docker, Kubernetes, CI/CD, Terraform, unix-based command line• Full stack development: GraphQL, React• Data: SQL, Spark, Hadoop• Data Science and machine learning (Pandas, Scikit learn)• Deep learning (Tensorflow, Keras etc.)• Cloud: AWS/Azure/GoogleWORK ENVIRONMENT:• Fast-paced, intellectually intense, service-oriented environment• Fluency in local language and business level English are required"
Senior Machine Learning Operations Engineer (Python) - Open to remote across ANZ,NA,2023-01-30 12:10:57,https://www.google.com/search?q=Machine+Learning+Jobs+Australia&ibp=htl;jobs&sa=X&ved=2ahUKEwi9p8fG_-_8AhXbGDQIHYl9CL0QutcGKAF6BAgSEAU#htivrt=jobs&htidocid=5WD86jNW2WMAAAAAAAAAAA%3D%3D&fpstate=tldetail,Canva可画,Full-time,NA,"Sydney NSW, Australia","Canvas Commitment and MissionAt Canva, we celebrate diversity. We deeply believe that bringing together diversity of thoughts, perspectives and expression is key to building the best product, team and company. We look for many different skills and abilities, as well as how you can enhance Canva and our culture. So, even if you dont think you quite meet all of the skills listed or tick all the boxes, wed still love to hear from you!Our mission at Canva is to empower the world to design and since launching in 2013, we have grown exponentially, amassing over 100+ million monthly active users across 190 different countries and a team of over 3,000 people and the best bit is that weve only achieved 1% of what we know were capable of.Join us and design your future.Central Platform Team (MLOps / MLInfra)The ML Engineers working on the platform team are responsible for delivery of machine learning at scale. Our systems, frameworks and processes are used daily by ML Engineers to... train, validate, deploy and monitor online inference services. We are building a platform that follows engineering best-practices and shortens the loop between early exploratory work in notebooks and shipping reliable models to production. Our platform is built using the latest technologies and cloud infrastructure.We're looking to grow the team to continue to scale the impact of machine learning across Canva"
Machine Learning Engineer,2023-01-21,2023-01-30 12:10:58,https://www.google.com/search?q=Machine+Learning+Jobs+Australia&ibp=htl;jobs&sa=X&ved=2ahUKEwi9p8fG_-_8AhXbGDQIHYl9CL0QutcGKAF6BAgSEAU#htivrt=jobs&htidocid=bRxL7U7DyJ4AAAAAAAAAAA%3D%3D&fpstate=tldetail,nbn™ Australia,Full-time,NA,"South Australia, Australia","Job ExpectationsBuild your career and Australias future.Not many people can say they are working on building Australias future. With us youll be doing just that, leaving a legacy for all Australians. Plus, theres equal employment, great training, and true flexible working arrangements.A fantastic opportunity atnbn, Australias largest infrastructure project, as theMachine Learning Engineer, reporting to the Head of Data Science, COE where you will join the Office of the Chief Data Officer, a key pillar within the Strategic Services Business unit.A bit about your rolenbnis streamlining and improving the quality and flow of data across the entire organisation as well as performance management and advanced analytics capabilities to support day to day operations and decision making for all levels withinnbn.In this role, you will perform the delivery of high-quality data science solutions to high priority business problems, with a focus on protecting, managing and promoting data... as a strategic asset fornbnand its stakeholders, in a sustainable, scalable and cost-efficient manner.The position will require you to understand challenges in multiple business domains, discovering new business opportunities while being comfortable shaping problem definitions and working with ambiguity. The problems addressed are significantly complex, you will demonstrate excellence in data science methodologies and represent CDO best practices.You will seek to identify and implement robust, efficient and scalable solutions that leverage multiple techniques and/or technologies. You will consider and quantify cross-organisation trade-offs to implement mechanisms to ensure that benefit persists. You will be required to deliver on advanced analytic and data science engagements with the business, catering for stakeholder expectations regarding delivery and testing approach, development of machine learning models, and evaluating new techniques. You will play a key role in thenbnData Science community, defining and developing standards and best practices across the analytic and ML lifecycle & in advocating best practice and the ongoing development of other analytics practitioners.A bit about youThe ideal candidate will have demonstrated experience in applying a breadth of analytics skills to drive projects and BAU activities, applying MLOps/Devops methodologies on Machine Learning solutions, leading to proven business value and impact on strategic decisions. You will have an agile development mindset, appreciating the benefit of constant iteration and improvement.You have experience with AWS, with excellent data manipulation and data transformation skills. Ideally, you will have a working experience with one or more machine learning platforms such as Sagemaker (desirable), Kubeflow or GCP AI platform and a strong understanding and hand-on experience in cloud engineering and modern devops practices including an in-depth understanding of Linux and bash/shell scripting, automation (gitops, dataops, CICD, infrastructure as code), deployment strategies, container and container orchestration (docker and kubernetes), serverless (lambda, knative), micro service architecture, API design and documentation (OpenAPI format), API deployment and scaling distributed systems (load balancing, ingress/egress controllers).Lifeat nbnPlease note that this role will be a permanent position and applications for this role will close at midnight Sunday 5th February 2023.Atnbnour people have a clear and shared purpose - empowering Australians to redefine the way they live, work and play into the future. As one of the Australias largest infrastructure projects ever undertaken in Australian history, youll be part of a team building a brighter future for the country.In your personal career, youll benefit from technical training for professional development, leadership programs and access to the latest technology, as well as being led by a diverse executive team.nbnis committed to an inclusive, flexible and supportive workplace where everyone can feel valued, respected and have equal opportunity to thrive and succeed. We encourage applications from people of all ages, nationalities, abilities and cultures - including Aboriginal and Torres Strait Islander peoples, the LGBTI+ community and people living with disability. We're happy to adjust our recruitment process to support accessibility needs  we encourage you to advise us at the time of the application via ******We actively focus on our people having a fair go at reaching their career aspirations. Were committed to equal opportunities for all employees. With initiatives like Womens Leadership Programs, a commitment to equal pay, flexibility and market leading parental leave, we truly are paving the way for true equality in the workplace.Continue the conversationIf you think this role might be for you, we want to hear from you. Please apply by following the links and sending in your resume only. We do not require a cover letter or any selection criteria to be addressed.Atnbn, health, safety and wellbeing will always be our highest priority and we are committed to protecting our employees, and the customers and communities we serve.nbnrecognises that vaccinations against COVID-19 are critical and necessary in certain situations. As such workers who regularly engage face to face with our customers or the community must be fully vaccinated against COVID-19 (which means two doses of an ATAGI approved vaccine), unless a valid medical exemption is provided.Atnbnour people and our planet matter. We have an unwavering commitment to the wellbeing and safety of our employees so that everyone goes home safely each day and can perform at their peak to deliver thenbn network.nbnalso aims to build a network that minimises energy use and can be operated with minimal impact on the environment.Worker TypePermanentTime TypeFull time"
Machine Learning - Operations,NA,2023-01-30 12:10:58,https://www.google.com/search?q=Machine+Learning+Jobs+Australia&ibp=htl;jobs&sa=X&ved=2ahUKEwi9p8fG_-_8AhXbGDQIHYl9CL0QutcGKAF6BAgSEAU#htivrt=jobs&htidocid=ahMHAGSwbIkAAAAAAAAAAA%3D%3D&fpstate=tldetail,Maltem Australia,Part-time,NA,"Sydney NSW, Australia","Who we areMaltem Group is a community of 1,200+ passionate individuals dedicated to innovation, new technologies, data, and digital transformation projects.Founded in 2001 and located in 13 different countries, our footprint covers France, Singapore, Hong Kong, Vietnam, Philippines, Luxembourg, Belgium, Madagascar, Mauritius Island, Morocco, US, Canada and Australia. Our expertise consists of 20+ years of market knowledge in the business organization, digital practices, agile, data management and innovation.Maltem APAC is composed of highly experienced practitioners. We work closely with clients to understand, connect, improve organizational effectiveness, and deliver value faster.Our aim is to support our partners in building a sustainable competitive advantage in their industry and be at the forefront of innovation and customer experience.Join our Data and Analytics team as we continue our journey to build innovative cloud-based data solutions. Our engineers operate in a... collaborative and autonomous environment where they are empowered and continuously learn, becoming masters in their craft.This is a fantastic opportunity for someone who is passionate about big data technologies, enjoys solving problems and takes pride in delivering high quality solutions. You will work in a multi-talented, diverse team across multiple geographical locations and implement solutions in a fast-paced environment.Skills and Experience:• Minimum 2-3 years of experience in Machine Learning Engineering (AWS Sagemaker preferred)• Strong background in Linux and shell/bash scripting• Basic understanding of end-to-end Machine Learning pipelines (including the ML algorithms involved)• Experience in deploying Machine Learning models (Batch or Real time)• Experience troubleshooting and monitoring AWS environment and services• Understanding of data engineering tools and languages including SQL, Python, Red Shift & Glue will be added advantage• AWS certification will be added advantage• Great communication and collaboration skills.Internal life Maltem• A community of practitioners that you can contact anytime• Regular lunch and coffee catch-ups with our wider community• Team Building activities• Sports activities that can happen after work or during the weekend (voluntary-basis)• Work at our new offices where we have open space, free drinks, and plenty of other advantages• Possibility to work overseas for Maltem Group• Possibility to be part of advisory and greenfield projects• Possibility to be mentored or mentor someone during your journey with Maltem• We take care of each other, and our employees are at the heart of everything we do.We take care of each other, and our employees are at the heart of everything we do. We are community driven. By joining us, you will have access to a pool of passionate experts across data engineering, analytics, data science Change and Project Management.So, are you ready to join us"
Machine Learning AI Engineering Internship,NA,2023-01-30 12:10:59,https://www.google.com/search?q=Machine+Learning+Jobs+Australia&ibp=htl;jobs&sa=X&ved=2ahUKEwi9p8fG_-_8AhXbGDQIHYl9CL0QutcGKAF6BAgSEAU#htivrt=jobs&htidocid=tXVz1Jd9nA4AAAAAAAAAAA%3D%3D&fpstate=tldetail,Reesby IT,Full-time,NA,"Melbourne VIC, Australia","About the Data Scientist InternshipReesby are looking for a junior ML / AI Data Scientist who wants to learn how to analyze large amounts of raw information to find patterns and use them to optimize our performance.You will work with our team to learn to build data products to extract valuable business insights, analyze trends and help us make better decisions.We expect you to be highly analytical with a knack for analysis, math and statistics, and a passion for machine-learning and research.Critical thinking and problem-solving skills are also required.Data Scientist Internships will involve :Research and detect valuable data sources and automate collection processesPerform preprocessing of structured and unstructured dataReview large amounts of information to discover trends and patternsCreate predictive models and machine-learning algorithmsModify and combine different models through ensemble modelingOrganize and present information using data visualization... techniquesDevelop and suggest solutions and strategies to business challengesWork together with engineering and product development teamsData Scientist :Graduate Role, no experience necessary, remote opportunity availableDevelop Significant knowledge in data mining, machine-learning and operations researchGain experience using business intelligence tools (such as Tableau) and data frameworks (such as Hadoop)Gain knowledge of R, SQL and Python; familiarity with Scala, Java or C++ is an assetStrong math and analytical skills, with business acumenStrong communication and presentation skillsGood problem-solving abilities• BSc or BA degree in Computer Science, Engineering or other relevant area; graduate degree in Data Science or other quantitative field is preferred"
