Job-Title,Date-Posted,Date-Scraped,Url,Company,Job-Type,Salary,Location,Description
Machine Learning Tech Lead,2022-12-29,2023-01-11 18:15:31,https://www.google.com/search?q=Machine+Learning+Jobs+New+Zealand&ibp=htl;jobs&sa=X&ved=2ahUKEwjy6ofR7cD8AhWvIEQIHX1RBTQQutcGKAF6BAgSEAU#htivrt=jobs&htidocid=giKDJ7mBAZEAAAAAAAAAAA%3D%3D&fpstate=tldetail,Orion Health,Full-time,NA,"Auckland, New Zealand","Innovate with purpose Do you want to work for a company that is innovating and making a difference to the health and wellbeing of people all over the world Were not about selling meaningless, unnecessary products for corporate profitability. Youll be working on technology that will revolutionise global health systems so that we can finally get the healthcare we all want - a basic human right. We like to think of ourselves as a community of start ups where you can be your true, genuine self. Each of our product teams have the freedom to choose how they operate and contribute towards our mission of providing each person with the right care at the right time and in the right place. Orion Health is excited to be expanding our galaxy by recruiting for a number of stellar individuals to join our team to help us deliver to our global customer base. If you want to climb aboard the rocketship and help us revolutionise global health systems, astronomical opportunities await. What will... you be doing Were on the hunt for a Tech Lead within our Machine Learning team. You will join a cross-functional, agile development team who are leading ground-breaking research in machine learning, exploring meaningful ways to minimise waste, reduce operating costs and help clinicians make more accurate decisions at the point of care. As a Machine Learning Tech Lead you will:  Make crucial design decisions and guide software development  Play an integral part in shaping the technical direction of new products  Translate customer and business objectives into technical solutions through effective design and architecture  Engage with a range of external customers and Orion Health product teams  Lead hands-on development, delivering software through to production  Coach and mentor engineers and data scientists  Manage one direct report with the opportunity for team growth over time. What will you bring to the role  Experience: You have a minimum of 5-10 years commercial experience as a software developer, ideally with some being a Tech Lead, and working in cross-functional development teams.  Skills: You are proficient in Python and familiar with ML libraries/frameworks such as TensorFlow and PyTorch, modern data architecture, cloud computing and containers. NLP experience is a plus.  Characteristics: Youre passionate about keeping up with the latest technology, particularly in the world of machine learning. Product-oriented, you love solving real-world customer problems. Boasting a wealth of knowledge, you have a desire to share this to support the growth and development of a high-performing team. Whats in it for you  You'll use the latest languages and platforms and will be joining the ranks of the most talented and experienced tech workers in the industry.  Our relaxed, open plan offices have a vibrant and energetic atmosphere. We also have a casual dress-code so you will feel as comfortable in the office as you would at home.  Flexibility is important. We encourage our people to design a workday that suits them by offering flexible working arrangements.  Love food and coffee We provide free breakfast and fruit every day and have a barista coffee machine in the office - not to mention the onsite cafe discount!  With weekly Friday drinks and an active social club, Orionites are never short of good times and we pride ourselves on our fun community.  We support our Orionites keenness to learn and grow by providing unlimited access to LinkedIn Learning.  Summer Fridays! If this sounds like you, we would love to hear from you"
Data Scientist,2022-12-18,2023-01-11 18:15:31,https://www.google.com/search?q=Machine+Learning+Jobs+New+Zealand&ibp=htl;jobs&sa=X&ved=2ahUKEwjy6ofR7cD8AhWvIEQIHX1RBTQQutcGKAF6BAgSEAU#htivrt=jobs&htidocid=RLpXDFE8nwoAAAAAAAAAAA%3D%3D&fpstate=tldetail,Halter,Full-time,NA,"Auckland, New Zealand","At Halter, we're tackling the core issue of lifting production on farms for our growing population whilst decreasing emissions. We do this by turning real-world farming problems into software with the use of smart hardware, and a cloud-based system to more efficiently run these farms. Our world-first technology helps farmers break free from the time-intensive constraints of conventional farming and empowers a more sustainable future for farmers, their animals, and the land. Halter gives farmers the freedom to spend more time with their families, the technology to increase production and meet the growing demand for food, and the data to help them care for their animals. Founded in 2016, Halter has developed a revolutionary farm management system. We fit our solar-powered GPS-enabled smart collars to every cow on the farm. We then equip farmers with a simple app for managing their cows. This system enables farmers to remotely shift, virtually fence and proactively monitor their cows... health, feed and behaviour - all through their phones. Scaling rapidly onto farms across New Zealand, we have the privilege of working together with exceptional farmers including some of the largest farms in the country. We care deeply for our farmers and their animals, with our customers heavily involved in product development and animal welfare core to our culture. Our work is turning heads. In 2021, Halter won in two categories at the NZ Hi-Tech Awards. Our Board comprises tier 1 Silicon Valley investors who have backed the world's best technology companies such as SpaceX, Tesla, Airbnb and Spotify. Were also fortunate to have Rocket Lab CEO, Peter Beck, as an investor and Board member. We hire the world's best people and provide an epic environment for them to thrive in. Our culture is unique; we care about high performance, about each other, and we're passionate about making a difference for our customers. About the role Each day we process millions of points of telemetry data from animals across the country on our customer farms. Our rich datasets and deep industry knowledge allows us to build market-leading models that continuously monitor and predict animal behaviour. The insights we provide transform the way farmers manage the health and movement of their animals. We are looking for a data scientist who can build models to predict animal behaviour and extend the way we apply data science across all areas of the business. Were looking for people who are hungry to make an impact, are comfortable in a fast-paced environment, and love helping the people around them succeed. What your day could look like  Collaborating with data engineers, software developers and product managers to build models for behaviour classification, animal guidance, and pasture management  Building models, while considering risks, opportunities, and technical debt  Running experiments to explore areas where insights and predictions, powered by data science, could add value to our teams  Staying up to date with the state of the art in data science tools, techniques, models, and design best practices  Working as part of a cross-functional team, contributing to your teammates success, and encouraging collaboration and task sharing  And finally, as this is a start-up, youll be rolling up your sleeves and helping with whatever is required to succeed in our mission, knowing that the whole organisation is with you doing the same What were looking for  A solid track record working as a data scientist, with examples of outcomes youre proud to have delivered  A comprehensive understanding of the fundamentals and design systems behind building reliable, scalable and fit-for-purpose machine learning models and infrastructure  Strong experience in Python and familiarity with development in a backend tech stack  A strong understanding of data engineering best practices and AWS infrastructure  Experience working in agile development practice, in a cross-functional development team  Understanding of common development processes such as version control, continuous integration/delivery, code reviews, and pair programming  Someone who is product oriented and cares about customer experience, being able to solve real-life customer problems  Evidenced-based reasoning and decision-making and the ability to make trade-offs against real-world constraints  Someone that takes responsibility for their projects and delivers complete work Why our team loves working at Halter  A genuine and shared connection to our mission to make a difference in the world.  The excitement, risk, and reward of a high-growth technology scale-up.  The pride of joining an iconic New Zealand technology company growing successfully on the global stage.  The opportunity to work with and grow alongside a dynamic, and highly talented team with diverse backgrounds.  The opportunity to supercharge your career in a supportive and caring environment.  Our ideas are truly valued, we are able to move fast, and our impact is real.  State-of-the-art, dog-friendly office thats been thoughtfully designed right in the heart of Auckland city.  Delicious snacks and drinks are available for your daily flow.  Healthy body, healthy mind. Were partnered with Southern Cross to support your well-being.  We offer 6 months of fully paid parental leave for primary caregivers, 4 weeks of fully paid secondary caregiver and many other parental benefits that support you and your family.  Our personal growth is important. Halter offers an annual $1000 self-development budget to be used for anything that fuels personal growth.  Our time to recharge is valued, were offered wellness leave & unlimited paid annual leave.  Importantly, we offer a competitive remuneration package made up of salary, benefits and an employee stock ownership plan. Halter is committed to promoting a diverse and inclusive workplace  a place where we can each be ourselves and do the best work of our lives. Research shows that while men apply to jobs when they meet an average of 60% of the requirements, women and under-represented groups of candidates tend to only apply when they meet every requirement. If you think you have what it takes but dont necessarily tick every requirement on this job description, please still get in touch and apply to Halter. Wed love to chat to see if youll be an epic fit! If this opportunity sounds like you, please apply below by sending through your cover letter explaining why youre excited about this role and working at Halter, along with your CV, and well be in touch! Please also feel free to check out the careers and culture page for more information on working at Halter and don't forget to follow us on LinkedIn & Instagram"
Senior AI Engineer,NA,2023-01-11 18:15:32,https://www.google.com/search?q=Machine+Learning+Jobs+New+Zealand&ibp=htl;jobs&sa=X&ved=2ahUKEwjy6ofR7cD8AhWvIEQIHX1RBTQQutcGKAF6BAgSEAU#htivrt=jobs&htidocid=mnxRkMdOFIsAAAAAAAAAAA%3D%3D&fpstate=tldetail,Imagr,Full-time,NA,"Auckland, New Zealand","Senior AI Engineer Department: Engineering Employment Type: Permanent - Full Time Location: Auckland, New Zealand Reporting To: Konstantinos Raptis Description Who are we The team at Imagr is growing and it's an exciting time to join us! Imagr is leading the charge in automated retail technology with our end-to-end, AI powered checkout solution. Our goal is to revolutionise modern retail and make life easier for everyday people, with no checkouts and no queues. Things all of our Imagr team do Imagrs core values are really important to us, and speak to what we believe makes the experience with Imagr so unique. We use them to guide our behaviours, both within our team, and with the rest of the big wide world.  We make magic happen. We seek opportunities for extraordinary innovation in all that we do and challenge ourselves to be better today than we were yesterday.  We act as one. We play to each other's strengths, value the success of the team over the individual, celebrate... our differences and support each other to bring our whole selves to work.  We dont stand still. We move fast, empower our team to have impact and use the data we have to drive direction.  We are all shoppers. We live and breathe the opportunity our product has to make a global impact on our retailers and shoppers; thinking big, but scalable. Our core values help us to ensure that we are building a successful company that provides value to our customers and a great environment for our team. How does this role fit in Your role delivers impact by advancing the functionality of the focal point of our solution: The worlds most advanced, computer vision empowered shopping cart that delivers a frictionless experience for shoppers. You will play a critical role in building and refining this advanced vision system, overcoming challenging technical problems to maintain IMAGRs best in class offering. In this role you will be researching and applying a range of software, computer vision and machine learning techniques to enable low-friction solutions to optimize the shopping experience. We have a number of novel challenges in the domains of object detection, segmentation, classification, and model lifecycle and sustainability. What will your days look like  You will lead, mentor and work with the team to design, prototype, evaluate, optimize, implement and deploy CV/DL algorithms as an integral part of AI-powered retail technologies  You will translate product feature requirements to design inputs / specifications and come up with high-level algorithmic designs to meet requirements and guide design tradeoff decisions.  You will research and prototype state-of-the-art computer vision and deep learning methods to develop solutions that meet product requirements.  Develop creative computer vision solutions for our cutting edge AI powered product  Develop novel, performant solutions around topics like object detection, segmentation and classification  Apply machine learning to computer vision problems  Plan and execute cutting-edge research, ensuring that the company stays at the state of the art  Research and prototype techniques and algorithms for object detection, recognition, few shot learning, and open set recognition  Collaborate with HW and SW engineers to develop prototype solutions for future generations of our product The skills we're looking for  Masters Degree with 6+ years of relevant industry experience OR 4+ years of relevant industry experience with a PhD Degree  A postgraduate degree in the field of computer vision, machine learning or similar  3+ years experience with computer vision with deep learning. Specifically object detection, segmentation and classification  2+ years of experience engineering in Python  Experience with machine learning libraries such as PyTorch or TensorFlow  Expertise in machine learning, Bayesian filtering and information theory  An academic publication in CV/AI conferences/journals such as CVPR, ICCP, ICCV, NeurIPS  Experience in designing and training and deploying production-grade deep learning architectures for computer vision application with a broad understanding of latest CV / DL methods and literature  Experience working with edge-based / embedded computer vision algorithms Engineers at IMAGR:  Care deeply about helping the team to excel  Demonstrate empathy for both their users and their coworkers  Have a hunger for learning and growing  Take pride in your work, and demonstrate a passion for your craft  Take the initiative to improve our system, platform and ways of working  Have energy and enthusiasm for the work you do  Excellent communication skills, both written and verbal  Self-manage your tasks, time and the expectations you have set  Share your time and knowledge generously with others and work openly and collaboratively. What can you expect from us Not only do you get to work with a talented and passionate team on a groundbreaking product, but we'll also look after you. We can offer you a competitive salary, a comprehensive wellbeing programme that looks after your mental and physical health, shared lunch with the team on every Friday, and the opportunity to grow your career in a venture-backed tech company growing on an international scale. At Imagr, we celebrate unique backgrounds and experiences. While facing an exciting range of problems, we need a diverse team to solve them, so put your unique perspective forward and let's see where it takes us! If you're interested in this role, but feel you may not have the exact experience we're looking for, please still consider applying as we're keen to hear from curious, passionate people who are willing to learn"
Senior Machine Learning Engineer,NA,2023-01-11 18:15:32,https://www.google.com/search?q=Machine+Learning+Jobs+New+Zealand&ibp=htl;jobs&sa=X&ved=2ahUKEwjy6ofR7cD8AhWvIEQIHX1RBTQQutcGKAF6BAgSEAU#htivrt=jobs&htidocid=-5iUVppEHi4AAAAAAAAAAA%3D%3D&fpstate=tldetail,Cuusoo,Full-time,NA,New Zealand,"Were a passionate bunch of data lovers and are searching for Senior Machine Learning Engineers to help us grow our ML Capabilities across Australia and New Zealand. At Eliiza we guarantee you will work with other smart, passionate and supportive people to deliver high quality data science and ML outcomes to clients. Our projects and clients vary a lot - but heres a typical snapshot of what you could be doing:  selecting the best technology for a given data science use case  choosing the best operational architecture for an ML application  developing ML applications  applying MLOps principles to data science workflows, e.g. building reproducible training pipelines  standing up cloud services to run ML workloads  automating repeatable routines in ML workflows  architecting a machine learning system or platform  leading client projects  coaching junior team members If youre the right Senior Machine Learning Engineer for us, youll have:  an undergraduate degree in maths or... engineering  fundamental modern software engineering skills (can design and implement a well structured code base and software development cycle, including CI/CD, TDD, monitoring/logging)  solid programming skills in at least one language, such as Python  cloud engineering skills to architect, use and deploy cloud services in at least one cloud stack  an understanding of key machine learning and data science concepts across different areas  good grasp of concepts in machine learning development cycle & MLOps, such as model development, model deployment, data versioning etc.  exposure to one or more ML technologies and/or frameworks such as Amazon Sagemaker, Google AI Platform, AI API Services, and/or TensorFlow, Pytorch, Scikit-Learn etc, with demonstrable production experience  ability to search and evaluate the best tool for a range of different technical problems  MLOps skills to design, develop and deploy machine learning workflows and standard frameworks  system design skills to architect, develop and deploy a large-scale machine learning system or platform  ability to plan and oversee a machine learning project end-to-end with different phases  great consultant / client skills, and / or the ability to coach junior members in the team  a genuine passion for and connection to the data science and ML community Our team is made up of a range of people, with different experience across a huge range of data driven skill sets. We value a diversity of skill-sets, and dont necessarily require that youre skilled with all of the above (were aware theres a lot listed!). If you feel you don't fit all the experience/skills listed we still encourage you to apply or get in touch. Why join us  We know you wont have one job for life. Thats why were building a group of companies across Australia and New Zealand where we can support you to take on new skills and challenges. We want to help you develop in your role or diversify your career pathways via alternate brands.  We want each person to tailor their working conditions whether that be remotely every now and then, or on a permanent basis - we know how to actually do flexibility not just talk about it.  You will get to build your experience and fine tune your skills by working on projects right across Mantel Groups portfolio of clients regardless of where you are based.  Were a fast growing progressive company that centres its focus on a people first culture - did we mention we have just ranked #1 in the 2021 Australias Best Workplaces list!  You will help establish our destination hubs in New Zealand and influence and foster the development of its culture.  We hire smart people and get out of their way. By focusing on our five principles and not getting caught up in red tape, we trust you to get the job done.  Naturally, youll get all the tools you need - a new iPhone or Google phone, a new Macbook Pro or HP Elite, and a lot of branded swag! Who are we Glad you asked! We are Eliiza. Data science. Engineered for scale. We are a passionate team of data scientists and engineers who apply data science and machine learning to solve real-world problems. Our mission is to create a bright future for businesses and society in a world increasingly influenced by intelligent technologies. More about us Mantel Group is an Australian-owned, 'house of brands' company with eight technology businesses; DigIO, Eliiza, Kasna, CMD Solutions, Pretzel Lab, Azenix, Cuusoo & Itty Bitty Apps. Since our inception in 2017, we have grown to a team of over 550 people (aka Mantelorians!) across Australia & New Zealand and have just ranked #1 in the 2021 Australias Best Workplaces list! We've built a hybrid approach to remote working where you can spend time in any (or all!) of our awesome hubs providing a space for collaboration across Melbourne, Sydney, Brisbane, Perth & & Magnetic island, (Auckland & Queenstown - watch this space!) meaning you can choose a work model that works best for you! We don't have a head office, instead have opted for a distributed and diverse leadership team that extends across Australia and New Zealand. Were building both support and leadership roles in New Zealand which creates the opportunity for our people to grow, learn and accelerate career development through executing the Mantel Group NZ Strategy. Keen to chat Click Apply to share your details with our talent team, and well be in touch. In the meantime, check out how we hire to find out whats in store if youre successful and get to know us better by visiting our website and following Eliiza on LinkedIn. Cuusoo focuses on Big Data, Cloud Data Services, and Data. Their company has offices in Australia and New Zealand. They have a small team that's between 1-10 employees. You can view their website at https://www.cuusoo.com.au"
