Job-Title,Date-Posted,Date-Scraped,Url,Company,Job-Type,Salary,Location,Description
Machine Learning Engineer OBM/OBD,2023-01-16,2023-01-30 12:38:17,https://www.google.com/search?q=Machine+Learning+Jobs+Sweden&ibp=htl;jobs&sa=X&ved=2ahUKEwipr_3RhfD8AhUrIDQIHYtqBfQQutcGKAF6BAgOEAU#htivrt=jobs&htidocid=xrYvgzQM9lkAAAAAAAAAAA%3D%3D&fpstate=tldetail,Powertrain Engineering Sweden AB,Full-time,NA,"Gothenburg, Sweden","Join us on our journey to net zero. We are looking for a Machine Learning Engineer OBM/OBD to join our R&D team.

At Aurobay, we are re-imagining motion for a brighter tomorrow. That means challenging accepted beliefs and pushing the boundaries of what you've done before. But you won't have to do it alone. You'll be working alongside fantastic people who are caring and collaborative, with a global mindset, and a commitment to creating excellence.

Do you fit the profile?
As a Machine Learning Engineer, you'll be helping to shape the future of sustainable powertrain development. Our team currently consists of six data scientists, SW engineers, and model-based calibration engineers. We develop new methods for measurement data collection and analysis to help R&D become more efficient and data driven. We also work closely with other advanced engineering teams.

You will use the data we are collecting in our rigs to build models for predicting engine emissions of hazardous species. The... models can be used both offline in the development phase, and on the edge for On-Board Monitoring (OBM) and On-Board Diagnostics (OBD) in our customer vehicles. As part of this job, you'll have the opportunity develop your own machine-learning projects together with the rest of the team. We give our engineers the freedom and time for their own projects, to try out new ideas and fine-tune their skills.

You will also:

• Train and evaluate ML models for predicting emissions
• Work closely together with subject matter experts to align data/measurement requirements and incorporate physical models into the model
• Optimize algorithm memory and CPU load for predictions on the edge together with function developers

What we offer

Although we are proud of our heritage at Volvo Cars and Geely, this is a start-up environment, where you'll be helping to create the Aurobay of tomorrow. You'll get plenty of both formal and informal opportunities for learning and development. Joining Aurobay will give you a platform for personal and professional development, and a springboard for your future career.

What you'll get

We're passionate about sharing our success and making sure you're well rewarded, from pay and bonuses to the company pension. Our benefits are designed to improve your life at work and at home, with health and wellbeing support, life and travel insurance, and a timebank you can use to flex your work-life balance:

• Competitive salary
• Wellness contribution of up to SEK 5 000/year
• A personal and professional development scheme to support your growth.
• Want to drive a car? - Discount to buy a car, and a competitive leasing cost for a company car.
• Additional pension funding.
• Competitive additional and full-cover insurance.
• Other benefits through an industry-leading portal: health and wellness, bicycle, electronics, shopping, to name a few.

What you'll need

• A master's degree or higher in data science, mathematics, statistics, physics or relevant fields.
• Strong programming skills in Python, Julia, or MATLAB.
• Experience in ML algorithms such as linear regression, artificial neural networks, and boosted decision tree regression.

Nice to have experience in

• Time series modeling, especially ML algorithms that can be used for time series such as recurrent neural networks, convolutional neural networks, or transformers
• Internal Combustion Engines
• Chemical models for catalytic converters
• Embedded systems

We encourage diversity and believe that the different backgrounds, experiences, and perspectives our people bring make us stronger as a company.

Questions

If you have any additional questions regarding the position, you are welcome to contact recruiting manager Erik Fyrk, erik.fyrk@aurobay.com

For questions regarding the recruitment process please contact Recruiter Felicia Eriksson, felicia.eriksson@aurobay.com

Unionen: Ordf Joakim Dahlin, joakim.dahlin@volvocars.com, tel +46734630172

Ledarna: Ordf Håkan Modigh, hakan.modigh@volvocars.com, tel +46733333801

Akademikerna: Ordf. Henrik Simonsen, henrik.simonsen@aurobay.com, tel +46708219331

How to apply

Deadline to submit your application is 31st of January, but the selection process will be running continuously. Please note that due to GDPR, we do not accept applications via email.
Good luck with your application"
Postdoc in developing deep learning for satellite images,NA,2023-01-30 12:38:18,https://www.google.com/search?q=Machine+Learning+Jobs+Sweden&ibp=htl;jobs&sa=X&ved=2ahUKEwipr_3RhfD8AhUrIDQIHYtqBfQQutcGKAF6BAgOEAU#htivrt=jobs&htidocid=zw8EYxYD6oMAAAAAAAAAAA%3D%3D&fpstate=tldetail,Chalmers University of Technology (Chalmers),NA,NA,"Gothenburg, Sweden","This is a call for one postdoctoral position in the Data Science and AI division at the Department of Computer Science and Engineering, Chalmers University of Technology. The positions are situated within the research project Observatory of Poverty, situated in the AI and Global Development Lab (you will find more information about the Lab at www.global-lab.ai), funded by the Swedish Research Council (SRC). The Lab furthers the use of AI for Social Good for the sustainable development goals.Project descriptionAbout 900 million people—one-third in Africa—live in extreme poverty. Operating on the assumption that life in impoverished communities is fundamentally so different that it can trap people in cycles of deprivation (‘poverty traps’), major development agencies have deployed a stream of development projects to break these cycles (‘poverty targeting’). However, scholars are currently unable to answer questions such as in what capacity do poverty traps exist; to what extent do these... interventions release communities from such traps—as they are held back by a data challenges. This challenge is that there is a lack of geo-temporal poverty data, and thus, one of the goals of the Observatory of Poverty project is to develop new methods to produce such data. Thus, this is the main challenge that the postdoc is expected to contribute to.1.To train learning algorithms to estimate poverty from satellite images, of African communities over time and space, quarterly, from 1984 to 2020.2.To contribute to creating a statistical package—ObservatoryOfPoverty—that enables us, and other scholars, to produce poverty estimates for policy evaluation.Another goal of the Observatory of Poverty is to use our poverty estimates to identify to what extent African communities are trapped in poverty and explain how competing aid and development interventions alter these communities’ prospects to free themselves from deprivation. This goal is about causal inference. Thus, a secondary goal of the postdoc position is to facilitate the methodological development for causal inference for the project.In other words, we are searching for a candidate that is interested in either poverty estimation from satellite images or the causal inference part of the project, or both. Your interest should be clearly stated in your application and linked to your track-record.The candidate for the postdoc position will join the AI and Global Development Lab and is expected to produce research that contributes to the listed objectives or related spin-off objectives (e.g., based on the candidate’s research interest). Such spin-offs are welcomed, especially those that provide a new research angle to the listed objectives.As the project is highly interdisciplinary, we welcome applicants from a variety of disciplinary backgrounds, such as computational social science, statistics, computer science, mathematics, information technology, computer or electrical engineering, signal processing, physics or related fields, and experience in machine learning.We publish in top interdisciplinary generalist journals, discipline-specific journals, and conferences. We will adapt our publication strategy depending on the candidate’s background and interest.Regardless of background, to contribute to this research, the candidate should have experience in the following items:Excellent communication skills in written and spoken English.Excellent coding skills in Python, R, or equivalent languageExperience in using deep learning.Experience in image processing, preferably satellite imagesDesirable skills and experience are the following:Experience in remote sensing or earth observations (or willingness to learn)Experience in using Google Earth Engine (or willingness to learn)Research interest in causal inference (or willingness to learn) (see e.g., Imbens and Rubin, 2015, Causal Inference for Statistics, Social, and Biomedical Sciences, or Pearl, 2016, Causal Inference in Statistics).The candidate should have a proven track record in applying deep-learning methods with publications in peer-reviewed journals or conferences.Work environmentThe AI and Global Development Lab tend to meet weekly and remotely, with collaborators based in Sweden, the United States, India, Chile, United Kingdom.The project constitutes a collaboration mainly among the Department of Engineering and Computer Science, Chalmers University of Technology, the Departments of Political Science, University of Gothenburg, Institute for Analytical Sociology, Linköping University (campus Norrköping) and the Department of Statistics, Harvard University. This means that occasional travels within Sweden and between Sweden and the United States are expected.Leadership and mentorshipThe AI and Global Development Lab are headed by Adel Daoud, and will be the primary mentor for the candidate (more information is provided at www.adeldaoud.se. Daoud is a computational social scientist. He is a Senior Associate Professor at the Institute for Analytical Sociology, Linköping University, and an Affiliated Associate Professor in Data Science and Artificial Intelligence for the Social Sciences, Department of Computer Science and Engineering, Chalmers University of Technology, Gothenburg, Sweden. Previously he held positions at Harvard University, the University of Cambridge, and the Alan Turing Institute. The vision of the Lab is to “combine AI, earth observation, and socio-economic theories to analyze sustainable and human development globally.”The two secondary mentors will be Connor Jerzak at the University of Texas at Austin (www.connorjerzak.com), and Mohammad Kakooei, at DSAI. Other important collaborators to the projects and potential mentors are Fredrik Johansson (DSAI), Devdatt Dubhashi (DSAI), and Xiao-Li Meng (Harvard).Daoud, Jerzak, Kakooei, and others at the Lab are committed to providing high-quality mentorship for the candidate. For example, Daoud is the creator of a new podcast called the Journeys of Scholars. The Journeys of Scholars is a podcast with conversations about the trajectories, macro-micro strategies, habits, and advice of top-class academic performers.The candidate is encouraged to check out the YouTube playlist (provided here) and some of the recent interviews are the following:• Pursuing excellence. An interview with Professor Gary King, Harvard University. (Link to the show)• How to combine academia and entrepreneurship. Continuing the conversation with Prof. King at Harvard. (Link to the show)• Following your curiosity. Interview with Xiao-Li Meng, Professor of Statistics, Harvard University. (Link to the show)• Establishing your research program. An Interview with Prof. Stephen Raudenbush University of Chicago. (Link to the show)• Choosing your academic path. Interview with Professor Christopher Winship, Harvard University. (Link to the show)• Building excellent research environments. Interview with Professor Peter Hedström, Linköping University. (Link to the show)• Finding one’s path as a statistician or data scientist. An Interview with Prof. Jennifer Hill, New York University. (Link to the show)The applicationsApplications must be received by January 31st. Apply for the position by clicking the “Apply” button below. The application should include the following items.First, the candidate is expected to attach a working sample, proof preferably a publications in a peer-reviewed journal or at least a working-paper manuscript, demonstrating the flagship work of the candidate.Second, the candidate should include a prospective project plan (max 1000 words), describing how the candidate’s research background is suitable for tackling the project objectives stated previously. Alternatively, the candidate should describe what related spin-off objectives the candidate would like to pursue instead, based on the candidate’s research interest.Third, the application should include a short cover letter (max 400 words), addressing the candidate’s academic background, and how the position furthers the candidate’s future aspirations.Fourth, CV (Please name the document as: CV, Surname, Ref. number) CV, include complete list of publications. Previous teaching and pedagogical experiences and two references that we can contact.Fifth, attested copies of completed education, grades and other certificates.The application should be marked with Ref PROJECT_ID and written in English. The application should be sent electronically and be attached as PDF-files. Maximum size for each file is 40 MB. Please note that the system does not support Zip files.Working and living in SwedenSweden offers one of the most high-quality living standards in the world. It provides a great welfare system, with government-funded health care and education. This means that schooling and health care are virtually free, saving some minor costs. For a postdoc provides for more than compared to other postdoc salaries around the world.Major responsibilitiesThe main responsibility of the candidate will be to pursue research in the area of the position. The candidate will have the chance to work with the group members and collaborators at Chalmers and abroad, including the co-supervision of PhD students. The candidate is encouraged to supervise/teach up to 20% of their time.Contract termsFull-time temporary employment. The employment is limited (temporary) for 24 months with the possibility of extention with 12 months (contingent on funding and research performance).QualificationsApplicants must have a doctorate, PhD or equivalent degree, in a relevant field. The degree should generally not be older than three years, but exception can be made.To qualify, candidates must have experience in one or more of (1) deep learning, (2) causal inference (3) image data (preferably earth observations), (4) modeling geo-temporal data, as evidence by publications in appropriate venues. The position requires sound verbal and written communication skills in English. Swedish is not a requirementWe offerChalmers offers a cultivating and inspiring working environment in the coastal city of Gothenburg. Read more about working at Chalmers and our benefits for employees.Chalmers aims to actively improve our gender balance. We work broadly with equality projects, for example the GENIE Initiative on gender equality for excellence. Equality and diversity are substantial foundations in all activities at Chalmers.Application deadline: February 20 , 2023For questions, please contact:Adel Daoud, CSE DSAIE-mail: daoud@chalmers.se"
"Assistant Professor in Machine Learning, with specialisation in applications...",NA,2023-01-30 12:38:18,https://www.google.com/search?q=Machine+Learning+Jobs+Sweden&ibp=htl;jobs&sa=X&ved=2ahUKEwipr_3RhfD8AhUrIDQIHYtqBfQQutcGKAF6BAgOEAU#htivrt=jobs&htidocid=l_537jvrs4YAAAAAAAAAAA%3D%3D&fpstate=tldetail,Uppsala University,Full-time,NA,Sweden,"Assistant Professor in Machine Learning, with specialisation in applications

in life sciences

Published: 2022-12-13

Uppsala University is a comprehensive research-intensive university with a
strong international standing. Our ultimate goal is to conduct education and
research of the highest quality and relevance to make a long-term difference
in society. Our most important assets are all the individuals whose curiosity
and dedication make Uppsala University one of Sweden's most exciting
workplaces. Uppsala University has over 54,000 students, more than 7,500
employees and a turnover of around SEK 8 billion.

Uppsala University's tenure track system grants assistant professors the
possibility to be assessed for promotion to the position as associate
professor. The university provides support in various areas, such as
scientific and educational development, leadership development as well as
patent and innovation support.

The Department of Information Technology is situated in the... newly built
Ångström House 10, which contains a visualization studio, a social robot lab,
a maker space and 3D printing workshop. Researchers work in all areas of IT,
from designing processers, through HCI and cybersecurity, to cancer research
tools and methods from numerical analysis and machine learning. Active
researchers in Artificial Intelligence include Thomas Schön and David Sumpter
(machine learning); Ida-Maria Sintorn and Caroline Wählby (AI and image
analysis); Ginevra Castellano and Katie Winkle (social robotics); and
Matteo Magnani (data science and networks).

Uppsala University's has a long tradition of successful research – among its
alumni are 16 Nobel Prize laureates, including, most recently, Svante Pääbo.
The University is unique when it comes to combining IT with wider research,
from life sciences to the humanities, and this collaboration is currently
facilitated by AI4Research and the Centre for Interdisciplinary Mathematics.

The IT Department currently has about 300 employees, including 120 teachers
and 110 PhD students. More than 4000 students study one or more courses at the
department each year and teaching staff actively develop new approaches to
education.

The position is an important part of the new Beijer Laboratory for Artificial
Intelligence, which is a part of the universities ambition to grow its
activities within the subject of AI.

Read more about our benefits and what it is like to work at Uppsala University

Description of subject area of the employment
Research into data-driven methods in least one application area in the life
sciences. This includes applying and developing machine learning methods in
applications at molecular, cellular, population or ecosystem levels. Examples
of applications include topics ranging from precision medicine to evolution
and biodiversity, and data may come from sources such as patient records,
large-scale genetics, and images. The research should come from a technical
viewpoint, but be grounded in applications in life science.

Duties
• Teaching, research (between which the balance is initially 30/70
teaching/research) and administration and public communication.
• Build an active group around research specialisation. The position is
associated with funding for one PhD student and startup funds for travel
etc.
• Teaching duties include course responsibility and course administration
and supervision of second- and third-cycle students. We are looking, in
particular, for candidates who can teach courses in statistical machine
learning, neural networks, advanced probabilistic machine learning,
reinforcement learning and are interested in developing a new course in
the use of Machine Learning in the life sciences. Supervision of Masters
students is an important responsibility.
• Follow developments within the subject area and the development of society
in general that is important for the work at the university.

Appointment Period
The position can be held for a maximum of six years. An Assistant Professor
can apply for promotion to Associate Professor. If the Assistant Professor is
deemed suitable and fulfills the criteria for promotion established by the
Faculty Board he/she shall be promoted to and employed as Associate Professor.

Qualifications Required
• PhD in machine learning, statistics, computational biology, biostatistics,
engineering, mathematics or related area. Applicants who have obtained a
PhD degree or achieved the equivalent competence in five years or less
prior to the end of the application period will be given priority.
• Research Expertise and Teaching Expertise. It is necessary that the
pedagogical skills, the research expertise and the professional skills are
relevant to the content of the employment and the tasks that will be
included in the employment.
• Applicants should have completed teacher training of relevance to
operations at the University, comprising five weeks, or have acquired the
equivalent knowledge. If special circumstances apply, this training for
teachers in higher education may be completed during the first two years
of employment.
• Documented ability to teach in Swedish or English is a requirement unless
special reasons prevail.
• Personal capabilities necessary to carry out fully the duties of the
appointment.

Assessment Criteria/Ranking of applicants that fulfil the above-mentioned
qualifications required
The ranking of eligible applicants will be based primarily on research
and teaching expertise , of which weight will be primarily given to
research expertise.

Research Expertise comprises research merits as well as the applicant's
potential to contribute to the future development of both research and
teaching. In assessing research expertise research quality must be the prime
consideration. The scope of research, primarily in regard to depth and
breadth, must also be afforded consideration. A qualitative assessment will be
made of the research. In assessing research expertise special weight will be
attached to research merits in technical aspects of machine learning with
respect to the development and novel applications of data-driven methods in at
least one area of the life sciences. Examples of applications include, but are
not limited to topics ranging from precision medicine to evolution and
biodiversity, and data may come from sources such as patient records, large-
scale genetics, and images.

Teaching Expertise comprises educational and teaching qualifications. In
assessing teaching expertise teaching quality must be the prime consideration.
The scope of teaching experience, in terms of both breadth and depth, must
also be afforded consideration. In assessing teaching expertise special weight
will be attached to merits in teaching data-driven methods with life science
applications.

Collaboration Expertise is important and will be afforded consideration.
Collaborative expertise is demonstrated by the ability and skill of planning,
organizing and implementing interaction with the surrounding community.
Popular publications, public debate and lectures are examples of forms of
interaction with the surrounding community. Other examples of collaboration
are patent applications, commercialization and industrial cooperation. The
ability to translate knowledge sharing with the surrounding community into
activities of importance to the education's development and quality is part of
the collaboration expertise.

All merits must be documented in a manner that makes it possible to assess
both quality and scope.

In filling this position the university aims to appoint the applicant who,
following a qualitative holistic assessment of her/his competence and
expertise, is judged to have the best potential to carry out and develop the
relevant duties and to help advance operations.

Further information
In an overall assessment of the applicant's qualifications, parental leave,
part-time work relating to care of children, union assignments, military
service, or the like are to be regarded as work experience.

University appointment regulations

Faculty appointment regulations

Instructions for application

For further information about the position, please contact Associate
Professor Dave Zachariah (dave.zachariah@it.uu.se) or Professor Thomas Schön
(thomas.schon@it.uu.se).

About the employment : Temporary full-time position six years.
Individually negotiated salary.
Fulltime, 100%. Placement: Uppsala. Starting date: As soon as possible as
otherwise agreed.

Please submit your application by 7 February 2023, UFV-PA 2022/3955.

In the event of any disagreement between the English and the Swedish versions
of this announcement, the Swedish version takes precedence.

If you are an international candidate, you will find a lot of information
about working and living in Sweden at www. uu.se/joinus.

Please do not send offers of recruitment or advertising services.

Submit your application through Uppsala University's recruitment system.

Placement: Department of Information Technology

Type of employment: Full time , Permanent position

Pay: Fixed salary

Number of positions: 1

Working hours: 100%

Town: Uppsala

County: Uppsala län

Country: Sweden

Union representative: Seko Universitetsklubben seko@uadm.uu.se
ST/TCO tco@fackorg.uu.se
Saco-rådet saco@uadm.uu.se

Number of reference: UFV-PA 2022/3955

Last application date: 2023-02-07"
