Job-Title,Date-Posted,Date-Scraped,Url,Company,Job-Type,Salary,Location,Description
Machine Learning Engineer,NA,2023-01-30 12:38:01,https://www.google.com/search?q=Machine+Learning+Jobs+Sweden&ibp=htl;jobs&sa=X&ved=2ahUKEwipr_3RhfD8AhUrIDQIHYtqBfQQutcGKAF6BAgOEAU#htivrt=jobs&htidocid=PgQ5OMKn31oAAAAAAAAAAA%3D%3D&fpstate=tldetail,Viaplay Group,Full-time,NA,"Stockholm, Sweden","At Viaplay Group, we entertain millions of people every day through our streaming services, radio networks, TV channels and production studios. We believe in the power of content not just as a way of telling stories and touching lives, but also expanding worlds.

We may have started in the Nordics, but we have a global mindset and consider ourselves to be the international entertainment provider. This means we’re constantly launching our Viaplay streaming service in new markets and on the lookout for talented, curious, driven professionals to join us on our journey.

Right now, we’re searching for a Machine Learning Engineer to the Applied Machine Learning team in our Stockholm office.

The role

As a ML Engineer you will bring to life recommender systems and other intelligent services that personalize and enhance the experience on our video on demand (VOD) streaming service Viaplay. 

You will work in an empathic and supportive team with other Data Scientists and Machine Learning... Engineers who share knowledge and experience in researching and developing data products. You love seeing things go into production and love the idea of seeing on-point recommendations produced by algorithms. You enjoy prototyping new data applications and work with teammates to bring projects onto all parts of our streaming service. You believe that maintaining models is a must in the data product development lifecycle.

You will be able to use and develop your machine learning and engineering competence on massive amounts of data from Viaplay’s Data Lake, containing everything from customer and viewing behavior to every detail about our movie, television, and sports content. As a ML Engineer you will play a key role to move data products to production, making it easier for customers to find the content they love and make the streaming service more intelligent. You will also help maintain ML systems so that the personalized experience continues to be personalized.

Our technology stack offers great opportunities to showcase and develop your data science skills. You will work on AWS for computation and storage, using Python and Spark to breathe life to cloud-based data products.

What we’re looking for

We understand you may feel confident ticking certain boxes more than others and that’s why we always keep an open mind in our recruitment process. But, in order to thrive in this role, we do believe you’ll have at least some experience in the following:
• Strong communicator and listener.
• Affinity towards teaming up with other curious minds to tackle mathematical and engineering challenges.
• Academic degree in Statistics, Mathematics, Computer Science or equivalent.
• Have 2+ years working experience creating production-grade machine learning solutions for product problems.
• Solid understanding of various machine learning techniques, both theoretical and practical.
• High Competence in Python and SQL, transforming data with Spark is a plus.
• Knowledge of containerizing ML models in a cloud environment such as AWS.

Our offering
• We’ve got the basics covered! 30 days of paid vacation every year, flexible work arrangements and extra compensation on top of a parental pay lift.
• Your wellbeing matters. We have an attractive pension and insurance scheme with full health care coverage should you need it.
• A safe space to grow and up-skill with the freedom to try new things in autonomous teams. Our learning culture puts you in the driver’s seat of your own development, while always making sure you feel supported with regular knowledge-sharing sessions, technical training, mentorship opportunities and peer-to-peer networks.
• An innovative environment with Hack Days, not once, but twice a year. This week-long initiative allows you to think outside the box and deliver creative, technical solutions that (more often than not) go on to be implemented, either in our product or our ways of working.
• A genuinely international and diverse group of colleagues to connect with. We’re striving towards a 50:50 gender balance & we’re not far off – plus last time we checked, we have more than 60 different nationalities across our nine offices!
• Entertainment is what we love, and entertainment is what we do. So, unlimited access to Viaplay seems only fair for you to get to know the product – including live sports & pay per view events, new release movie rentals, linear channels and more.

Hit play today

If this feels like your kind of challenge, make sure you apply by attaching your CV here – you may also want to add your LinkedIn profile. Please don’t send us your application via email because we won’t be able to accept it. We do, however, welcome any questions you may have about this particular position.

Want to learn more about who we are and what we do? Check out our careers page or follow us on Instagram! We’re only ever a few clicks away"
Deep Learning Engineer,NA,2023-01-30 12:38:01,https://www.google.com/search?q=Machine+Learning+Jobs+Sweden&ibp=htl;jobs&sa=X&ved=2ahUKEwipr_3RhfD8AhUrIDQIHYtqBfQQutcGKAF6BAgOEAU#htivrt=jobs&htidocid=-6qz67fLjDwAAAAAAAAAAA%3D%3D&fpstate=tldetail,Teledyne Technologies,Full-time,NA,"Täby, Sweden","Be visionary

At Teledyne FLIR, we have a simple but ambitious mission: to develop market-leading thermal and sensing technologies which enhance everyday life. From saving energy, to saving lives Teledyne FLIR is making a real difference in our world.

Our products are used in a wide array of situations to rescue people in danger, detect criminals, conserve energy, navigate safely, provide security around the globe, and protect our environment.

We are looking for individuals who thrive on making an impact and want the excitement of being on a team that wins.

Job Description

Be Visionary

At FLIR, we have a simple but ambitious mission: to develop market-leading thermal and sensing technologies that enhance everyday life. From saving energy to saving lives, FLIR is making a real difference in our world.

Our products are used in a wide array of situations to rescue people in danger, detect criminals, conserve energy, navigate safely, provide security around the globe, and protect... our environment.

We are looking for individuals who thrive on making an impact and want the excitement of being on a team that wins.

Job Description

For our I ntelligent T ransportation S ystems (ITS) R&D team in Kortrijk (Belgium) (or Täby – Sweden) we are looking for a creative, passionate and hands-on Senior Machine Learning Engineer with a solid background in AI for object detection & classification solution on the edge. You will be part of a team that is responsible to design and learn convolutional neural networks for visual and infrared sensors for different businesses.

Responsibility
• Create more efficient object detection and classification models for different businesses
• In collaboration with other colleagues, develop and implement advanced algorithms on embedded camera’s
• Responsible to evaluate the performance of implemented algorithms
• Following the state of the art in the field of computer vision
• Documenting and share the knowledge along the international AI team

Candidate Profile
• You are passionate about Computer Vision, Image Processing , Artificial Intelligence and Machine Learning.
• You have a degree (master or PhD) in Computer Science, Applied Mathematics or other related field and/or specific training
• Experience with programming in C++ / python is a plus
• Experience with object-oriented design methodology and concepts is a plus
• Must be a results-oriented professional with solid organizational and time management skills

What FLIR offers you
• To be a part of a market leader company with a 50 years track record
• At FLIR, you get a unique opportunity to experience how cutting edge R&D, software- and hardware development come together under one roof. We do our own research, our own development, and our own manufacturing
• Permanent employment
• Friendly culture with a focus on collaboration, problem-solving and creativity
• Fair compensation structure and benefits

Interested?

If you liked what you just read, and believe you are the person that will make us better, do not hesitate to apply.

The selection process is ongoing, so don't wait. When applying, make it easy for yourself. Add a resume and fill out the required fields, no need to add anything else at this point. We accept applications in English.

Teledyne FLIR and all of our employees are committed to conducting business with the highest ethical standards. We require all employees to comply with all applicable laws, regulations, rules and regulatory orders. Our reputation for honesty, integrity and high ethics is as important to us as our reputation for making innovative sensing solutions.

Teledyne FLIR is an equal opportunity employer.

You may not realize it, but Teledyne enables many of the products and services you use every day .

Teledyne provides enabling technologies to sense, transmit and analyze information for industrial growth markets, including aerospace and defense, factory automation, air and water quality environmental monitoring, electronics design and development, oceanographic research, energy, medical imaging and pharmaceutical research"
Machine Learning Specialist,NA,2023-01-30 12:38:02,https://www.google.com/search?q=Machine+Learning+Jobs+Sweden&ibp=htl;jobs&sa=X&ved=2ahUKEwipr_3RhfD8AhUrIDQIHYtqBfQQutcGKAF6BAgOEAU#htivrt=jobs&htidocid=Tw_n9KrKPv0AAAAAAAAAAA%3D%3D&fpstate=tldetail,Eviture,Full-time,NA,"Stockholm, Sweden","We are seeking an experienced Machine Learning Specialist with experience of mathematics analysis for our client in Stockholm.

Key experience and qualifications required
• Strong communicator and listener
• Academic degree in Statistics, Mathematics, Computer Science or equivalent
• Working experience in creating production-grade machine learning solutions for product problems
• Solid understanding of various machine learning techniques, both theoretical and practical
• High Competence in Python and SQL, transforming data with Spark is a plus
• Knowledge of containerizing ML models in a cloud environment such as AWS

Language

Fluent English. Swedish is valuable but not compulsory.

Working arrangements

Start ASAP.

You must have an existing right to work in Sweden without sponsorship in order to apply.

]]>"
R&D Data Sciences & AI Graduate Programme - Sweden,NA,2023-01-30 12:38:02,https://www.google.com/search?q=Machine+Learning+Jobs+Sweden&ibp=htl;jobs&sa=X&ved=2ahUKEwipr_3RhfD8AhUrIDQIHYtqBfQQutcGKAF6BAgOEAU#htivrt=jobs&htidocid=s48ox0pL214AAAAAAAAAAA%3D%3D&fpstate=tldetail,50056739 - Scientist,Full-time,NA,"Mölndal, Sweden","R&D Data Sciences & AI Graduate Programme – Sweden

Locations: Gothenburg (Sweden)

Fuel your curiosity, feel valued and follow the science

If you have a quantitative science focused bachelor’s or master’s degree and a desire to explore and develop your skills in data science and artificial intelligence within a global biopharmaceutical organisation, our R&D Data Science & AI Graduate Programme could be the perfect start to your career. You’ll gain invaluable insight, exposure and opportunities across our diverse, Research and Development organisation. We’ll accelerate your learning and help you achieve your potential.

About AstraZeneca

AstraZeneca is a global, science-led, patient-focused biopharmaceutical company that focuses on the discovery, development and commercialisation of prescription medicines for some of the world’s most serious diseases.

Embrace the novel opportunity to work at a business that puts patients first. Working with data and an agile mindset in our... constantly changing business, we help uncover solutions that power the business to better harness the science and get it to market. It means we play our part in reaching patients in need and influencing outcomes.

What does the programme involve?

Starting in September 2023, the programme lasts two years, consisting of three individual eight month placements. Each placement will provide you with fantastic insights and experience in our use of machine learning, AI and data science to advance drug discovery and development.

The programme’s variety and flexibility provides you with opportunities to apply machine learning, AI, and data science techniques to help push our scientists push the boundaries of science to develop life changing medicines for patients worldwide. You could be contributing to detecting safety risks, designing novel molecules, optimising clinical trial design and processes, or developing new models for use in high profile drug discovery and development projects. As well as helping you broaden your industry and technical knowledge, we’ll help you develop professional skills required to fulfill your career potential.

You will gain an invaluable blend of on-the-job experience and training. You’ll enjoy guidance and advice from a huge support network, including a mentor and dedicated programme management team. We’ll also encourage you to identify and build collaborative relationships with specialists and leaders across our organisation, and our external networks including leading academic and biotech research institutions.

Together, we’ll help accelerate your development and knowledge!

Essential requirements
• Highly numerate with a strong quantitative science (e.g. Maths, Physics, Statistics or Computer Science) focused Bachelors or Masters level qualification gained in 2022 or due to be completed by September 2023
• Hands-on experience in Data Science, Artificial Intelligence, Machine Learning, Statistics, Computational Biology, Computational Chemistry, Bioinformatics or Cheminformatics
• Deep understanding of a few key machine learning or statistical models
• Considerable experience in Python or experience with multiple data-centric programming languages enabling Big data analysis
• Innovative thinking, with enthusiasm, energy and drive
• Open-minded, and ready to embrace new ideas and different perspectives
• Strong critical thinking, planning, organisational and time management skills
• Ability to work as part of a collaborative team
• Able to start employment in September 2023

Together, we push the boundaries of science to deliver life-changing medicines to patients around the world!

Where can I find out more?

Early careers at AstraZeneca

Our Social Media

Follow AstraZeneca on LinkedIn https://www.linkedin.com/company/1603/

Follow AstraZeneca on Facebook https://www.facebook.com/astrazenecacareers/

Follow AstraZeneca on Instagram https://www.instagram.com/astrazeneca_careers/?hl=en

What next?

After you submit your application, you will be asked to complete an online assessment (SHL). If shortlisted, you will then be invited to a full day virtual assessment day.

Our virtual assessment days will be held week commencing 17th April 2023

Advert Opens 06 December 2022

Advert closes 19 February 2023"
Lead Machine Learning Engineer,NA,2023-01-30 12:38:03,https://www.google.com/search?q=Machine+Learning+Jobs+Sweden&ibp=htl;jobs&sa=X&ved=2ahUKEwipr_3RhfD8AhUrIDQIHYtqBfQQutcGKAF6BAgOEAU#htivrt=jobs&htidocid=EUgUEqecXRoAAAAAAAAAAA%3D%3D&fpstate=tldetail,Pagos,Full-time,NA,Sweden,"About Us

At Pagos, we’re passionate about empowering businesses to take control of their payments stack and solve the puzzles standing between them and optimized growth. Our global platform provides developers, product teams, and payments leaders with both a deeper understanding of their payments data and access to new payments technology through user-friendly tools that are easy to implement. To succeed in this, we need creative thinkers who are willing to roll up their sleeves and start building alongside us.

About the Role

In this role, you’ll play a key part in building out the core foundation of machine learning at Pagos. We're looking for someone dedicated to continuously learning and staying aligned with developments in machine learning engineering and best practices. You'll have the opportunity to apply emerging innovations and solutions to provide best-in-class solutions to our clients.

As the Lead Machine Learning Engineer, you will:
• Design, build, and deploy models... that solve complex business problems
• Partner with engineers and product leaders across Pagos to build products that delight our customers
• Create ML models for real time solutions that allow companies to incorporate data-driven decisions into the payment stack to save money and grow revenue - including anomaly detection, recommendation, and prediction use cases

What We’re Looking For

We’re looking for someone with:
• 7+ years of professional experience as a Machine Learning Engineer and/or Data Scientist
• Strong experience with data analysis, feature exploration, ETL, and visualization
• Highly proficient with SQL, and has the ability to independently source data for projects and analysis
• Strong programming skills in Python, including exposure to the python ML ecosystem (Numpy, pandas, statsmodels, sklearn, TensorFlow/PyTorch, etc.)
• Experience with model versioning and lifecycle management (mlflow), version control (Git), job orchestration (e.g. Airflow), and artifact management such as PyPi (nice to have)
• Experience in deploying machine-learning models as scalable services
• Familiarity with parallel processing databases (Snowflake or Redshift, etc) and large-scale data processing and distributed systems (Spark or Dask, etc.)
• Proven experience shipping high quality, well-documented code

Nice to haves:
• Experience with data visualization tools, such as D3.js, GGplot, etc.
• Prior leadership experience, ownership of projects/products, and working collaboratively to carry those projects/products to production
• Prior experience with fintech, trading, transaction or payments data for optimization, fraud, recommendation, routing or tracking"
Systems Engineer to AI Sweden’s Data Factory,NA,2023-01-30 12:38:03,https://www.google.com/search?q=Machine+Learning+Jobs+Sweden&ibp=htl;jobs&sa=X&ved=2ahUKEwipr_3RhfD8AhUrIDQIHYtqBfQQutcGKAF6BAgOEAU#htivrt=jobs&htidocid=FwsFeCQfajMAAAAAAAAAAA%3D%3D&fpstate=tldetail,AI Sweden,Full-time,NA,"Gothenburg, Sweden","Artificial intelligence is transforming society. AI Sweden is the national center for applied artificial intelligence, jointly funded by the Swedish government and our partners, both public and private. Our mission is to accelerate the use of AI for the benefit of our society, our competitiveness, and everyone living in Sweden.

We are now looking for a Systems Engineer for our Data Factory.
About the Data Factory

AI Sweden’s Data Factory is a national resource that includes standard storage and compute facilities as well as world-leading test and experimentation facilities. These are intended as test beds to develop next generation training infrastructure for high-integrity, cost efficient development of AI models. Read more at ai.se/en/data-factory.

Currently, AI Sweden and its partners are expanding the capacity in all areas of the Data Factory to further speed up the ability to enable partners to train AI models, and to experiment, learn and develop solutions and... knowledge.
About the position

As a systems engineer you will participate in the implementation, operation, and maintenance of the Data Factory and its Test and Experimentation facilities.

Additionally, you will support AI Sweden’s partners and help them succeed with their experiments.

As your physical presence is often needed, you’ll be based in Gothenburg. If you’re moving to Sweden from another country, we will of course offer relocation assistance. Check out movetogothenburg.com to learn more about Gothenburg.
We believe that as a person you are
• a keen learner, curious, and able to suggest innovative ideas
• very comfortable with ever-evolving requirements and requests for novel arrangements that have never been done before
• keen to work in a dynamic environment and a rapidly growing organization
• excited to work with our partners and to help them succeed with their AI-related efforts
• comfortable with diverse teams that comprise people of many cultural and language backgrounds

Professionally you are
• interested in working in experimentation facilities and infrastructure with flexible multi-tenant and multi-purpose platforms.
• proficient with Linux and Ansible.
• a good communicator, both verbally and in writing. (English)
• knowledgeable about how Machine Learning models are trained and understand what this entails.
• and most likely you have a M.Sc. in Computer Science/Networks/Machine Learning (or similar) and 2-3 years working experience. Also, it’s an advantage to have experience from multi-tenant administration, network switch configuration, embedded environments and IoT devices, Virtual Machine Environments, and Core & Cloud management.

Why work for AI Sweden?

At AI Sweden, you’ll be part of a diverse and highly skilled team with inspiring colleagues all working with a higher purpose in mind than “just” tech. You'll be working alongside journalists, linguists, policy professionals, leading AI scientists, historians, entrepreneurs, change leaders, and many more.

As an organization, we're uniquely positioned at the sweet spot of governmental oomph and startup nimbleness. Small enough to stay adaptive and have fun but backed by and in close contact with both state and industry, both private and public.

And, we can most certainly be a platform helping you realize your ideas. Bring a good one, big or small, and we most likely will support and co-create with you.

In short, we like to believe we offer our staff a place to grow, an environment for personal development.

Listen to Johanna, Vinutha, and Martin to hear what they say about working at AI Sweden.
An equal and fair working environment

We strongly believe in diversity and inclusion and are acutely aware of the skewed gender balance in our industry. We actively strive to put together a diverse team in terms of age, gender, and background.

Naturally, we’re under a collective agreement (“kollektivavtal”) and offer everything that comes with it in terms of annual leave, pensions, wellness allowance (“friskvårdsbidrag”), and such.

AI Sweden does not accept unsolicited support and kindly ask not to be contacted by any advertisement agents, recruitment agencies or manning companies"
